id,created_at,text
1366704907185758208,2021-03-02 11:00:16+00:00,Sign up to our webinar on 16 March where we will discuss how to simplify occlusion and will cover practical tips on how to improve lateral and protrusive guidance. Register now. https://t.co/kpqJqT2F8W https://t.co/cFlg9jlxG0
1366373611997691912,2021-03-01 13:03:49+00:00,Represent your profession and be part of the future of the Faculty by standing for election to the FDS Board. Applications for the three available vacancies close on Friday 5 March 2021. https://t.co/DBThO5hgco https://t.co/cgt9h2xLNR
1366372530450292741,2021-03-01 12:59:31+00:00,"@WCLTFSusHealth Thank you for your message! We will not be covering environmental issues as the course focuses purely on clinical use of sedation however, this is something that we are considering to include for the future!"
1366343048809095170,2021-03-01 11:02:22+00:00,Our Dean @Matthew_RCSEng comments in @thetimes today about the effects of delayed dental care during the pandemic resulting in a surge of oral cancer cases being caught at a late stage https://t.co/GhMA00oAVi https://t.co/kJDCus9dm0
1365309137920270337,2021-02-26 14:33:59+00:00,"More than two thirds of children in England did not see an NHS dentist last year. Dental surgeons @FDS_RCS are warning the number of children admitted to hospital for tooth decay may rise, if access does not improve this year: https://t.co/aVY5IBk3Nf https://t.co/2mcjBj1mRz"
1365255545905635334,2021-02-26 11:01:02+00:00,"Would you like to transform your practice to make it more sustainable? Join the challenge &amp; find out more now. #GreenSurgeryChallenge
https://t.co/4qKD13kRrR https://t.co/ltUCnAyWiv"
1364968840522776585,2021-02-25 16:01:46+00:00,Learn about the best practice for conscious sedation in dentistry at our virtual course on 12 March and gain 5 CPD points. Book now to avoid disappointment. https://t.co/g7FxwEamIK https://t.co/lvxR7TR178
1364183369957994496,2021-02-23 12:00:35+00:00,"Something exciting has happened…our @FDS.RCS Facebook page is now live. Make sure to follow us for the most up-to-date information on courses, exam dates, blog posts and so much more. Head over now and click that follow button! https://t.co/DJvDb24q6U https://t.co/i9lli4P8HD"
1363805794337247232,2021-02-22 11:00:14+00:00,"Sign up for our webinar on 23 February at 6pm – Emerging techniques in facial and dental implant construction with Consultant Oral and Maxillofacial Surgeon, Mr Jag Dhanda.  https://t.co/NSKVE4aKWt https://t.co/yXoXhe2DB0"
1363775718795194369,2021-02-22 09:00:43+00:00,Tomorrow is the deadline to book your place on the new dental qualification replacing the MJDF. Book your place on the MFDS exam now and become a member of the FDS @RCSnews https://t.co/3dargAEMt7 https://t.co/A5pdpdMhf2
1362006392169709569,2021-02-17 11:50:03+00:00,Join our virtual course on conscious sedation for the dental team on 12 March. Don't let lockdown jeopardise your progression! https://t.co/kbsrjaXSuM https://t.co/4PTlzTUfVL
1361699425211584513,2021-02-16 15:30:16+00:00,Submit your questions ahead of tonight’s webinar and tune in to hear the panelists discuss the issues facing the dental profession as a consequence of the #COVID19 pandemic. https://t.co/f2D77NPW1H https://t.co/j4dFA6hnOY
1361653144762134528,2021-02-16 12:26:22+00:00,Limited spaces remain on the April MFDS exam. This new dental qualification has now replaced the #MJDF – book before 23 February to secure your place. #DentalExam #Dentistry https://t.co/ZjiXbwXvbx https://t.co/Tkuaa260jm
1360891708519690240,2021-02-14 10:00:42+00:00,"Happy #ValentinesDay! Did you know that when 5,500 adults were surveyed on what they found to be the most important factor in a partner, 60% of men &amp; 71% of women claimed they cared most about teeth! Does this mean dentists are the modern day cupid? https://t.co/QcMMnbMLo7"
1360242738193653761,2021-02-12 15:01:55+00:00,"‘Simple daily actions such as toothbrushing can amass overwhelming amounts of waste’. The January issue of the FDJ, discusses eco-friendly oral hygiene options. Read the article about how we can keep our teeth clean but not at the environment’s expense: https://t.co/yvW4ayjmca https://t.co/SZVvzeVEuE"
1359819651333685249,2021-02-11 11:00:43+00:00,"Vaccinations were a hot topic during our last joint faculty Q&amp;A, next week we’ll be answering more of your questions! Join us at 6pm on 16 February where hosts, including Mr Matthew Garrett, will discuss what testing &amp; vaccination means for dentistry . https://t.co/yTtaqCOByx https://t.co/Fmr96fUQdD"
1358717382294990851,2021-02-08 10:00:42+00:00,Register for our CBCT on 19 April! This one-day course is delivered by consultant dental maxillofacial radiologists &amp; can earn you 6 CPD points https://t.co/gfXnNdOTCE https://t.co/tOH91Q0Xct
1358007654942208007,2021-02-06 11:00:30+00:00,"Many of our members have trained as #vaccinators, been re-deployed to ICU or joined research teams on infection control since the #COVID19 pandemic. FDS Senior Vice Dean, Dr Pepe Shirlaw is pictured vaccinating specialty dentist colleague! We would love to hear your experiences! https://t.co/0JlNB39mcU"
1357378984074477571,2021-02-04 17:22:23+00:00,Would you like to find out more about the #GreenSurgeryChallenge? We have resources available to you so that you can help to improve the future of sustainability in surgery https://t.co/vA3fOMuY5y https://t.co/GIDqUtbIAT
1357358734343815172,2021-02-04 16:01:55+00:00,We are here to help! If you would like to be considered for FDS support with your Clinical Excellence Award application then email your completed ACCEA application forms to us before 10am tomorrow! https://t.co/hgpl3vExS7 https://t.co/hxBxU1Paga
1356914842624524290,2021-02-03 10:38:03+00:00,Will you be joining tonight's webinar? If you want to drive sustainable initiatives within the dental profession then find out how you can be a part of this exciting opportunity and sign up now! ♻️ https://t.co/rnYtMAdZXX
1355108555951661059,2021-01-29 11:00:31+00:00,"Would you like to receive support for your Clinical Excellence Awards application? For bronze, silver and gold awards please submit your completed ACCEA application forms to us at 10am on Friday 5 February. https://t.co/oFaFxw7qJi https://t.co/l93JDICqLe"
1354806787803779074,2021-01-28 15:01:23+00:00,Don't let lockdown jeopardise your progression. Join our virtual course on conscious sedation for the dental team on 12 March. https://t.co/KkjS7gumtJ https://t.co/6XQgDWl5NF
1351601415886659585,2021-01-19 18:44:23+00:00,LIVE: 'What advice would you give to an underexposed dental graduate?' @ruarikeir answers this question saying 'It is important that we as College's and education facilities  ensure that they have the support necessary &amp; offer a safe environment to gain experience &amp; confidence.'
1351594910206595072,2021-01-19 18:18:32+00:00,LIVE: Have you tuned into our webinar with the Deans of the Dental Faculties? Our hosts are answering your questions and as expected the #vaccine is a consistent theme in your questions! 💉It's not too late to join!
1351469625821851649,2021-01-19 10:00:42+00:00,"TONIGHT the Deans of the Dental Faculties will answer your questions &amp; discuss the impact of #COVID19 as part of our webinar at 6pm. This is one not to be missed! https://t.co/MJZT6G2OgV%
@RCSEd @facdentistry @rcpsglasgow https://t.co/nGziTmGgc4"
1351182925291728900,2021-01-18 15:01:27+00:00,Fellows and members are encouraged to apply for the Clinical Excellence Awards. They provide a fantastic opportunity to be rewarded for your hard work and commitment to the profession. Apply before Thursday 18 March. https://t.co/oFaFxw7qJi https://t.co/JcWLPag9v2
1350807602737917959,2021-01-17 14:10:03+00:00,"In the January issue of the FDJ, Nigel Knott discusses the crossroads that COVID-19 has created for dentistry, and how the profession may need to change. Join the conversation by reading the article here: https://t.co/8jjEqvk5eP https://t.co/Cn3ad8uvKU"
1350020004872413184,2021-01-15 10:00:25+00:00,Send in your questions for our upcoming webinar – #COVID19: current perspectives. The Deans of the Dental Faculties will be answering your questions and discussing what a third national lockdown means for the profession at 6pm on 19 January. https://t.co/9tW32wqZVe https://t.co/OM2Jcr05kp
1349672745223806977,2021-01-14 11:00:32+00:00,"Tell us what it takes to be a leader! Volunteer now and take part in focus groups to develop new learning material. These resources will be available for people at any stage of their career, as part of our Leadership Professional Passport. https://t.co/X8zuSNsGBU https://t.co/WfQX7r8JUd"
1348931066460041218,2021-01-12 09:53:22+00:00,A fantastic opportunity not to be missed! https://t.co/UltPDHQj3V
1348199159413805058,2021-01-10 09:25:02+00:00,"Did you know the application process for NHS #ClinicalExcellence Awards has been streamlined, making it easier than ever to apply? Be sure to put yourself forward by Thursday 18 March &amp; don't forget we are here to offer guidance &amp; support if you need it. https://t.co/XShFmIApGj"
1348034333265825794,2021-01-09 22:30:04+00:00,Improving children's oral health is something we have targeted in recent months. Our pump priming grant winner @LauraTimms10 along with @ShefDentistry @ProfHRodd &amp; @Prof_Hatton have produced this fantastic video by children for children. Spread the word! https://t.co/vm432KJmdn
1347578975841824774,2021-01-08 16:20:39+00:00,Dental teams supporting the NHS &amp; those working in private/mixed practices will be entitled to the #COVID19vaccine. This includes specialist practices &amp; clinical dental technicians registered with the CQC. Please update your details as soon as possible💉 https://t.co/50Re5pG6JF
1346834152511959044,2021-01-06 15:00:59+00:00,"More than 33,000 children had their teeth removed in hospital in 2020. Read the latest article from the @MailOnline. Our Dean, Matthew Garrett comments on the statistics &amp;  implications this will have on children's desires to visit dentists in the future. https://t.co/29zmUzVN8r"
1346773736960241664,2021-01-06 11:00:55+00:00,We have formed partnerships with a number of organisations including the British Orthodontic Society and the British Association of Oral Surgeons to offer you a variety of research fellowships. Apply before Friday 29 January 2021. https://t.co/VvLIShPd6O https://t.co/zx5uUrAUZ2
1343935121850830849,2020-12-29 15:01:16+00:00,Hannah Barrow and Alexander Gormley were both appointed this year as early careers representatives for the Faculty. They will be participating in discussions and decisions of the FDS Board. Congratulations and welcome to you both! https://t.co/VDRsQl5Iro https://t.co/e6Las98Z7G
1342409887666630659,2020-12-25 10:00:32+00:00,"Wishing all of our fellows, members and followers around the world a Merry Christmas and a Happy New Year, from the entire FDS team 🎄✨☃️ https://t.co/jKPMKA5ZIp"
1341715322064220161,2020-12-23 12:00:35+00:00,"Keep your practice safe and up to date by joining our one-day virtual course on conscious sedation for the dental team on 12 March 2021. Don't leave it too late, only a few spaces remain! https://t.co/UQBnfmpzK4 https://t.co/7A3YE1YpQF"
1341425520106418178,2020-12-22 16:49:01+00:00,"See, even Santa Claus takes dental hygiene seriously. Are you getting in the festive spirit? We'd love to see your photos! https://t.co/kDORapEEGq"
1340235522434854913,2020-12-19 10:00:23+00:00,"We are here for you. Our 24/7 helpline, CSAS offers you both support with your work and any personal, emotional stresses that you may have. Please do not hesitate to get in touch. https://t.co/toJzgR06O7 https://t.co/n4KoyVba9F"
1339208429932589057,2020-12-16 13:59:05+00:00,🤩 https://t.co/uoNU5dJtZV
1336256781870370816,2020-12-08 10:30:17+00:00,"Our webinar tonight illustrates the implementation of the new classification of periodontitis with some clinical cases. Tune in at 7pm and join Professor Iain Chapple, to discuss the strengths, weaknesses &amp; controversies over the last 18 months. https://t.co/k5ulzJbQF9 https://t.co/jaOCe3y23a"
1335917208321609729,2020-12-07 12:00:57+00:00,"If you are interested in pursuing research then this is one to watch! Professor Helen Rodd discusses her research fellowship at the FDS. Having a full year away from clinical practice, allowed her to make real progress &amp; go on to complete her PhD. https://t.co/z4o0Jytl6x"
1335199814527619075,2020-12-05 12:30:17+00:00,"Join our webinar chaired by Professor Iain Chapple, Professor of Periodontology and Consultant in Restorative Dentistry, on Tuesday 8 December! We will explain the philosophy behind the 2017 periodontal classification system and how it works in practice. https://t.co/gCrunW6NrK https://t.co/yG8qwJG3Uf"
1334519622255710211,2020-12-03 15:27:26+00:00,"Past FDS Dean, Kathryn Harley has recently been involved with a mentoring initiative for those wishing to consider a career in Dentistry ⬇️ https://t.co/E31lXe2OFZ"
1334104826272223233,2020-12-02 11:59:11+00:00,"@PHE_uk have published a toolkit on #oralhealth for adults in #carehomes to support care homes and commissioners to implement @NICEComms guidance.

It also contains useful links for care home staff, residents, their families and friends. 

Read it online: https://t.co/OHeCCP53FX https://t.co/hj0NTYD0dc"
1334102237702987776,2020-12-02 11:48:54+00:00,The FDS is delighted to see today's announcement by the Government on the mass roll out of the #Pfizervaccine https://t.co/Fu9vvDpnCw
1334090249438425092,2020-12-02 11:01:16+00:00,Applications are now open for the 2021 FDS Research Fellowships and Grants. We have formed partnerships with a number of oral &amp; dental organisations including @BOSbraces &amp; @bspduk to name a few! Take your research to the next level &amp; apply now: https://t.co/RBYYb1fynr https://t.co/gZciUL07P5
1333821500089131016,2020-12-01 17:13:21+00:00,"@PHE_uk have today published their online toolkit for adult oral health in care homes. Supporting care homes and commissioners to implement NICE guidelines, it also provides information for care home staff, residents, friends and family. View it online at: https://t.co/RWrplL5ZjG https://t.co/KEnS7NfbZd"
1333742907057197056,2020-12-01 12:01:03+00:00,If you are interested in broadening your understanding of the new periodontal classification system and how it works in practice then tune into our webinar on Tuesday 8 December! https://t.co/dfYdG4FZhz https://t.co/6lGaaM0355
1333727770883584001,2020-12-01 11:00:54+00:00,Rupal Shah joins the FDS Board as a trainee representative this year. She says the opportunity has given her a good insight into management and the issues arising within the profession. Find out more about Rupal and join us in welcoming her! https://t.co/PfYx1pvv52 https://t.co/vmKFeTLSje
1332640465062080512,2020-11-28 11:00:20+00:00,"Join us in welcoming Helen Rogers, your new trainee representative! Helen has already achieved so much and her ultimate goal is to become a Professor in Paediatric Dentistry. We look forward to seeing more of Helen over the next two years! https://t.co/md2LZP2qmi https://t.co/dRN2dP12k7"
1331923260032868354,2020-11-26 11:30:25+00:00,"📻 Junior Vice-Dean of the FDS, Professor Martyn Cobourne @martyn_cobourne featured on BBC radio Bristol @bbcrb last week. He explained the role palatine rugae (mouth roof ridges) play in the digestive process and in forensics.

Take a listen from 3h45 at: https://t.co/pGVRRIeTGu"
1330843896990076929,2020-11-23 12:01:25+00:00,"We have a number of fantastic oral &amp; dental research opportunities available to you. If you have a passion for research within your specialty then you could be granted a fellowship of up to £10,000. Does this sound of interest to you? Find out more: https://t.co/6k2Czfu0HC https://t.co/9aM6L5Ks3T"
1329766660081905664,2020-11-20 12:40:52+00:00,"FDS Dean, Matthew Garrett, said:
""Mouth cancer is often spotted in its early stages by dentists, and with early diagnosis, the chances of surviving mouth cancer are nine out of ten."" #MouthCancerActionMonth #MouthAware
https://t.co/Pbwwn10849"
1329100266663239683,2020-11-18 16:32:51+00:00,👀Check out the new online course from @fdiworlddental and @BSACandJAC on what dentists should do to tackle antibiotic resistance at https://t.co/3Mhy9V0qvo. It's for clinical &amp; non-clinical members of the dental team &amp; those dealing with patients presenting w. toothache/abscess. https://t.co/ugNNaBfdsG
1329094113615024128,2020-11-18 16:08:24+00:00,"It's World Antimicrobial Awareness Week 💊

The pandemic has presented challenges in managing patients with infections but we must all continue to reduce inappropriate antibiotic use to prevent the spread of drug-resistant infections.

Use the PHE toolkit: https://t.co/Q3whezaAdJ https://t.co/9skMkNoUdB"
1329016820871917569,2020-11-18 11:01:16+00:00,"If you want the chance to attend international conferences to present, discuss and celebrate your research, whilst meeting life-long collaborators along the way, then one of our FDS fellowships could be for you! Find out more now: https://t.co/hSwYe8WUXM https://t.co/K7SMXjFW8J"
1328613601813426176,2020-11-17 08:19:01+00:00,"Don't forget to join us at 6pm tonight to learn more about the benefits and pitfalls of CBCT in dental implants with consultant maxillofacial radiologist, Mr Jimmy Makdissi. This is just one in a series of webinars from the FDS! https://t.co/BQpEfZhEgV @BrennanSurgeon https://t.co/kaeZHVI0qF"
1328337617377783809,2020-11-16 14:02:21+00:00,"Monitoring your own health and wellbeing in these current times is so important. Janine Brooks, encourages dental surgeons to be kind to one another, discusses how to reduce patient anxiety &amp; gives guidance on how to build emotional resilience. Read more: https://t.co/0faq5iI36F https://t.co/5QduVWdpmc"
1326857514730876928,2020-11-12 12:00:57+00:00,‘Without the support of the FDS fellowship I don’t think I would have made it as a clinical academic.’ Being awarded an FDS fellowship meant Prof Helen Rodd was able to make great progress in her oral &amp; dental research. Apply for 2021 opportunities now: https://t.co/hcmK9rszhN https://t.co/PVZGnzgURC
1326840069341196293,2020-11-12 10:51:38+00:00,Encouraging to see the government pushing forward with its obesity strategy. We look forward to responding to the consultation to remove junk food ads online. https://t.co/Y2vRsoBNCU
1326480203032485888,2020-11-11 11:01:39+00:00,Did you know that if healthcare were a country it would be the 5th largest greenhouse gas emitter in the world? Sustainability was a hot topic in the recent #FSV2020 event. If you care about the environment then read about how dentistry can lead the way : https://t.co/J2aU76bhdZ https://t.co/YGfLYxwr68
1326199613238472707,2020-11-10 16:26:42+00:00,"Join Consultant Maxillofacial Radiologist, Mr Jimmy Makdissi, at 6pm on Tuesday 17 November to learn more about the benefits and the difficulties of CBCT in dental implants. Perfect for those new to dentistry, or those looking to refresh their knowledge https://t.co/JES5LBM3pE https://t.co/PyPBDn1GXG"
1323565815225032705,2020-11-03 10:00:55+00:00,'Not only is dentistry considered a highly stressful career but it is also perceived as more stressful than other occupations.’ Janine Brooks discusses how to cope with professional &amp; personal challenges during these uncertain times. Read the article: https://t.co/0faq5iI36F https://t.co/B3NSPB3HHN
1319235234907512837,2020-10-22 11:12:44+00:00,"The FDS Dean welcomes new guidance on infection prevention and control, saying ‘It provides clarity for dental professionals across the UK on how to manage the risks of COVID-19 effectively for staff and patients’ https://t.co/cfukFDqrRX"
1318492517881479168,2020-10-20 10:01:27+00:00,Last chance to sign up! Tonight join Professor of Endodontics @KingsCollegeLon Francesco Mannocci as he helps you to understand two important aspects in the treatment of endodontic diseases. This is not one to miss! Tune in at 6pm https://t.co/44Dea9j9hg https://t.co/VEaqBCbrps
1317103128639119361,2020-10-16 14:00:31+00:00,"Have you registered for our upcoming webinar on Tuesday 20 October? Professor Francesco Mannocci will cover two key aspects in the treatment of endodontic diseases, with plenty of time for questions! Don't miss out https://t.co/mVcJaH9uRp https://t.co/WFhfnq7oVW"
1316680401184751616,2020-10-15 10:00:45+00:00,"Join Francesco Mannocci, Professor of Endodontics @KingsCollegeLon, who will be kicking off our Autumn webinar series. Tune in to hear about the emerging trends and techniques in endodontics on Tuesday 20 October at 6pm. Sign up now! https://t.co/sfWA0ucyr9 https://t.co/KQ9FY6jsEB"
1316311548642627584,2020-10-14 09:35:03+00:00,"In our October FDJ, @smarshdentist and @KandiahThayalan investigate the benefits and limitations of virtual clinics in the delivery of paediatric dental care. Our members can read the full article here:  https://t.co/YtlKNqj82U https://t.co/QGAKNYyt2Z"
1315955574115307520,2020-10-13 10:00:32+00:00,"Happy National Hygiene month! Dental hygiene doesn’t deserve just a day of celebration, it deserves an entire month! 😬✨ https://t.co/72scEoZhVE"
1315639065732100096,2020-10-12 13:02:51+00:00,"Want to brush up on your management &amp; leadership skills? Sign up to our course on 6 February 2021 to build upon your existing knowledge of the NHS structure, policy &amp; management through a range of practical skills scenarios &amp; prepare for the ISFE exam. https://t.co/zRS5uoNVaQ https://t.co/Nz8GAMzUnX"
1314561269756723201,2020-10-09 13:40:04+00:00,A third of dentists in our recent survey did not know when they would fully resume services. Our report looks at barriers such as time needed to leave the treatment room empty and the lack of staff: https://t.co/RA8IMuZaw5 https://t.co/iCm4PJ89T9
1314536613742075905,2020-10-09 12:02:06+00:00,Register now! On 19 November our cone beam computed tomography course will be delivered by experienced consultant dental maxillofacial radiologists with the aim to help participants fulfil their legal &amp; ethical responsibilities in relation to CBCT. https://t.co/usjvaCzwkk https://t.co/XPCpKQcIBW
1313426366583406592,2020-10-06 10:30:22+00:00,Our survey shows a significant drop in the number of dentists who see more than ten patients per session. We set out ways to help services return to pre-pandemic levels in our latest report: https://t.co/gM2HykUjef https://t.co/v8F8lZvogK
1313109347191476225,2020-10-05 13:30:39+00:00,"Build upon your existing knowledge of NHS structure, policy and management through a broad range of practical skills scenarios to help you prepare for the ISFE exam. Sign up to this exciting course 6 February now! https://t.co/kBwg8aoVSA https://t.co/vgWeL0qOaX"
1313050057093120002,2020-10-05 09:35:03+00:00,"In the new issue of the FDJ, Rasaratnam et al share the procedures that were developed to cope with the challenge of re-establishing dental services following the peak of #COVID19. Read their protocols for patient and staff safety here:  https://t.co/mBTZiXMzfZ https://t.co/46fADneMn4"
1312337859509190656,2020-10-03 10:25:02+00:00,"The majority of dentists are unable to provide a full service this year due to #COVID19, our survey found. We’re calling on the government to remove barriers to full resumption of dental care: https://t.co/2VNHluKcrE https://t.co/flGBDVYYzF"
1311972472913367041,2020-10-02 10:13:07+00:00,"Out of more than 450 respondents, only half said they had adequate #PPE to do their job safely. Here’s what we’re calling to change in light of a #secondwave: https://t.co/WOPSv1lUjV https://t.co/BXlSE0oSW5"
1311971697315151874,2020-10-02 10:10:02+00:00,Results from our dental survey suggest that the lack of #PPE is preventing NHS dentists from doing their job safely and resuming care. Read our findings in the @Telegraph: https://t.co/YaNlkPgUSX
1311608067797155840,2020-10-01 10:05:06+00:00,"In the new issue of the FDJ, we look at how dentistry is adapting to #COVID19 as the new normal. Access the digital version now: https://t.co/RTH6uPMlI4 https://t.co/IosxwnJjIB"
1311591973967536130,2020-10-01 09:01:09+00:00,Our cone beam computed tomography course will be delivered by experienced consultant dental maxillofacial radiologists &amp; can be booked now! Follow the link to join us on 19 November: https://t.co/HTjS5XiooH https://t.co/2dHpfft04T
1309493907089227783,2020-09-25 14:04:11+00:00,We have today welcomed the publication by the SDCEP of a rapid review of the evidence related to the generation and mitigation of aerosols in dental practice and the associated risk of transmission of SARS-CoV-2. 💦https://t.co/RWgLb1k40g https://t.co/RNqBdm9D36
1308778842119704582,2020-09-23 14:42:46+00:00,"⌛️This SDCEP questionnaire on AGPs, to inform their rapid review, is only open until 12 midnight Thursday, 24 September 2020. Make sure you complete it today. https://t.co/KfLE95lq9V"
1306506529210802184,2020-09-17 08:13:24+00:00,"The Faculty are signatories to the below letter with the BDA, Mencap and others, calling on the health secretary to deal with waiting times for tooth extractions. https://t.co/TxXCc5DkBG"
1305823757324423168,2020-09-15 11:00:19+00:00,"Last chance to register for our ‘Meet the new Dean’ webinar tonight at 6pm. We will be joined by Simon Littlewood, Helen Rodd and Caroline Harvey as they interview Matthew Garrett and discuss plans for the new digital version of our MFDS membership exam.
https://t.co/wjTBaTjh5P https://t.co/9s8kVTjNJg"
