id,created_at,text
1477973243076173824,2022-01-03 12:00:55+00:00,"Would you like to be part of improving access to excellent oral care, particularly in low and middle-income countries? We are recruiting dental fellows and members for a brand new Global Oral Health Committee @RCSnews. Find out more and apply by 31 January https://t.co/17AZHRuDWt https://t.co/jv0SvKxtYe"
1476856918136143872,2021-12-31 10:05:02+00:00,"#Omicron has increased uncertainties for dentists and their teams, and added huge pressure onto the NHS. Ask your questions to @Matthew_RCSEng and the Deans of the Dental Faculties at our latest intercollegiate webinar on 25 January. Register today: https://t.co/wPQXTLybxn https://t.co/rZzpnZBxQ8"
1476523666313732098,2021-12-30 12:00:49+00:00,How can we improve the delivery of care in oral surgery? Join us on Wednesday 26 January to learn more about Managed Clinical Networks and the importance of improving data quality as part of a series of webinars we are hosting with @NHSGIRFT https://t.co/kk2fHrFTGl https://t.co/1ZLxjHANlf
1476134661189423107,2021-12-29 10:15:03+00:00,Learn about the implications of human factors on patient safety and much more on our Joint Paediatric-Orthodontic Course in collaboration with @bspduk and @BOSbraces. Limited spaces remain for our next session on Friday 21 January: https://t.co/l507P6zqYm https://t.co/BZ8JgQHK89
1474681457838858243,2021-12-25 10:00:32+00:00,"Dean @Matthew_RCSEng and FDS Registrar, Hazel, are shown here enjoying a socially distanced drink earlier this month to mark the end of another challenging year! Merry Christmas and Happy New Year to all of our fellows and members from everyone at the Faculty 🌟 https://t.co/z1xunVzc6L"
1473594279113248775,2021-12-22 10:00:28+00:00,"Find out how @NHSGIRFT's recommendations can lead to better quality data in restorative dentistry, helping to measure clinical outcomes, assure quality and support workforce planning in the first of our series of webinars on 19 January: https://t.co/pxBexDXCfo https://t.co/hiwg17ZAjt"
1473272805840064518,2021-12-21 12:43:03+00:00,"We’re excited to be hosting a series of webinars in early 2022 with @NHSGIRFT. Join us to learn more about restorative dentistry, oral surgery and improving service delivery and care for children: https://t.co/2dZJe2FRbx https://t.co/pFIriu57rr"
1468898413953568772,2021-12-09 11:00:47+00:00,Throwback to last month when the FDS Board met face to face for the first time since January 2020. We look forward to welcoming more members and fellows into our newly refurbished home in 2022! https://t.co/cgBOCW2eXm
1467826406650429441,2021-12-06 12:01:00+00:00,We are looking for a new National Specialty Advisor in Dental Public Health. Our Specialty Advisors work with the Faculty Regional Advisor to provide specialty-specific advice to local individuals and groups. Find out more and apply: https://t.co/VvVIMZpbqq https://t.co/nu1vRxLLKi
1466359398507462657,2021-12-02 10:51:38+00:00,"Chief Dental Officer, Sara Hurley, and National Lead for Dental Public Health, Anna Ireland, have issued an update to the dental profession with a special focus on mouth cancer prevention. Read the update online now: https://t.co/R3VkUQYGyp"
1466346559558270982,2021-12-02 10:00:37+00:00,Last chance to register for our virtual Core CPD course! Join us tomorrow to ensure you are up to date on all core subjects as set out by @GDC_UK. Covering everything from disinfection and decontamination to legal and ethical issues. Find out more: https://t.co/ucbI3FBPVg https://t.co/8D3A631C77
1465741127286288385,2021-11-30 17:54:51+00:00,There's still time to register for tomorrow night's @NHSEngland webinar on the latest IPC and SOP changes. Sara Hurley CDO will update dental care professionals on what the changes mean for the delivery of primary care dentistry from 7-8pm: https://t.co/cuX8t6B9Kd
1465636849259532294,2021-11-30 11:00:29+00:00,"Keep up with your professional development and join us virtually for our Core CPD course on 3 December. We will be covering a wide range of subjects, including; medical emergencies, radiography and radiation protection, and early detection of oral cancer. https://t.co/ucbI3FBPVg https://t.co/g0SonNOcqA"
1456597949119614977,2021-11-05 12:23:08+00:00,All staff working in the delivery of primary care services can access individual coaching with a skilled and experienced coach through the NHS' #LookingAfterYou offer. Access their new coaching on looking after your career today: https://t.co/fFzpZgOUmj https://t.co/jmqdaVjc9p
1456199694300950533,2021-11-04 10:00:36+00:00,"Don't forget! The deadline to apply for the Emerging Leaders programme is fast approaching. Develop your leadership style, build confidence and learn from colleagues and mentors. Eligible FDS members who are women should apply by Sunday 7 November. https://t.co/iUnA6daaAC https://t.co/zSTL4PStup"
1456184530944118788,2021-11-04 09:00:21+00:00,Happy #Diwali to all those celebrating today! We hope the festival of lights brings you happiness and prosperity. https://t.co/BSaOTHqWVP
1455097422326214662,2021-11-01 09:00:34+00:00,"Spend a year training in research! If you are a clinical trainee, you can apply for our Dental Research Fellowship and train in any area of oral or dental research. Find out more and start your application today: https://t.co/sKXI5ZJS8X https://t.co/mPLcrAeEVS"
1454411519840735237,2021-10-30 11:35:02+00:00,#HappyHalloween! Trick or treating needn’t spoil children’s teeth. Here are six tips from our Dean @Matthew_RCSEng on keeping teeth healthy: https://t.co/9vBWuPTCBJ https://t.co/94ESQZP0gg
1453315628350246924,2021-10-27 11:00:21+00:00,"It's #WorldSustainabilityDay! Did you know a single operating theatre can produce 814kg of CO2? That's why we are working to make surgery more sustainable, while still improving standards of clinical care. Because saving a patient shouldn't cost the earth: https://t.co/P7fX3exa7e https://t.co/fMEEiS2J8O"
1451465904856961024,2021-10-22 08:30:13+00:00,"The FDS Pump-Priming Grant Scheme is now accepting applications for a variety of grants of up to £10,000. Learn more about the available opportunities and eligibility and submit your application by Wednesday 27 October. https://t.co/zJmS3rbddQ https://t.co/rl0C1QIzmx"
1451141339559731200,2021-10-21 11:00:30+00:00,"Did you know October is National #DentalHygieneMonth? Thank you to the whole dental team for helping us maintain good oral health, which plays a huge role in both our physical and mental wellbeing. You keep our smiles bright! https://t.co/O4IUcTP4uE"
1449306658669223942,2021-10-16 09:30:08+00:00,"Together with @SAADuk, @bspduk, @BAOS_UK, @Gerodontology and more, we have developed a range of grants of up to £10,000 each. Learn more about the available opportunities and submit an application by 27 October. https://t.co/STPqu25V5W https://t.co/1HosPDFa48"
1448234605119692801,2021-10-13 10:30:11+00:00,"We have a range of pump-priming grants of up to £10,000 available to FDS fellows and members in a variety of fields. Find out more on the available opportunities and submit your application by 27 October. https://t.co/nkWrbFkb7F https://t.co/iMeNPTVIhj"
1446807979228078080,2021-10-09 12:01:17+00:00,"Find out how the MFDS is structured, where it can be taken and what the benefits of FDS membership include at our upcoming webinar on 12 October. We'll explain more about the new gold standard dental qualification and how it can support your future career: https://t.co/91tHebKWdh https://t.co/kJ4vKrB15v"
1446430300284887043,2021-10-08 11:00:31+00:00,Is teledentistry here to stay? Arya et al discuss the benefits and challenges of virtual  dental clinics in the latest issue of the FDJ. Read in full: https://t.co/LXUQ1rT4kE https://t.co/YonuadhnvZ
1445388870699339780,2021-10-05 14:02:15+00:00,"Together with a number of organisations, such as @BOSbraces,  @BAOS_UK, @Gerodontology and @bspduk, we have developed research fellowships and pump-priming grants for a variety of specialties. Find out more and apply: https://t.co/ToWnqIFnDU https://t.co/rSwUrPybAR"
1443966708130197506,2021-10-01 15:51:05+00:00,"Today is #WorldSmileDay! Your smile not only shows off your excellent oral health, it's good for your mental health too. What made you smile today? https://t.co/0NGEeWi8Hi"
1443855732269592577,2021-10-01 08:30:06+00:00,"In October’s issue of the FDJ, authors explore how the #COVID19 pandemic has affected dental students and trainees, and whether teledentistry is here to stay. Read the full issue here: https://t.co/PPfxy1COjS https://t.co/bGCDnYnfI1"
1443516227008221185,2021-09-30 10:01:02+00:00,"Join our webinar at 6pm on Tuesday 12 October to discuss the re-established gold standard exam, the MFDS. Find out why this exam plays an important part in marking progression in dental careers and register now! https://t.co/JBNa25K4UE https://t.co/4jF8hjK6xn"
1443138652100497408,2021-09-29 09:00:41+00:00,The Emerging Leaders programme is a fantastic opportunity to learn and grow in your career and prepare for future leadership opportunities. Eligible female FDS members are encouraged to apply for this unique programme by 24 October. https://t.co/Y20WNTVtoT https://t.co/SjZXknpng7
1442806530781421569,2021-09-28 11:00:57+00:00,"The basics of dento-alveolar CBCT interpretation (training at level 2) will develop your clinical skills to treat patients who need specialist care. Register for this one day, virtual course on 20 November now. https://t.co/2HveT32LPi https://t.co/Rze4dvUsj7"
1442399875216248839,2021-09-27 08:05:03+00:00,"Applications are open for our research fellowships and pump-priming grants. Whether you’re interested in paediatric dentistry or community oral health, there’s an opportunity available for you. Find out more: https://t.co/zHCYUeRtPP https://t.co/TTZQ8oSaSD"
1441432917905903618,2021-09-24 16:02:42+00:00,"If you're preparing for your management viva, or wanting to develop your ISFE management then sign up to this course where you will receive in-depth, individual feedback during the assessment. This course is delivered via Microsoft Teams. https://t.co/9PtGIbmOtK https://t.co/SUEl9fdu9t"
1440677938974785538,2021-09-22 14:02:41+00:00,".@TMitchellFRCS and @SueHillSurgeon share their experience of fundraising for @RCSnews Surgical Research Fund in a new blog. Read about the miles they covered, the challenges they faced and the support that they received! https://t.co/r38jS6ZpsH https://t.co/FzQgGToMaB"
1440241907880267776,2021-09-21 09:10:03+00:00,"‘I am proud the College is committed in ensuring that diversity, equality and inclusion are at the heart of all we do, and look forward to addressing the Action Plan,’ says @Matthew_RCSEng. Read more and discover our timeline of actions: https://t.co/2LiraiMPmS https://t.co/VALqYmgmox"
1439862076017684484,2021-09-20 08:00:44+00:00,"'Helping those on the way up at every stage should be the norm.' Our members have exclusive access to this special issue of the Bulletin, the first female professor of surgery, Averil Mansfield, reflects on her surgical career. https://t.co/tl3nIryt5M https://t.co/jWY6QUVQE8"
1439167432283787265,2021-09-18 10:00:28+00:00,Applications are now open for @RCSnews redeveloped Emerging Leaders programme. Gain confidence to apply for leadership roles within all areas of the healthcare sector. Eligible FDS members are encouraged to apply by 24 October. https://t.co/dZWVkCHaem https://t.co/Zs18ceML4i
1438094948549775362,2021-09-15 10:58:48+00:00,"Laura is one of our previous Emerging Leaders, representing the dental side she is #UnashamedlyAspirational and a fantastic leader within the industry! Apply for the fellowship now ✨ https://t.co/SY2kVtl2p0"
1437687791387828226,2021-09-14 08:00:55+00:00,"The MFDS qualification is accessible globally and has been redesigned to provide a modern, innovative and relevant assessment for today’s dentists keen on professional development. Join our webinar at 6pm on Tuesday 12 October to find out more. https://t.co/ljlJzlqtDX https://t.co/2nMd58bGTJ"
1436322415253106688,2021-09-10 13:35:24+00:00,"BTS! Our speakers @LauraGartshore and @VictoriaPegna engaging in a brilliant conversation about diluting imposter syndrome during their leadership workshop. They also have a special guest in the room, Professor Averil Mansfield! https://t.co/oFC5dpvP76"
1436318419029274642,2021-09-10 13:19:31+00:00,A fantastic talk about leadership at the @RCSnews WinS conference today from our member @LauraGartshore and Council member @VictoriaPegna. They talk about ‘choosing to challenge’ in the workplace &amp; their experiences as females in the healthcare industry.
1436253321371787265,2021-09-10 09:00:50+00:00,"Update your knowledge on 21st century peridontal and peri-implant disease classification and diagnosis, including  the management of failing implants, at this one-day course. https://t.co/yIA6xhTfFa https://t.co/xTSyUE9ykT"
1435543623337222154,2021-09-08 10:00:45+00:00,A process has been developed to facilitate applications to specialty training posts from individuals who haven't followed a standard training pathway. The process can be used by applicants for DCT3 posts if they have not already undertaken a DCT2 post. https://t.co/89lKn7pLx8 https://t.co/s4IKIhSe08
1434803709377142786,2021-09-06 09:00:36+00:00,Gain further experience of ISFE management vivas at this virtual course. We'll cover a series of vivas in a mock viva environment and will provide in-depth feedback for all participants. Sign up now. https://t.co/yGiM7BHLtW https://t.co/P2eLWFyXt7
1433701388681367599,2021-09-03 08:00:22+00:00,"Happy #GumCareMonth to all of our fellows, members and dental professionals! https://t.co/6ZVa7Y6qss"
1433369141281427459,2021-09-02 10:00:08+00:00,The IPC guidance has been amended so that fallow time is not considered necessary for successive appointments between members of the same household. Read more here: https://t.co/c2sLxIptR5
1433069648350748672,2021-09-01 14:10:03+00:00,"Do you want to find out about our newly re-established dental qualification, the MFDS? Join us at 6-7pm on Tuesday 12 October to find out why this gold standard qualification is relevant for today’s dental professionals career development. Sign up now. https://t.co/DL0zui3ZbX https://t.co/lfbnHidPhV"
1432629354106957830,2021-08-31 09:00:29+00:00,"Sara Hurley and Ed Waller provide an update on staff isolation guidance, health and wellbeing, support for asylum seekers and more in their latest dental and oral health update. https://t.co/p4ruHFKIiG"
1432357687375929350,2021-08-30 15:00:59+00:00,"The majority of dental surgeons are now able to provide routine treatment say members who took our recent survey. You can now read our report which outlines how recovery has progressed for dental services, one year on since the pandemic. https://t.co/MadTuXblve https://t.co/H1aKZZKDDt"
1431527018668171268,2021-08-28 08:00:12+00:00,Dental professionals can benefit from the inspirational sessions at this year’s Women in Surgery (WinS) conference. Learn more about developing your leadership style and overcoming career challenges at this virtual event on Friday 10 September. https://t.co/BtJ1DJYwgY https://t.co/VUPjluJC8Z
1431296453868142597,2021-08-27 16:44:01+00:00,Join us on Thursday 16 September to learn more about improving children's oral health. We'll explain the rationale for minimally invasive oral healthcare for children and describe commissioning models to encourage adoption in primary care. Register today. https://t.co/BiBeOhNhBo https://t.co/H5UsGmH73a
1430917155827195905,2021-08-26 15:36:49+00:00,"Catch our Dean @Matthew_RCSEng between 5pm-6.30pm tonight on @5_News as he discusses our new report which highlights waiting times, staff wellbeing &amp; the urgent need for more preventative measures for improving oral health since the #COVID19 pandemic."
1430885262792474625,2021-08-26 13:30:05+00:00,"Our report, A resumption of dental services – one year on, can be read now. Thanks to your help, we were able to understand the challenges that you are facing since #COVID19 &amp; have outlined 5 recommendations for the continued recovery of dental services. https://t.co/zUC6fvPRqq https://t.co/WNwyPP78i2"
1427547710811484164,2021-08-17 08:27:51+00:00,"Are you attending the mock Intercollegiate Specialty Fellowship Exam (ISFE) on 11 September? If not, sign up now and work through management vivas and gain in-depth feedback throughout at the virtual half-day. https://t.co/eJ2KH9mFF5 https://t.co/0KlnczTBRL"
1424656805511278593,2021-08-09 09:00:25+00:00,"Look after yourself and those around you. Check in with your colleagues, maintain physical health, and take advantage of mental health services like the CSAS helpline. https://t.co/pPErjjkMNG https://t.co/DcCaw70Rur"
1422905232552603650,2021-08-04 13:00:18+00:00,"Faculty members have a once in a lifetime opportunity to become part of our history in our newly refurbished headquarters, based at the home of @RCSnews. You can make a donation to the College and see your name on a recognition board alongside your peers. https://t.co/GbNVrzp2li https://t.co/v7SiDmTSPH"
1421425484471095301,2021-07-31 11:00:18+00:00,"Read @NHSEngland revised publication 'Avoidance of Doubt: provision of phased treatments', which takes into account the guidelines on prevention and treatment of periodontal disease, ensuring care is provided to those with the greatest need. https://t.co/htpJetWWDA"
1421032871993778183,2021-07-30 09:00:12+00:00,The best dental professionals never stop bettering themselves. That’s why we are setting a new gold standard for professional development in dentistry. Applications for our MFDS Part 2 examination close on 27 August 2021. https://t.co/r0WChuitCo https://t.co/K8m3IJu9Rk
1419930758655975438,2021-07-27 08:00:48+00:00,How has personal protective equipment developed and what challenges are yet to come? Kushnerev et al describe the evolution of PPE and the possible future developments in a new article for the FDJ: https://t.co/V7RTNXzVQw https://t.co/QYKZDyFo0l
1418903883070443528,2021-07-24 12:00:22+00:00,Last chance to help us help you. We need you to complete our survey ‘Resumption of dental services – one year on.’ Your responses will inform discussions with @Matthew_RCSEng and senior health leaders on the future of dental services. Please share. https://t.co/LXtKcELTfF https://t.co/YnvHpEPM5D
1417847005880242176,2021-07-21 14:00:43+00:00,You can now make a donation to the College and see your name on a new recognition board alongside your peers at our newly refurbished headquarters. This is a once in a lifetime opportunity for Faculty members to become part of our history. https://t.co/u3MHPd2Spd
1417394031944949781,2021-07-20 08:00:45+00:00,How does oral cancer present in younger patients? Thomson et al present their observations from the Hong Kong population in the July issue of the FDJ: https://t.co/LiDqkyviVQ https://t.co/adVIilarRx
1415944395031973888,2021-07-16 08:00:25+00:00,We need your help to complete our survey ‘resumption of dental services – one year on.’ Your responses will inform discussions with senior health leaders on the future of dental services. Please share with friends and colleagues. https://t.co/LXtKcELTfF @ProfHRodd @LauraTimms10 https://t.co/fykO7jN0FH
1415627249613774849,2021-07-15 11:00:12+00:00,"The best dental professionals never stop bettering themselves, so why not apply to take our gold standard exam? MFDS Part 2 is now open for applications 🥇 https://t.co/YtI2FTtsbt https://t.co/VdbbRnjvqY"
1414857290805653513,2021-07-13 08:00:39+00:00,"In the latest issue of the FDJ, Virdee et al explore the reasons why some NHS staff don't want to get the #COVID19 vaccine. Read the full article today: https://t.co/Yt8IzvTzoa https://t.co/Pgjae7PlbN"
1414570345844072449,2021-07-12 13:00:26+00:00,"We will embed the values of Collaboration, Respect and Excellence, from the @RCSnews five-year strategy, into everything we do – to help the entire dental team to achieve and maintain excellence in practice and patient care https://t.co/QMtiFzUfCS https://t.co/jZv04BYBvB"
1414510541943582725,2021-07-12 09:02:48+00:00,"The entire dental team can benefit from the incredible facilities at @RCSnews’ new #HomeOfSurgery. We’ll be running courses, exams and events from this beautiful space - and we look forward to welcoming our members back soon. #CareersInDentistry https://t.co/nhXaJ4jbBL"
1413815331160735749,2021-07-10 11:00:17+00:00,"In our recent blog, Chloé Rolland shares her advice for preparing for the MOrth exam, including how to showcase your treated cases &amp; how to discuss material properties &amp; consent topics during your OSCE. Read it now for specialty exam tips &amp; tricks https://t.co/MRX46hkFDd https://t.co/vi7EYGcnGc"
1413513486856904706,2021-07-09 15:00:51+00:00,Our members have a once in a lifetime opportunity to become part of our history. You can now make a donation to the College and see your name on a new Faculty recognition board alongside your peers in our newly refurbished headquarters. https://t.co/IPdPFL9mat
1413045313200340993,2021-07-08 08:00:30+00:00,How did the pandemic affect dental antibiotic prescriptions? Patel et al discuss in July’s issue of the FDJ. Available online now: https://t.co/7ZHn9eMjtW https://t.co/bFclIWlNyV
1412456439910707201,2021-07-06 17:00:32+00:00,LAST CHANCE! We urgently need dental professionals to complete our survey 'resumption of dental services – one year on'. Your responses will  inform discussions between @Matthew_RCSEng &amp; senior health leaders on the future of dental services.  https://t.co/dlO7dJUi3M https://t.co/uMpdgzfcgs
1412350659786125312,2021-07-06 10:00:12+00:00,"In July’s issue of the FDJ, we look at how #COVID19 affected antibiotic prescriptions and how NHS staff feel about the vaccine. Read the full issue online now: https://t.co/41GlIAkES4 https://t.co/jwS7ylPxIA"
1412048744166703104,2021-07-05 14:00:29+00:00,"FDS Registrar, Hazel, is joining the national outpouring of love for @NHSuk today and raising a mug for #NHSBigTea. Put the kettle on and raise a mug for our unique and wonderful NHS, which has just faced one of the most challenging years in its history ☕🎈 https://t.co/0AmoOQuXL2"
1411958062454292483,2021-07-05 08:00:09+00:00,"Happy Birthday @NHSuk Thank you to all those who have cared for our nation over the last 73 years – and to those who continue to provide the best oral care, despite the many challenges caused by COVID-19 #HappyBirthdayNHS 🎈7️⃣3️⃣ https://t.co/DuqtuqlToO"
1411686617253920768,2021-07-04 14:01:32+00:00,"The Chief Dental Officer for England, Sara Hurley, and Director for Primary Care, Ed Waller, have issued an update to the dental profession containing important information for the NHS dental community. Read it now: https://t.co/cgyP2oQeQv"
1411317563494174721,2021-07-03 13:35:02+00:00,Limited spaces remain for our Masterclass in Special Care Dentistry on Monday 5 July. If you're preparing for the diploma in special care dentistry examination then this is the course for you! https://t.co/nMM0fa6efO https://t.co/0oc21QeZqv
1411006860220567553,2021-07-02 17:00:25+00:00,"If you are a dental professional who has worked throughout the pandemic, we encourage you to share your experiences as part of our survey 'resumption of dental services – one year on'. Submit your responses before 4 July. https://t.co/YEimLiBMJq https://t.co/Ygdc20D7Wv"
1410910889151184899,2021-07-02 10:39:04+00:00,Join Dr Judith Jones if you are interested in a career in oral surgery. 'The most common pathway to become a specialist involves dental foundation training followed by dental core training with some of the time being spent in an oral surgery or OMFS unit.' https://t.co/dEe4AOcwMr
1410908624029896704,2021-07-02 10:30:04+00:00,Dental Public Health! Did you know that this specialty is concerned with the oral health of a population rather than individuals? 'As a small discipline we have influence on population health &amp; health services by working across organisations and systems.' https://t.co/PdSy1f1NAT
1410898550679126018,2021-07-02 09:50:02+00:00,"Prosthodontics is concerned with the functional &amp; aesthetic restoration of damaged teeth &amp; replacement of missing teeth. You can learn more about a career in this speciality now, join us. https://t.co/KLTyBV9045"
1410893523222732800,2021-07-02 09:30:03+00:00,"Join @MarkIdePerio at our Careers Conference as he takes you through specialty information, tips on how to succeed and talks about a day in the life of a periodontist! https://t.co/5iI3ZZIvxF"
1410892259009216512,2021-07-02 09:25:02+00:00,"Following on from restorative dentistry we have endodontics which is the speciality with a pursuit to prevent, diagnose and treat pulpal
and periradicular disease. Top tip: If you are interested in endodontics we recommend joining the British Endodontic
Society!"
1410883645875830789,2021-07-02 08:50:48+00:00,"Restorative dentistry has evolved in response to various factors, such as increased life expectancy, awareness and expectations of patients 🦷 https://t.co/gxuFY20ihE"
1410878369391128577,2021-07-02 08:29:50+00:00,‘It’s so much more than teeth!’ @ProfHRodd speaks about paediatric dentistry which is primarily the provision of specialist oral healthcare for children from birth up to 16-years! https://t.co/DSZnvYeOcD
1410873039265349633,2021-07-02 08:08:39+00:00,This mornings line-up at our FDS Careers Conference 2021. Do you see a speciality that you would like to hear more about? Join us! https://t.co/9zqoTskhgZ https://t.co/jlg28DJ378
