id,created_at,text
1270030706199199746,2020-06-08 16:31:31+00:00,"""Addressing health inequalities is a key strategic priority for the RCOG and we continue to urge the Government to tackle these across women's health as a matter of urgency"" - Dr Edward Morris, RCOG President. 

Read our response to the @NPEU_UKOSS study: https://t.co/IE9aazbpTu https://t.co/sED3d6HnLR"
1269909578139029504,2020-06-08 08:30:11+00:00,"As the pandemic continues, it is vital that you contact your GP with any gynaecological concerns like bleeding between periods, during sex or after the menopause. Although face-to-face appointments are limited, phone consultations are available. https://t.co/ibWZ9zheG3 @eveappeal https://t.co/UBI5CTtW4r"
1269902131827441671,2020-06-08 08:00:36+00:00,.@SandsUK have produced a brilliant campaign to ensure that healthcare professionals are trained and supported to care for families when a baby dies. Find out more: https://t.co/o2oXWljxoD #FindingTheWords https://t.co/wahMWLaFYO
1269574585659412481,2020-06-07 10:19:03+00:00,"From antenatal care to gynaecological oncology, there are over 90 core knowledge eTutorials available for free for a limited time only. Find out more: https://t.co/XHBV77rFbi https://t.co/T8a9gkPZVb"
1269268315626778626,2020-06-06 14:02:02+00:00,"The incidence of stroke in young and middle-aged adults is increasing, with pregnancy-related strokes affecting up to 30 women per 100,000 pregnancies. This infographic offers an overview of the clinical presentation, aetiology and much more: https://t.co/ZWCbHFweGD https://t.co/J6RKkzi6D2"
1268604948234846208,2020-06-04 18:06:03+00:00,"Register today for our new MRCOG Part 1 interactive revision course, designed to increase your confidence around the various types and formats of the exam questions. 
Find out more: https://t.co/42sBjGet33 https://t.co/Wp7xvDNHDE"
1268584427946459137,2020-06-04 16:44:31+00:00,"Parliament will soon vote on regulations which will establish a framework for abortion care in Northern Ireland for the first time.

We encourage all MPs and Peers to vote Aye and end the violation of human rights and #TrustWomen. Read our briefing below 👇#TheNorthIsNow https://t.co/UaSckzZivi"
1268570316336508929,2020-06-04 15:48:26+00:00,"Pregnant women with suspected or confirmed #coronavirus should seek care if they develop more severe symptoms or if they are taking a longer time than usual to recover, by contacting their maternity unit or dialling NHS 111. Read more advice below 👇https://t.co/bV3RX5o0h8"
1268569338119938048,2020-06-04 15:44:33+00:00,"If you are pregnant, and from a BAME background, your maternity team may book you additional appointments, or refer you to a doctor or specialist clinic should there be any concerns about your health or your baby’s."
1268568920543449092,2020-06-04 15:42:54+00:00,"In response to this study, the RCOG national clinical guidance for health professionals and advice for pregnant women were updated. 

Health professionals are being advised that women with a higher risk should be told at each contact that they may be at risk of complications."
1268567333905281024,2020-06-04 15:36:35+00:00,"A recent study from @NPEU_UKOSS confirmed that pregnant women from a BAME background are more likely than other women to be admitted to hospital for coronavirus. Read more on the link below ⬇️
https://t.co/IE9aazbpTu"
1268564038381899777,2020-06-04 15:23:30+00:00,"**New video!**

Advice for pregnant women from a Black, Asian or other ethnic minority background🤰🏿

Watch Dr Christine Ekechi, RCOG spokesperson on racial equality, talk about what women should know during the #coronavirus pandemic 👇 #covidmaternity https://t.co/KrJaHGKdsu"
1268556975601848320,2020-06-04 14:55:26+00:00,"We continue to call on the Government to urgently determine why this shocking variation exists, and to implement measures to reduce these unacceptable disparities without delay. 

Read our policy statement on racial disparities in women’s healthcare 👇
https://t.co/VHp6FrBhH7 5/5"
1268556519907475463,2020-06-04 14:53:37+00:00,"What we do know is that people from BAME communities are likely to be at increased risk of #COVID19 due to social and economic factors. Also, BAME people are likely to be at greater risk of poorer outcomes due to health conditions, such as diabetes and cardiovascular disease 4/5"
1268556338050805763,2020-06-04 14:52:54+00:00,"It's still unknown why #COVID19 affects people from a BAME background, as these latest analyses did not consider the effect of occupation, pre-existing health conditions or obesity among other factors 3/5"
1268556099680075778,2020-06-04 14:51:57+00:00,"These shocking statistics confirm what we already know: #COVID19 disproportionately affects people from a Black, Asian or other ethnic minority background. It's extremely concerning that #covid19 has reinforced existing health inequalities. In some cases, these have increased 2/5"
1268555820272357379,2020-06-04 14:50:50+00:00,"[THREAD] 👇 1/5
We welcome the publication of the Government commissioned @PHE_UK review into the disparities in risks and outcomes of #coronavirus.
https://t.co/T6M9TqToyH"
1268530135575166979,2020-06-04 13:08:47+00:00,"*New updates to our #coronavirus infection and pregnancy guidance*

Latest information for health professionals: https://t.co/9erdrdzC60

Q&amp;As for pregnant women &amp; their families: https://t.co/bQIvXPm9in

 #covidmaternity  

@MidwivesRCM @RCPCHtweets @RCPCHtweets @PHE_uk https://t.co/856WSgejVv"
1268452442284478464,2020-06-04 08:00:03+00:00,"The current postponement of cervical screening in many areas of the UK is to prevent transmission of the #coronavirus. If you are worried about the postponement, please contact @JoTrust: https://t.co/AKypEe5BUT https://t.co/DtVdzix5dk"
1268227333141528577,2020-06-03 17:05:33+00:00,"We have also updated our information for anyone seeking an abortion. This covers:

✅The impact of #COVID19 on accessing care
✅How to contact an abortion care provider
✅How you may be eligible for care without needing to leave your own home

Read more 👇 https://t.co/UbvYghBitR"
1268226682315571203,2020-06-03 17:02:58+00:00,"📢Updated guidance on abortion care📢

Since the approval of home use for both abortion drugs, we have seen:

▶️Higher demand for this essential service
▶️Decline in the average gestational age of women having treatment
▶️Waiting times reduced

Read more: https://t.co/0IQ4ixDfWp https://t.co/Kbho1mgn6V"
1268162642088275969,2020-06-03 12:48:29+00:00,"We support the fantastic #FindingTheWords campaign from @SandsUK. This aims to ensure that healthcare professionals can access support, advice and training to equip them with the confidence and skills to care for families when a baby dies. Learn more: https://t.co/oYmuySbebo https://t.co/tbrbJljZLB"
1267778049577279490,2020-06-02 11:20:15+00:00,"The Government must take steps to tackle these health inequalities as a matter of urgency. Read our statement below 👇 3/3 
https://t.co/IE9aazbpTu"
1267777936515567616,2020-06-02 11:19:48+00:00,Over half of pregnant women admitted to hospital with #coronavirus were from a #BAME background -  this further deepens our concerns around the persisting vulnerabilities of this particular group of women🤰🏾#covidmaternity 2/3
1267777374738944000,2020-06-02 11:17:34+00:00,"[THREAD] 1/3 👇

We are disappointed that the Government has delayed its report into how factors such as ethnicity, deprivation, age, gender and obesity impact how people are affected by #COVID19. 

Now more than ever we need to understand why these inequalities exist."
1267742827494195201,2020-06-02 09:00:18+00:00,Have you experienced issues accessing contraception during #covid19? The Cross-Party Group on Sexual and Reproductive Health has reopened its inquiry into contraception access. Submit your thoughts: https://t.co/CY54aK3xsr @FSRH_UK https://t.co/o93gk0fYbE
1267727816868737026,2020-06-02 08:00:39+00:00,"Cervical screening may be postponed in much of the UK, but help is still available if you have any new or troubling gynaecological symptoms, such as bleeding between periods or after sex. Contact your GP or gynaecologist with any concerns. Read: https://t.co/BiN07rZcCk @JoTrust https://t.co/yjsrRx6uHq"
1267381375671439360,2020-06-01 09:04:01+00:00,"You can learn more about the College’s patient and public involvement work, including the RCOG Women’s Voices panel and Women’s Network on our website: https://t.co/QiuMXzxj3h #RCOGWomensNetwork"
1267381237930496000,2020-06-01 09:03:28+00:00,"The RCOG Women’s Voices Lead is an honorary lay role with responsibility for leading the College’s Women’s Network, Voices Panel and influencing the College’s patient and public involvement agenda; ensuring women’s views and experiences are front and centre of our work"
1267380840591474688,2020-06-01 09:01:53+00:00,Today our next RCOG Women’s Voices Lead @ShaistaGohir begins her three year term and we’re so excited for her to get started in this very important role at the College. Hit play below to listen to Shaista talk about what she hopes to bring to the role #RCOGWomensNetwork https://t.co/FS4EmgFZTh
1267365319879909376,2020-06-01 08:00:13+00:00,Have you had your cervical screening appointment cancelled or postponed and are wondering what to do? We’ve created a short video with @JoTrust outlining the current situation and where to find help. Learn more: https://t.co/oQzLqmOQsV #covid19 #coronavirus https://t.co/yYGRYNhGHn
1266971803664121856,2020-05-31 05:56:31+00:00,@GallyHJ @suelovell22 @nicki_abbott @susiecalder @IdiagheRosemary @TeamMidwife We hope to move to a mid-week publishing schedule from next week 👍
1266404611121991681,2020-05-29 16:22:42+00:00,"This has been published in a new section of our #coronavirus, pregnancy and #womenshealth webpages and includes resources to assist in the restoration of O&amp;G services following the #COVID19 pandemic #covidmaternity https://t.co/ZXKMFYnsj1"
1266404299195781120,2020-05-29 16:21:28+00:00,"Version 2 of our Restoration and Recovery: Priorities for O&amp;G Framework has been published today. 

Changes can be found in the summary of updates on pages 3-4 👇https://t.co/xGQmyN8B2A"
1266389763440984064,2020-05-29 15:23:42+00:00,"This framework is intended to be adapted according to local testing capacity and disease prevalence, and it will be updated as national guidance evolves. Feedback is welcomed via covid-19@rcog.org.uk 👍"
1266389616548085762,2020-05-29 15:23:07+00:00,✅Women who have an elective caesarean birth or induction of labour planned may be asked to follow a period of self-isolation and offered a test for coronavirus prior to admission. Read more in our Q&amp;A 👇https://t.co/Wf9qCv8EKr
1266389525267349505,2020-05-29 15:22:45+00:00,"✅All women who are admitted to hospital for maternity care should be offered a test for coronavirus, regardless of whether they have symptoms or not."
1266389285562920961,2020-05-29 15:21:48+00:00,"Principles for testing and triaging women receiving maternity care in hospital settings have been published today: https://t.co/1TXn9edbG6
#covidmaternity #coronavirus https://t.co/OzvoJF8aGO"
1265916009740939266,2020-05-28 08:01:10+00:00,Mental health issues during pregnancy are common and affect up to 1 in 5 pregnant women. Women in England can self-refer to local Improving Access to Psychological Therapies (IAPT) services. Further information and resources can be found here: https://t.co/4OdaTEnE8z https://t.co/LD1EDaBs0z
1265581807967354880,2020-05-27 09:53:11+00:00,"@Catt2211 We completely understand this restriction may be upsetting for women and their partners, but please be assured these measures are in place to protect healthcare staff, and other women, their babies and families, from risk of infection during this pandemic. 2/2"
1265581709204041729,2020-05-27 09:52:47+00:00,"@Catt2211 Hi Cat, we are aware of restrictions on partners attending scans in most hospitals and units, and sadly we do not have any information on when these are likely to be lifted at this stage. 1/2"
1265190948897804288,2020-05-26 08:00:02+00:00,"You should be asked about your mental health during every contact with a healthcare professional. By sharing any of the difficulties you are experiencing, healthcare professionals can help to support your wellbeing. Find out more: https://t.co/WFhoXX9hwD #covidmaternity https://t.co/BXYDJ2M8Gq"
1264874043993448449,2020-05-25 11:00:46+00:00,Today is the last day to submit your application to join our Board of Trustees! This position is of paramount importance to the College’s core strategic aim – the pursuit of excellence in women’s healthcare. Apply here: https://t.co/1DsrIzg1XR https://t.co/UgZK3SZBJS
1264828594909597697,2020-05-25 08:00:11+00:00,"We know that the #coronavirus pandemic will result in increased anxiety for everyone, and this is likely to be even more so for pregnant women. It is important to be aware of the services and resources available to support you during this time. Read more: https://t.co/7D8e05ljyX https://t.co/dARh84kQ69"
1264538529499090944,2020-05-24 12:47:34+00:00,"In the latest issue of TOG, RCOG president @epmorris co-authored a commentary addressing common beliefs among obstetricians regarding the risk of retinal detachment during labour compared with evidence from the literature. Read the commentary: https://t.co/uMeQRChYRw https://t.co/MXhYMnn4I3"
1264466173556645888,2020-05-24 08:00:03+00:00,"If you are worried about your health or the health of your unborn baby, please contact your midwife or maternity team who will be able to offer advice and support. Read more: https://t.co/Y7YcfFbJvK https://t.co/yXcGCWYZsE"
1264172239794114560,2020-05-23 12:32:03+00:00,We want to pay tribute to the inspiring Dr Elinor Catherine Hamlin who sadly passed away on Wednesday 18 March 2020. Dr Hamlin pioneered the treatment of obstetric fistula in Ethiopia and set up the Hamlin Foundation. We hope together we can continue her fantastic work. https://t.co/XB8YHAffSy
1264103785250643968,2020-05-23 08:00:02+00:00,"If you are pregnant, it is very important that you continue to attend your antenatal appointments. These appointments are there to keep you and your baby safe and to support you with any concerns you may have. Read more: https://t.co/XuEA2JQzy1 https://t.co/07KqurY5eF"
1263867696547946496,2020-05-22 16:21:55+00:00,"📣 Updated information for pregnant women🤰🏾📣

This includes:

✅ Advice for pregnant women from a BAME background
✅Advice for those with children attending school/nursery/external childcare
✅ Information on #covid19 testing

 #covidmaternity

Read more: https://t.co/bV3RX56oSy https://t.co/qSdBnxBC73"
1263795566611517442,2020-05-22 11:35:17+00:00,"📢 Updates to our guidance for antenatal and postnatal services during the #coronavirus pandemic 📢

Information for healthcare professionals: https://t.co/ORMl9dic4p

#covidmaternity #COVIDー19 @MidwivesRCM https://t.co/8TrReD0F0r"
1263513396185628676,2020-05-21 16:54:03+00:00,Important advice for pregnant women from BAME backgrounds🤰🏾🔽 #covidmaternity https://t.co/OjRhJwZOIW
1263394355399856128,2020-05-21 09:01:01+00:00,"Options for contraception during the #coronavirus pandemic may be slightly different than usual due to social distancing and other infection control measures in healthcare settings. 

Learn about how and where you can get help and advice: https://t.co/upioZj5ony https://t.co/mttQtNnzc0"
1263363911363047424,2020-05-21 07:00:03+00:00,"If you are a birth partner, please be aware of the strict infection control procedures in place to prevent the spread of #coronavirus. It is important to stay in the labour room whenever possible and avoid movement around the hospital. Read more: https://t.co/nBwiBuriaT https://t.co/xCzmLfbAGo"
1263091380001353728,2020-05-20 12:57:06+00:00,"Sexual and reproductive health services are classified as essential by the @WHO and should be provided to girls and women during the #Covid_19 pandemic and beyond. 

Read our joint statement with @FSRH_UK 👇 #coronavirus #womenshealth 
https://t.co/u2BBXxRtJ6"
1262726401200775168,2020-05-19 12:46:49+00:00,".@ThePOGP have produced this handy resource for women experiencing bladder and bowel problems while recovering from a chronic cough or #COVID19. 

Please visit https://t.co/FLHalqdeoG to learn more about pelvic organ dysfunction and what can be done to help manage symptoms https://t.co/wG9L0jk1ni"
1262669366145007616,2020-05-19 09:00:10+00:00,"Sexual and reproductive healthcare services continue to function during the #coronavirus pandemic but access and provision may change slightly in certain areas. 

Learn more in this @FSRH_UK resource: https://t.co/wWFS765FaN #womenshealth_covid19 https://t.co/6XzhG5BxV3"
1262639373541167107,2020-05-19 07:01:00+00:00,"Pregnant women should be supported to have a birth partner present during their birth. However, if the partner has #covid19 symptoms they won't be allowed into the hospital. Please think about an alternative person who could take their place. Read more: https://t.co/X9VmWqBnZ7 https://t.co/XgzTdamogP"
1262396930950340609,2020-05-18 14:57:37+00:00,"The RCOG continues to support the offer of maternal request for caesarean, as recommended by NICE. 

We have not proposed any restrictions to elective caesareans during the #coronavirus pandemic. #covidmaternity 
https://t.co/bP6QtfZa7n"
1262342860671770624,2020-05-18 11:22:45+00:00,"If you are pregnant and need support with shopping or collecting a prescription, getting a lift to or from hospital or health appointments or you’d like a chat, the NHS Volunteer Responders are on hand. Please call 0808 196 3646 to learn more @NHSVolResponder https://t.co/i2XgY0CPIv"
1262337259770122240,2020-05-18 11:00:30+00:00,There is just a week left to apply to join our Board of Trustees. Don’t miss the opportunity to help shape the future of an organisation committed to improving healthcare for women and girls globally. Learn more and apply: https://t.co/WNQvzwIQeE https://t.co/mcEoWRTqQn
1262307794365145090,2020-05-18 09:03:25+00:00,"Read more on the links below 👇🏾

News story: https://t.co/IE9aazbpTu

Clinical guidance for health professionals and Q&amp;As for pregnant women: https://t.co/t0ck3efmrs"
1262307486373158913,2020-05-18 09:02:11+00:00,"Our revised guidance recommends that pregnant women from BAME backgrounds should be:

✅told at each contact with a health professional that they may be at higher risk of complications of coronavirus 
✅ advised to seek help early if they are concerned about their health"
1262307285382107136,2020-05-18 09:01:24+00:00,"Dr Christine Ekechi, a consultant obstetrician and gynaecologist and spokesperson on racial equality for the @RCObsGyn, said the figures on BAME hospital admissions “deepen our concerns around persisting vulnerabilities of this particular group of women”.
https://t.co/w6miAlgFJa"
1262300687251243010,2020-05-18 08:35:10+00:00,"During #covid19 all hospitals are restricting visitors, but there are exceptions for a birthing partner during active labour and birth. Watch this video to learn how birth partners can keep themselves, their family and NHS staff as safe as possible. Read: https://t.co/5RMtL4l8zQ https://t.co/Lq3WRw2bH1"
1261914456302465024,2020-05-17 07:00:26+00:00,"Current evidence shows that Black, Asian and minority ethnic pregnant women in the UK may be more likely to become seriously unwell with #coronavirus. 

If you are experiencing symptoms, or have a slow recovery, it is important to seek medical help.

https://t.co/lbe3r7DMuA https://t.co/a5HKqogVFP"
1261680403565498370,2020-05-16 15:30:23+00:00,"Our heartfelt sympathies and thoughts are with the women, their families and healthcare staff who have been affected by this appalling tragedy. 2/2"
1261680087046463491,2020-05-16 15:29:08+00:00,"We stand in solidarity with @MSF in condemning this outrageous attack on a maternity ward in the Dasht-e-Barchi hospital in Kabul, Afghanistan. 1/2 
https://t.co/naQAZAh7BW"
1261552183612444672,2020-05-16 07:00:53+00:00,"You may have seen reports about poor outcomes for some BAME pregnant women in the UK with #coronavirus. 

Clinicians are working to protect these women and their babies and the threshold for reviewing and admitting in hospitals have altered to help this.

https://t.co/hdwjYoOEsO https://t.co/VHzZyFVGuq"
1261373719185932289,2020-05-15 19:11:44+00:00,"We want to take this opportunity to thank all our amazing Fellows, Members and Trainees who have continued to work tirelessly to ensure the public remain protected and supported during these difficult times #covidmaternity"
1261373569725939713,2020-05-15 19:11:08+00:00,"This framework has been developed alongside our specialist societies and with help from the College's Guidance Cell, Women's Network and Officers. They have all been integral to championing the importance of O&amp;G services during the pandemic."
1261373284811264001,2020-05-15 19:10:00+00:00,"The #coronavirus pandemic has disrupted all areas of healthcare in the UK and O&amp;G has not been exempt from that.
 
We have published a framework, designed to be adaptable, for the restoration and recovery of services that have been postponed or reduced. 

https://t.co/ohMaFF8Siy"
1260984193007390723,2020-05-14 17:23:54+00:00,"**Revised guidance on maternal medicine services during the #covid19 pandemic**

Information for healthcare professionals: https://t.co/d7dXhLuyPn

#covidmaternity https://t.co/F0sfgJHMtq"
1260857679494483968,2020-05-14 09:01:11+00:00,"If you are looking for sexual or reproductive healthcare support, please don’t attend a clinic but know that help is still available through a phone or video consultation.

Find out how services are working during #covid19 in this @FSRH_UK resource: https://t.co/kAYNrSopxf https://t.co/vFSp4eOUMP"
1260842332544532480,2020-05-14 08:00:12+00:00,"Evidence has shown that Black, Asian and minority ethnic people in the UK are more likely to suffer severe symptoms of #coronavirus. We want to ensure that pregnant women and their babies are kept safe during this time. Watch our video to learn more @MidwivesRCM https://t.co/bxGHTfaqLI"
1260827891299909632,2020-05-14 07:02:48+00:00,"When at home with your newborn, don’t hesitate to seek help if your baby is displaying concerning symptoms of any kind, or not progressing as you’d hope. Your midwife is on hand to help you. Read more: https://t.co/J6Mt3ReaRC @MidwivesRCM https://t.co/8hzv8dsjUa"
1260665556845371404,2020-05-13 20:17:45+00:00,"📢 New updates on our coronavirus infection and pregnancy guidance 📢

Latest guideline for health professionals: https://t.co/mGWusa0MA7

Updated Q&amp;A for pregnant women: https://t.co/MJXPHoX0Kt 

#covidmaternity @MidwivesRCM @RCPCHtweets @DHSCgovuk https://t.co/aEpMTbtSMy"
1260498403546533888,2020-05-13 09:13:32+00:00,"#ICYMI - read our joint RCOG/RCM statement in response to the @NPEU_UKOSS study of more than 400 pregnant women hospitalised with coronavirus in the UK: https://t.co/IE9aazbpTu #covidmaternity
https://t.co/AXViF9pHmO"
1260232365269569536,2020-05-12 15:36:24+00:00,"Urinary tract infections (UTIs) are the most common infections in women worldwide, with more than 150 million people diagnosed annually. The latest edition of TOG outlines the rationale of why preventing recurrent UTI is so important. Read the article: https://t.co/wbXE4oPyBM https://t.co/QiqXcYd4hW"
1260132812872658944,2020-05-12 09:00:49+00:00,"Are you looking for advice and guidance about starting new contraception or changing the method you currently use? Support remains available during the #covid19 pandemic. 

Learn more in this @FSRH_UK advice: https://t.co/395q0sH4L0 #womenshealth_covid19 https://t.co/GDurMhGEb7"
1260118805369565185,2020-05-12 08:05:09+00:00,"Happy International Nurses' Day!👩🏽‍⚕️  

We would like to thank all our nurses who provide amazing care and support during these challenging times 🙏🏽🌈🌍

#InternationalNursesDay #ThankOurNurses
https://t.co/1yZoWOgqMB"
1260102517632925697,2020-05-12 07:00:26+00:00,"It is safe to breastfeed your baby during the #COVID19 pandemic. If you have symptoms of #coronavirus, or are generally unwell, be extra careful with hygiene when holding and feeding your baby and consider wearing a mask, if one is available. Read more: https://t.co/wNBqvS10BZ https://t.co/A13kXOcB4J"
1259869919988105217,2020-05-11 15:36:10+00:00,"RCOG and RCM joint response to @NPEU_UKOSS study of more than 400 pregnant women hospitalised with #coronavirus in the UK: https://t.co/IE9aazbpTu #covidmaternity
https://t.co/lpd30zYgyN"
1259800431259258882,2020-05-11 11:00:03+00:00,"Do you have experience of board or committee membership in a charitable, public sector or commercial organisation? Are you a person with financial expertise, with a recognised accounting qualification? Apply to join our Board of Trustees: https://t.co/9FxIgJeIjx https://t.co/7X9u3fItSB"
1259755170696695808,2020-05-11 08:00:12+00:00,Bringing home a new baby should be an exciting time but we appreciate #COVID19 may be increasing the worries for new mothers and their families. Watch our short video with some handy tips to protect newborns. Read more: https://t.co/W7CZYKMKge https://t.co/R9CPbA8PQd
1258411930760470528,2020-05-07 15:02:39+00:00,"Very useful advice for women during pregnancy🤰🏽🔽 #coronavirus #covidmaternity
https://t.co/hnYWUm6xSY"
1258410630807080960,2020-05-07 14:57:29+00:00,"@SeacilinNi Hi Jacqueline, we completely understand your concerns. After a formal announcement, we will review our guidance to ensure it is in line with official Government advice. Please do check back. In the meantime, our Q&amp;As may be helpful &gt; https://t.co/bV3RX56oSy"
