id,created_at,text
1405490112612515840,2021-06-17 11:38:50+00:00,"Investment in renewable energy generation and energy efficiency businesses must be part of a healthy and sustainable recovery from the pandemic, including phasing out coal power by 2024, and ending investment in all fossil fuel projects abroad."
1405490110448156673,2021-06-17 11:38:49+00:00,Further investment in air pollution monitoring and research is essential. Action and research must also focus on most vulnerable groups and the heavier toll on deprived communities.
1405490108200112128,2021-06-17 11:38:49+00:00,"A reduction in road transport of all kinds is needed to minimise the health impacts of air pollution – we need ambitious and equitable investment to support and promote active, green and shared travel, alongside curbing emissions through initiatives such as Clean Air Zones."
1405490106081947648,2021-06-17 11:38:48+00:00,"The UK Government must show strong international leadership and adopt legal limits on particulate matter which at least meet WHO guidelines, to be met by 2030 at the latest."
1405490103787610114,2021-06-17 11:38:48+00:00,"We have published a position statement on outdoor air pollution and pregnancy today to mark #CleanAirDay. Our recommendations are in short below, read more on our website: https://t.co/HBKPWovMLe https://t.co/BRgMKVe353"
1405186704835764228,2021-06-16 15:33:12+00:00,"We support @SandsUK #AlwaysThere campaign to save lives and improve care by ensuring  women who are pregnant following loss can choose to have the same maternity team always there to care for them and their baby, through pregnancy, birth and beyond.  
#BetterCare https://t.co/dpO2y5dpjU"
1405126018298437633,2021-06-16 11:32:03+00:00,"Don’t forget: Tonight at 7pm we are hosting an Instagram Live with @Jotrust and Dr Pavan Minhas. Join us to hear about cervical screening, gynaecological health and much more. #CervicalScreeningAwarenessWeek https://t.co/G2sKY9S8vv"
1405117971291312129,2021-06-16 11:00:04+00:00,"A new Menopause Bill by @CarolynHarris24 will be introduced today in the House of Commons. This is an excellent opportunity to improve access to menopause treatment and support, a key recommendation of our 2019 Better for Women report. https://t.co/M4pxBweYiE"
1405080732620529664,2021-06-16 08:32:06+00:00,"We are thrilled to announce applications for the William Blair Bell Lectureship are now open. The winner will have the opportunity to present at the next RCOG Annual Academic Meeting. Applications close Wednesday 14 July 2021. Find out more: https://t.co/FvGXsBmBi3
@BlairBellRS https://t.co/04CMkKYp1L"
1404473752369438728,2021-06-14 16:20:11+00:00,"This year’s World Congress event featured an insightful and hard hitting talk by @orlystern about the ways women are harmed by conflict - including displacement, gender violence, exploitation and healthcare needs. To watch Orly's talk visit: https://t.co/none3HIaN4 #RCOG2021"
1403791663332532225,2021-06-12 19:09:48+00:00,"Huge congratulations, Brendan. And to all our award winners at a record breaking #RCOG2021 https://t.co/c3DJaHj3ic"
1403776244123111427,2021-06-12 18:08:32+00:00,Huge congratulations to all our award winners on their fantastic achievements. That’s a wrap on RCOG World Congress 2021 – thank you for making this an exceptional event in extraordinary times. #RCOG2021
1403726287492075522,2021-06-12 14:50:01+00:00,"The @tommys National Centre for Maternity Improvement works to prevent stillbirths and preterm births across the UK. Tune in to Professor @dillyanumba talk at 4pm GMT to hear more. #RCOG2021
https://t.co/3YfccRlZtB"
1403694942984224768,2021-06-12 12:45:28+00:00,"We are enjoying hearing more about the fascinating topic of air pollution, the climate crisis and birth outcomes from Dr Bruce Bekkar @thgreendoc. Follow here to view the latest updates: https://t.co/3YfccRlZtB https://t.co/0BzPvMmRih"
1403680237964206084,2021-06-12 11:47:02+00:00,"One of the highlights from today’s RCOG stream at #RCOG2021 is the discussion of racial inequality in O&amp;G from members of the RCOG’s Race Equality Taskforce. As part of the taskforce, we are proud to work with organisations such as @fivexmore on influential campaigns. https://t.co/VVJh6Fi1f3"
1403663502120730632,2021-06-12 10:40:32+00:00,Watch @arricoomarasamy talk about why it is an exciting time to be working in early pregnancy. Hear more from Professor Arri Coomarasamy at 11.55am GMT. #RCOG2021 https://t.co/9wtLgDdUAU
1403656683877027840,2021-06-12 10:13:26+00:00,@Its_Shan1ce Good luck with your presentation!
1403652133401108480,2021-06-12 09:55:21+00:00,Thank you Professor @LucyChappell2 for talking to us about your research. Tune in to #RCOG2021 at 11am GMT to hear more from Lucy: https://t.co/dZ6DRh6DGz https://t.co/e0OO1GSns2
1403646889430560769,2021-06-12 09:34:31+00:00,"Look forward to hearing you speak, Dilly! #rcog2021 https://t.co/zFilNjSaxS"
1403644498677223424,2021-06-12 09:25:01+00:00,"A really powerful talk from @orlystern on ‘Women in War: The Price of Violence’ including displacement, gender violence, exploitation and healthcare needs. Stay up to date on the latest from the final day of #RCOG2021 here: https://t.co/3YfccRlZtB"
1403610589067452416,2021-06-12 07:10:16+00:00,"Today is the final day of #RCOG2021. Don’t forget: All content is available for three months post-event, meaning you can continue your professional development and learning at a time that suits you. Click here to follow the action: https://t.co/3YfccRlZtB https://t.co/6jVjkqpX3Y"
1403604838387224576,2021-06-12 06:47:25+00:00,We are delighted RCOG Fellow Dr Heather Currie has been awarded an MBE in the #QueensBirthdayHonours for services to healthcare. Dr Currie is a menopause specialist and past President of the @BrMenopauseSoc. Congratulations to Heather and all those across the NHS recognised👏
1403408193359958019,2021-06-11 17:46:02+00:00,"Thank you for attending day 3 of #RCOG2021! Remember, all content is available on demand and you can catch-up on today’s highlights here: https://t.co/RdHnAONL4p"
1403374381699567622,2021-06-11 15:31:40+00:00,"Tune in to #RCOG2021 at 4.40pm GMT to hear Dr Jonathan Lord discuss safe abortion care outside the clinical setting. 
Stay updated here: https://t.co/RdHnAONL4p https://t.co/ClUviCUC9m"
1403348800031408132,2021-06-11 13:50:01+00:00,"We are enjoying hearing Dr Pat O’Brien, RCOG Vice President for Membership, discuss the collateral effects of the COVID-19 pandemic on women’s health. Stay updated here: https://t.co/RdHnAONL4p"
1403331301525098500,2021-06-11 12:40:29+00:00,"@EllabanyRania Glad to hear you are enjoying Congress, and good luck with your presentation shortly!"
1403331211670568963,2021-06-11 12:40:08+00:00,"We’ve seen some fascinating and ground-breaking talks this morning at #RCOG2021! We want to hear your highlights.
Stay up to date with the very latest here: https://t.co/RdHnAONL4p https://t.co/Kl5qBhTxY4"
1403287689424740353,2021-06-11 09:47:11+00:00,"Fantastic work from @TheBUSOG recruiting new ambassadors, hosting webinars and growing their influence. The future is bright! #RCOG2021 https://t.co/Nz8QcaVkCn"
1403260969212694528,2021-06-11 08:01:01+00:00,"Mairead O’Connor provided interesting insights into cervical screening behaviours in older and younger women. View the key takeaways here: https://t.co/RdHnAONL4p
#RCOG2021"
1403248145803456512,2021-06-11 07:10:03+00:00,"It’s day three of #RCOG2021 and we are excited to start the day with sessions about genetics, quality improvement and gynaecological oncology. Follow us here to stay up to date: https://t.co/RdHnAONL4p https://t.co/cqHZ8TG8RE"
1403042277312942089,2021-06-10 17:32:00+00:00,"Thank you to all of our speakers and delegates who joined us today at #RCOG2021. Join us tomorrow for day three of Congress! Experts including Professor Dame Lesley Regan, Dr Richard Choy and Dr Pallavi Latthe. See our highlights from today: https://t.co/Lv8vtmt3e4"
1403026677878476808,2021-06-10 16:30:01+00:00,The final talks of #RCOG2021 day two are now underway! Check out the latest updates and highlights from the day so far: https://t.co/Lv8vtmt3e4
1403000253654061067,2021-06-10 14:45:01+00:00,"Dr @jenejardine has played a critical role in the RCOG’s COVID-19 response team. Hear Jen’s insight into the impact of the pandemic on O&amp;G services and the development of rapid clinical guidance. Tune in to #RCOG2021 now. 
https://t.co/Lv8vtmbrPu"
1402958514088206340,2021-06-10 11:59:10+00:00,It's vital fertility clinics do not mislead women around the effectiveness and cost of treatments. The RCOG fully supports this new guidance by @CMAgovUK and hope that it helps clinics better understand their legal obligations. Full response here: https://t.co/YgeUcgGf3y https://t.co/tc7oaNEE8v
1402951431922065409,2021-06-10 11:31:01+00:00,Here are the key takeaways from @ProfEmmaCrosbie’s fascinating talk on preventing endometrial cancer at #RCOG2021: https://t.co/Lv8vtmt3e4
1402935438491463680,2021-06-10 10:27:28+00:00,"Professor Fawzia Hossain spoke to us about her work in Myanmar. You can watch Professor Hossain’s moving talk on the Rohingya crisis and COVID-19 from #RCOG2021 on catch-up now.
https://t.co/Lv8vtmt3e4 https://t.co/YWUMf1tMde"
1402921050711678976,2021-06-10 09:30:18+00:00,"If you enjoyed Chris Turner’s talk at #RCOG2021, take a look at our new workplace behaviour toolkit, developed in collaboration with @MidwivesRCM and @civilitysaves: https://t.co/r7cPf7D5RM https://t.co/AMWKrDds1s"
1402919623398461443,2021-06-10 09:24:37+00:00,It is critical that all healthcare professionals feel confident discussing the options with those who are pregnant so they can make an informed choice. Read our news release here: https://t.co/8udZ6fG3ZW (3/3)
1402919622156951553,2021-06-10 09:24:37+00:00,"We want to reassure women that vaccination in pregnancy is safe and effective in preventing COVID-19, which can be more serious in pregnant women, particularly in their third trimester. (2/3)"
1402919620982591492,2021-06-10 09:24:37+00:00,"Our survey of 1,300 pregnant women has found that out of those who have been offered the COVID-19 vaccine, only 2 in 5 had accepted it (1/3)"
1402914690620141568,2021-06-10 09:05:01+00:00,"“How we behave towards each other is the single greatest factor in how well competent teams perform.” – Dr Chris Turner @orangedis, #RCOG2021 
https://t.co/Lv8vtmt3e4"
1402898694077403138,2021-06-10 08:01:27+00:00,We started day two of #RCOG2021 with talks from Helen Staley and Babu Karavadra. Find out what we learnt: https://t.co/Lv8vtmt3e4
1402884507007655937,2021-06-10 07:05:05+00:00,Welcome to day two of #RCOG2021. Today’s programme features unique streams including maternal medicine and labour ward management. Stay up to date with the latest updates from the day here: https://t.co/Lv8vtmt3e4 https://t.co/4K7PBULwZu
1402674355692257285,2021-06-09 17:10:01+00:00,Our first day of #RCOG2021 has been incredibly successful and it was great to virtually meet so many old and new faces! We’re looking forward to seeing you again tomorrow. Catch up on day one highlights here: https://t.co/5JPBTf0NNY
1402669322464645124,2021-06-09 16:50:01+00:00,"Is interstitial cystitis in fact a misdiagnosed chronic UTI? Alexandros Fanourgiakis is exploring the answer at #RCOG2021 now. 
https://t.co/5JPBTf0NNY"
1402656893227651074,2021-06-09 16:00:38+00:00,US ‘Helms Amendment’ is misogynistic legislation preventing women from accessing #safeabortion around the world - that's why RCOG wholeheartedly supports the efforts to #RepealHelms. Read more here: https://t.co/AHOAmDB56y
1402639123505090563,2021-06-09 14:50:01+00:00,Dr Ippokratis Sarris discusses what we can do about recurrent IVF failure: https://t.co/5JPBTf0NNY #RCOG2021
1402615237057069060,2021-06-09 13:15:06+00:00,RCOG President Dr Edward Morris @morris_ep is currently giving his Presidential Address at #RCOG2021. Stay updated with the latest Congress activity here: https://t.co/5eCKqKO3GS https://t.co/EmdJ0TdHfz
1402612584029773825,2021-06-09 13:04:33+00:00,"Ahead of our High-Risk Pregnancy stream this morning, we were delighted to welcome @ngawai_n  to share her experience of epilepsy during pregnancy and complexity and factors to consider. Catch up on #RCOG2021 here: https://t.co/ib32OPMLCn"
1402586275455057922,2021-06-09 11:20:01+00:00,Professor @cathwilliamson5 is currently talking about new concepts on intrahepatic cholestasis at #RCOG2021. Stay up-to-date here: https://t.co/5JPBTf0NNY
1402582793570430977,2021-06-09 11:06:11+00:00,"Fascinating Q&amp;A with @drumaram_ram following her talk on pre-existing diabetes in pregnancy, pre-pregnancy planning and the impact of COVID-19. Expertly chaired by former RCOG VP  @AliWrightObGyn in the maternal medicine stream. Live blog here: https://t.co/ngS8tmLAEV #RCOG2021 https://t.co/YWw4Ei5NEq"
1402576209180086275,2021-06-09 10:40:01+00:00,Professor Andrew Horne @horne_research is currently discussing drug repurposing for the treatment of endometriosis at #RCOG2021. Read the latest here: https://t.co/r7RZ6E99dY
1402572320800219143,2021-06-09 10:24:34+00:00,"We have signed this letter calling on the PM to stop the rollback of a generation of gender equality. Including reversing the harmful UK aid cuts and restoring funding to family planning and women and girls’ health globally.
#Wednesday4Women #G7Summit https://t.co/ObAcC0DVoa"
1402571535567802370,2021-06-09 10:21:27+00:00,@johns16_nina @obstetricmedic @PHE_uk @MidwivesRCM All pregnant women will be offered a first dose of the vaccine in the coming weeks we are committed to encouraging uptake. We understand that vaccine hesitancy is high in this population &amp; many are declining the vaccine which is a concern
1402570595188023296,2021-06-09 10:17:43+00:00,@johns16_nina @obstetricmedic @PHE_uk @MidwivesRCM We have worked with @PHE_uk and @MidwivesRCM on a decision aid support pregnant women make an informed choice. It's also vital that HCPs feel confident discussing the benefits and risks of vaccination with pregnant women https://t.co/6heVDr2PKE
1402549859761152004,2021-06-09 08:55:19+00:00,"@sundayajayi Hi Sunday, thank you for attending the talk. This was a recorded session so there were no live questions, but Professor McCowan left her email address on the last slide if you want to contact her."
1402548631421530112,2021-06-09 08:50:26+00:00,Watch Professor Adam Balen talk about advancements and innovation in reproductive medicine during his career. Hear more from @BalenAdam at 10am GMT. #RCOG2021 https://t.co/OkB6r9XKfj
1402540976934117378,2021-06-09 08:20:01+00:00,"Joining us from New Zealand, Professor Lesley McCowan will be kicking things off with a plenary discussion on the maternal going to sleep position: https://t.co/5JPBTf0NNY 
#RCOG2021"
1402538468778168322,2021-06-09 08:10:03+00:00,"Today marks the first Congress with Dr Edward Morris @morris_ep as RCOG President. Check here for the latest updates from his welcome address: https://t.co/5JPBTf0NNY
#RCOG2021 https://t.co/mf2BwmDf3X"
1402535792497545220,2021-06-09 07:59:25+00:00,"Today we welcome over 3,000 O&amp;G professionals to day one of RCOG Virtual World Congress 2021. Join the conversation using #RCOG2021 and stay up to date with our live blog here: https://t.co/Y4WAlPz861 https://t.co/i14HrIoSaJ"
1402284961433014272,2021-06-08 15:22:42+00:00,Join our past President Prof Dame Lesley Regan @lregan7 and a stellar panel at this event on tackling taboos in women's health https://t.co/8twP2Had0d
1402267949818421251,2021-06-08 14:15:06+00:00,We've published a short briefing ahead of the emergency debate today on the UK’s overseas development assistance spending commitments. We urge the UK Government to commit to the 0.7% target and rededicate itself to prioritising the health &amp; rights of women and girls globally. https://t.co/hwkYXpzVoA
1402257993585025025,2021-06-08 13:35:33+00:00,The @IMPRINT_network have produced a short animation on the use of COVID-19 vaccines for pregnant and breastfeeding women. Watch this and other videos about vaccines in pregnancy on their website: https://t.co/a7HDHL3FJe https://t.co/P47kXGALPc
1402176605527621632,2021-06-08 08:12:08+00:00,It’s almost here! #RCOG2021 starts tomorrow and we are excited to meet colleagues from across the world. Use code LASTCHANCE for 10% off before midnight. What are you looking forward to most? Comment below. https://t.co/OMQMWcjems
1401939702534574094,2021-06-07 16:30:46+00:00,"We, along with other royal colleges, unions and academics, have come together to urge the Prime Minister to reverse aid spending cuts and invest in overseas healthcare. 

Read more about it here: https://t.co/agBPTxSBRh https://t.co/d8YqhgogW8"
1401934484925300741,2021-06-07 16:10:02+00:00,"We, along with other royal colleges, unions and academics have come together to urge @BorisJohnson to reverse aid spending cuts and invest in overseas healthcare. Read more about it here: 
https://t.co/w4YpAUK0g9 https://t.co/TTz19KBHoz"
1401892739231457288,2021-06-07 13:24:09+00:00,@Euro_Bo_Bo @RoyalFreeNHS @DecarliDr @Verytallbecca @AdamSteingold @amateuradam @elly_charity @susannacrowe @JeremyCliffe @Medic_Russell @Euro_Bo_Bo We're sorry if you got the impression we are ignoring Pride. We have a number of posts and activity planned across our social media channels this month - the RCOG is passionate about inclusivity. Wishing you a #HappyPrideMonth2021 🏳️‍🌈
1401844383843074054,2021-06-07 10:12:00+00:00,"The ethos of teaching and training needs to be embedded in our NHS clinical practice, in order to ensure the high-quality training in gynaecological surgery, impacted by the COVID-19 pandemic. Read more recommendations by the RCOG here: https://t.co/rdJv4VfrCk"
1401840280828055553,2021-06-07 09:55:42+00:00,"This #PrideMonth2021 we want healthcare professionals to engage as much as possible with patient-led committees, our Women’s Network &amp; Women’s Voices involvement panel, to ensure the voices of those who need support are being heard &amp; their advice utilised in the care we provide. https://t.co/jOzNqNT6cX"
1401812768236486657,2021-06-07 08:06:23+00:00,We are looking forward to seeing you in less than 48 hours on our innovative platform at our first ever Virtual World Congress. Use the code LASTCHANCE for 10% off before midnight 8 June: https://t.co/xheNeJcIB9 https://t.co/ofpY3liGDx
1401571590589014019,2021-06-06 16:08:01+00:00,Register today for Risk Management and Medico–Legal Issues in Women’s Health Care. This comprehensive meeting will explore the latest hot topics – a fantastic development opportunity for healthcare professionals globally. Find out more: https://t.co/iREVCHhn0Y
1401527323946586112,2021-06-06 13:12:07+00:00,"Don’t miss out, at #RCOG2021 you will be able to hear the latest updates from around the globe without leaving your home. Book before midnight 8 June to save 10% by using the code LASTCHANCE: https://t.co/hILZ6hKnzH https://t.co/IsY0vpq7yO"
1401464388591263745,2021-06-06 09:02:02+00:00,We are delighted to be collaborating with @JoTrust for an Instagram Live during #CervicalScreeningAwarenessWeek! Send us your questions on cervical screening and gynaecological health here: https://t.co/GAB3MrhxFF https://t.co/Qh6Kth5cAm
1401183799426310144,2021-06-05 14:27:05+00:00,"Next week, you can hear Dr Bruce Bekkar talk about air pollution, the climate crisis and birth outcomes, alongside many other world-class presentations at #RCOG2021. Book now: https://t.co/1wMRS20TBj https://t.co/OVqa0hFX5I"
1401147801065623559,2021-06-05 12:04:02+00:00,"To support the delivery of high-quality gynaecological training, especially after issues caused by the pandemic, there should be at least one simulation hub for hands-on training within each region. Read more recommendations here: https://t.co/s4mk1PbBph https://t.co/recx6ZlU5l"
1401102507800252417,2021-06-05 09:04:03+00:00,"One month to go until our Pregnancy, Childbirth and the Pelvic Floor event. 87% of delegates at the last event  would recommend attending this course. Book your place for this virtual event now: https://t.co/zn5oYzQ76n https://t.co/O7LCQBd3xw"
1400801017588035587,2021-06-04 13:06:02+00:00,"Happy #PrideMonth2021. We recognise the importance of being a diverse and inclusive College to allow our members, staff and partners to be their true selves at work. Diversity is essential in a team because it means we can ensure the best possible care for all. https://t.co/p7j6FpE4Ur"
1400755720740642816,2021-06-04 10:06:03+00:00,All pregnant women in the UK are now being offered the COVID-19 vaccine when their age group is called. The RCOG and @MidwivesRCM have developed a useful decision aid for pregnant women so they can make an informed choice about whether to have the vaccine: https://t.co/2pmVOMD4yV https://t.co/VMQLVZ7Zna
1400415530134163460,2021-06-03 11:34:15+00:00,"The countdown is on, only six days until #RCOG2021. Secure your place using the code LASTCHANCE to save 10%. Book before midnight 8 June: https://t.co/9KV7IlCX8q https://t.co/OVs1tDHZqW"
1400382260176723969,2021-06-03 09:22:03+00:00,"We need to help clinical service/operational managers to understand that supporting training today will improve safety, efficiency and quality of gynaecological surgeries long after this restoration period. Read more recommendations here: https://t.co/JeAJKBA0uo https://t.co/Bf0NGcJ41L"
1400086055613784070,2021-06-02 13:45:02+00:00,RCOG is pleased to announce it will be collaborating with the Japan Society of Obstetrics and Gynecology to improve patient care for women and girls globally. Read more here: https://t.co/xKpdLlqhs9 https://t.co/9q91gfwswi
1400020230383063041,2021-06-02 09:23:28+00:00,"We're delighted to see such an important organisation recognised for the support they provide to women experiencing depression, anxiety or isolation during pregnancy or after birth. #VolunteersWeek https://t.co/XV6KjGJlZy"
1399671121994264577,2021-06-01 10:16:14+00:00,This #VolunteersWeek we want to say thank you to volunteers contributing their time and expertise to women’s health. Sabrina from our Patient Information Committee has written about volunteering as an obstetrician and gynaecologist with @MSF in Yemen: https://t.co/djgFoufUVA
1399637341304725505,2021-06-01 08:02:00+00:00,"Trainees should experience every possible training opportunity available in order to keep gynaecological surgeries at a high-quality level, the training of which was impacted by the COVID-19 pandemic. Read our recommendation here: https://t.co/2EkJ3vfSiS"
1399306171182465025,2021-05-31 10:06:03+00:00,"Joining virtually from Canada, Dr Sara Thorne will be exploring pre-existing heart disease in pregnancy at our Virtual World Congress. Book your place for #RCOG2021: https://t.co/sem0zDbmlR https://t.co/KbYGeFpCrd"
1398940251691917314,2021-05-30 09:52:01+00:00,"To resume the delivery of high-quality gynaecological surgical training, the RCOG has recommended a number of strategies, such as the development of a formal and structured RCOG simulation training programme to be implemented by all regions. Read more here:https://t.co/Kxri2tS7XU"
1398579930296901632,2021-05-29 10:00:14+00:00,At #RCOG2021 Jeeva John will be exploring the experience of women from ethnic minorities during maternity care. Book now to ensure you don’t miss our inspiring line up of speakers: https://t.co/scKJ53DmeQ https://t.co/JFhJLVROrw
1398353110972698630,2021-05-28 18:58:56+00:00,"Congratulations, Emily! https://t.co/Ml17l8nT1Y"
1398345843544137729,2021-05-28 18:30:03+00:00,"We believe #WomensHealthMatters and #SRHRisEssential, especially when it comes to safe abortion. 

In this blog Vice President at the RCOG @RaneeThakar explores how the telemedicine service could improve safe abortion globally: https://t.co/pnqBTbdVES"
1398324955012648960,2021-05-28 17:07:03+00:00,Thank you to all trainees and speakers that have joined us for a record-breaking #NTC2021. Explore our other upcoming virtual events: https://t.co/YA89oQq5LF https://t.co/9J2gYyemzE
1398322452225212422,2021-05-28 16:57:06+00:00,Congratulations to Mr Sujeewa Fernando who has won the 2021 National Trainer of the Year award at #NTC2021. Learn more about this prestigious annual award:  https://t.co/8hWrQ7QIbH https://t.co/YTkZrokkXL
1398319409727524867,2021-05-28 16:45:01+00:00,"Congratulations to Dr Emily Hotton, Miss Danai Bagkou Dimakou and Dr Nana Bosompra who have won awards for best oral presentation, poster pitch and e-Poster at #NTC2021."
1398297586956709890,2021-05-28 15:18:18+00:00,"It's International Day of Action for Women's Health and we are talking about how the telemedicine abortion service can help to increase access to safe abortions globally. Read this blog by the RCOG’s Vice President Miss Ranee Thakar: https://t.co/wGFFvfCUcm

#WomensHealthMatters https://t.co/HoNDbJdX50"
1398282414460391431,2021-05-28 14:18:01+00:00,Co-Chair of our Race Equality Taskforce @DrEkechi is currently discussing tackling racism in medicine at #NTC2021. Find out more about the taskforce here: https://t.co/o4IVpoq0eL
1398270838252748802,2021-05-28 13:32:01+00:00,The new Robotic Surgery in Gynaecology draft Scientific Impact Paper is now out for consultation. Further details can be found on the RCOG consultation page using the following link: https://t.co/QBijVM2BGU – closing date for comments is 23:59 Sunday 27 June 2021.
1398249698507595785,2021-05-28 12:08:01+00:00,"Today is International Day of Action for Women's Health. At #NTC2021 women’s health is being promoted through the Champion for Women’s Health stream, featuring a talk from @Iregan7 about the ‘Better for Women’ strategy. #WomensHealthMatters"
