id,created_at,text,scores,compound
1449752346423070723,2021-10-17 15:01:09+00:00,📖 Publication: ‘Clinical Cases for MRCPCH Foundation of Practice' for the FOP exam. This book gets to the heart of what examiners are looking for in successful candidate performance. Invaluable resource for those studying or preparing to apply for FOP. https://t.co/vIi9ScXYul https://t.co/7L5NtNuYHf,"{'neg': 0.0, 'neu': 0.913, 'pos': 0.087, 'compound': 0.5859}",0.5859
1449722157513256964,2021-10-17 13:01:11+00:00,Want your audience to understand the value of your events and how they get CPD for them? Our accreditation is a great way to achieve this – it's a recognised mark of quality. Get your events accredited today: https://t.co/lRuUWrQ7op https://t.co/gFO2MsYKps,"{'neg': 0.0, 'neu': 0.813, 'pos': 0.187, 'compound': 0.7783}",0.7783
1449707016394584066,2021-10-17 12:01:01+00:00,eLearning: ETAT+ is a well-established multi-professional course specifically designed for health professionals looking after children in low resource settings. It supports emergency care in the first 24 hrs of patient arrival at hospital. Find out more: https://t.co/eyBhivWidJ https://t.co/XHJDdZxtNE,"{'neg': 0.108, 'neu': 0.76, 'pos': 0.131, 'compound': 0.25}",0.25
1449405240688758790,2021-10-16 16:01:52+00:00,Learn the basics of how to assess children of all ages using clinical footage &amp; evidence based material. Find out more: https://t.co/4XV9a666FH https://t.co/yWPLEJ4vbp,"{'neg': 0.0, 'neu': 1.0, 'pos': 0.0, 'compound': 0.0}",0.0
1449390011992915977,2021-10-16 15:01:21+00:00,Child Protection: Recognition &amp; Response training helps discern the indicators in possible child abuse and neglect cases. It investigates the hidden signs which aren’t immediately obvious and provides a structured approach to managing this sensitive topic: https://t.co/JvCo3L3mjF https://t.co/3xr2hvOQJO,"{'neg': 0.164, 'neu': 0.776, 'pos': 0.059, 'compound': -0.6808}",-0.6808
1449359840585916416,2021-10-16 13:01:28+00:00,"Avoid the stress of tracking your CPD with our CPD Diary! It helps ensure your activity is up to date, and can manage your CPD activity, measuring its impact across your career. Find out more: https://t.co/2rfFb2Hp5b https://t.co/EgNelkaAjZ","{'neg': 0.115, 'neu': 0.759, 'pos': 0.126, 'compound': 0.126}",0.126
1449344693054197766,2021-10-16 12:01:17+00:00,"@MedsForChildren website relaunch: We’re looking forward to sharing our updated website with you! Relaunching this coming Monday, 18 October. Log on and check out all of the additional resources and guides it offers https://t.co/mvkFeolZav https://t.co/mDvEh6UcSX","{'neg': 0.0, 'neu': 0.917, 'pos': 0.083, 'compound': 0.4753}",0.4753
1449284190827077632,2021-10-16 08:00:52+00:00,"Our three research awards close next month. 

Have a look to see if you are eligible for the chance to win up to £2000. Find out more:  https://t.co/Nmlk4zxw8c https://t.co/DJm8L3Jnfz","{'neg': 0.0, 'neu': 0.74, 'pos': 0.26, 'compound': 0.8316}",0.8316
1449043391749181443,2021-10-15 16:04:01+00:00,Adolescent Health Programme - updated! It's our eLearning programme for healthcare professionals working with young people. It ensures that you have essential youth communication skills and understand young people’s rights to consent and confidentiality. https://t.co/iDCIJBAR9K https://t.co/DOJ1OGSDz7,"{'neg': 0.0, 'neu': 0.939, 'pos': 0.061, 'compound': 0.2942}",0.2942
1449027918475276295,2021-10-15 15:02:32+00:00,RCPCH-BPSU recorded webinar: Type 2 Diabetes in Children and Young People. Prof Julian Hamilton-Shield &amp; Prof Tim Barrett present practical information and guidance for managing type 2 diabetes in children. https://t.co/lvsyMFvTVG https://t.co/0JuFYkg8nz,"{'neg': 0.0, 'neu': 1.0, 'pos': 0.0, 'compound': 0.0}",0.0
1448997695494963232,2021-10-15 13:02:26+00:00,"The impact of climate change on child health at home and abroad: Join us virtually to be informed and inspired, and to find out about the impact of climate change on global child health and the roles and responsibilities of paediatricians https://t.co/VsQFZqBuZL https://t.co/GBM9FuQkjj","{'neg': 0.0, 'neu': 0.884, 'pos': 0.116, 'compound': 0.6597}",0.6597
1448982640124628999,2021-10-15 12:02:36+00:00,"Physician Associates in Paediatrics event: Including interesting talks and presentations, abstract presentations and quality improvement projects, as well as interactive workshops. https://t.co/fg7tOJXrUn https://t.co/iUFOsHcCmq","{'neg': 0.0, 'neu': 0.719, 'pos': 0.281, 'compound': 0.7783}",0.7783
1448955335742562306,2021-10-15 10:14:06+00:00,"“It’s one thing after the other at the moment- food then fuel then housing, school, Wi-Fi access…” says Dr Ian Sinha, “Everything is building up.”

Read the Insight article with @wheezylikesund1 on how fuel poverty affects child health - 
https://t.co/YFYgIiMR6J","{'neg': 0.08, 'neu': 0.92, 'pos': 0.0, 'compound': -0.5106}",-0.5106
1448936938363396096,2021-10-15 09:01:00+00:00,Are you an early career researcher? Apply for the chance to be the winner of the Simon Newell Early Independent Researcher award with the monetary prize of £2000. https://t.co/0i1hsHHzkG @GOSHCharity https://t.co/hTiLqshB40,"{'neg': 0.0, 'neu': 0.682, 'pos': 0.318, 'compound': 0.9118}",0.9118
1448680829484404743,2021-10-14 16:03:19+00:00,"Swallowing pills is an important life skill for children to learn. They’re less sickly than suspensions, have less sugar and more common in pharmacies. Take our short e-learning course. https://t.co/dHocw5OxTr
@YincentTse @nicola_vasey @EjLim9 https://t.co/l1Apx1oD6J","{'neg': 0.0, 'neu': 0.948, 'pos': 0.052, 'compound': 0.2023}",0.2023
1448665520882946057,2021-10-14 15:02:29+00:00,RCPCH-BPSU recorded webinar: Childhood Obesity – Surgical Management. Watch the recorded webinar on demand. Our experts present information and guidance for the surgical management of obesity in children: https://t.co/WhORB4YJlp https://t.co/vo7qDDV0LE,"{'neg': 0.051, 'neu': 0.949, 'pos': 0.0, 'compound': -0.128}",-0.128
1448635191145140229,2021-10-14 13:01:58+00:00,The impact of climate change on child health at home and abroad: Join us online for our first climate change event to find out about the impact of climate change on global child health and the roles and responsibilities of paediatricians https://t.co/VsQFZqBuZL https://t.co/WmJcnan01e,"{'neg': 0.0, 'neu': 0.95, 'pos': 0.05, 'compound': 0.296}",0.296
1448620084876939280,2021-10-14 12:01:56+00:00,🆕 online course: Statement &amp; Report Writing Scotland. Exploring how to write statements and reports that document the valuable information needed for effective investigation in Scottish child protection cases: https://t.co/wPzOevv1ku https://t.co/xwwtCZm6X3,"{'neg': 0.0, 'neu': 0.819, 'pos': 0.181, 'compound': 0.7351}",0.7351
1448567136717246468,2021-10-14 08:31:33+00:00,"""It is one of the joys and privileges of our profession, that we never stop learning, that our patients and their families teach us so many long lasting lessons.""

Read the final #RCPCHat25 blog by @cathrynchadwic1 VP for Training and Assessment: https://t.co/dMkkCsc9ev","{'neg': 0.0, 'neu': 0.835, 'pos': 0.165, 'compound': 0.7709}",0.7709
1448559483936968706,2021-10-14 08:01:08+00:00,"Have you published a paper in the last year? If you are a pre-consultant, apply to the Lorber Award for the chance to win £200 and free entry to the RCPCH Conference. Find out more: https://t.co/JK8oGnV70G https://t.co/Duqe1KSehK","{'neg': 0.0, 'neu': 0.711, 'pos': 0.289, 'compound': 0.9118}",0.9118
1448318682598420485,2021-10-13 16:04:17+00:00,"We can help with your RCPCH exams! Check out our online resources, there a range of items to help you, from preparation material to publications to sample papers. Visit our dedicated webpage: https://t.co/uySEKzs18n https://t.co/Ff3LODKpI9","{'neg': 0.0, 'neu': 0.775, 'pos': 0.225, 'compound': 0.8268}",0.8268
1448303061592682500,2021-10-13 15:02:12+00:00,"RCPCH recorded webinar: Childhood Obesity–Medical Management. Our experts present practical and current guidance on how to identify obesity in the clinic and offers an approach to broaching the subject with children, young people and their families https://t.co/SgSv2LNSkV https://t.co/MRnq1jHlsF","{'neg': 0.0, 'neu': 1.0, 'pos': 0.0, 'compound': 0.0}",0.0
1448272829405962252,2021-10-13 13:02:04+00:00,The impact of climate change on child health at home and abroad: Join us online for an exciting programme of speakers and sessions to understand the mental health needs of children and young people in relation to the climate emergency https://t.co/VsQFZqBuZL https://t.co/v8xjwVHHEw,"{'neg': 0.055, 'neu': 0.83, 'pos': 0.115, 'compound': 0.4215}",0.4215
1448257742511165445,2021-10-13 12:02:07+00:00,"🆕 online course: familiarise yourself with the DCH Clinical exam. Gain a greater understanding of the assessment criteria, the key skills required, the pitfalls to avoid by focusing on exam technique and, through practice, how to approach each station. https://t.co/bbzLOGF7yc https://t.co/jgsXPQeQ8m","{'neg': 0.05, 'neu': 0.816, 'pos': 0.134, 'compound': 0.5719}",0.5719
1448212030763278336,2021-10-13 09:00:29+00:00,"@AssimJavaid tells us what a day in paediatrics is like and the Variety that comes with it! For more information, check out our new paediatric training page  https://t.co/nTnbYhbQpK https://t.co/veGaZJZUce","{'neg': 0.0, 'neu': 0.906, 'pos': 0.094, 'compound': 0.4199}",0.4199
1448199056434544644,2021-10-13 08:08:55+00:00,Do you want to study a rare disease in children? Just 3 days left to apply ⬇️ https://t.co/F1hzNyqEFv,"{'neg': 0.0, 'neu': 0.92, 'pos': 0.08, 'compound': 0.0772}",0.0772
1448197092682436609,2021-10-13 08:01:07+00:00,"Join us for the Speciality Training at Level 1 live Q&amp;A on Monday 18 October. In this event, you will be able to to ask any questions you have on the newly updated ST recruitment process.
https://t.co/xyLWH5PuOP https://t.co/lf4oUBVhbS","{'neg': 0.0, 'neu': 0.942, 'pos': 0.058, 'compound': 0.296}",0.296
1447955983083483147,2021-10-12 16:03:02+00:00,🆕 Safeguarding CYP programme: Looked After Children. Helping you to recognise legislation related to looked after children and be confident in your knowledge of consent. Appreciate statutory health assessments needed. https://t.co/zAfsqUrBXb https://t.co/UqY7uBDBa1,"{'neg': 0.0, 'neu': 0.682, 'pos': 0.318, 'compound': 0.8779}",0.8779
1447940633658802184,2021-10-12 15:02:03+00:00,"RCPCH-BPSU Webinar: Did you miss the live webinar? Watch it on demand. Hear current evidence, guidance and information to increase awareness of lead exposure in children https://t.co/C8B2d9pTe7 https://t.co/KC0VZPfkrb","{'neg': 0.102, 'neu': 0.822, 'pos': 0.076, 'compound': 0.0516}",0.0516
1447910372493697026,2021-10-12 13:01:48+00:00,🆕 paediatric sepsis podcast–ep11: Sepsis recognition and care during the coronavirus pandemic. @ejlim8 &amp; @pus27 link up once again to reflect on experiences of the coronavirus pandemic on paediatric hospital admissions and the effect of the virus on CYP: https://t.co/WAS7vgVcGi https://t.co/rIoFdV1JmO,"{'neg': 0.0, 'neu': 0.924, 'pos': 0.076, 'compound': 0.4939}",0.4939
1447895321359552516,2021-10-12 12:01:59+00:00,🆕 online course: Expert witness in child protection: To equip paediatricians being called as expert witnesses with skills to produce constructive reports and effectively testify in court ensuring the best possible outcomes. Find out more: https://t.co/vraLJFRphT https://t.co/qgbUmSUIQb,"{'neg': 0.0, 'neu': 0.782, 'pos': 0.218, 'compound': 0.8481}",0.8481
1447834673586098182,2021-10-12 08:01:00+00:00,The PIER award closes next month. Apply now for the chance to be awarded for your involvement of patients and public in your paediatric research. The winners will get free entry to the RCPCH Conference. Find out more:  https://t.co/6CPsdRrzRf https://t.co/zwIuzXI54X,"{'neg': 0.0, 'neu': 0.706, 'pos': 0.294, 'compound': 0.9274}",0.9274
1447596477635776516,2021-10-11 16:14:29+00:00,RCPCH members can join 45 million other health professionals and sign the #HealthyClimate prescription letter here: https://t.co/RTXGsf3QFO https://t.co/SWEeP8edWO,"{'neg': 0.0, 'neu': 0.885, 'pos': 0.115, 'compound': 0.296}",0.296
1447593526007566342,2021-10-11 16:02:46+00:00,"🆕 Safeguarding CYP programme: Children Vulnerable to Abuse and Exploitation. Explores challenges in child protection, including ACEs, child trafficking and county lines, gang-based exploitation, missing children, forced marriage and honour-based violence. https://t.co/zAfsqUrBXb https://t.co/WCNxLmwSbD","{'neg': 0.352, 'neu': 0.571, 'pos': 0.078, 'compound': -0.9186}",-0.9186
1447578240655273987,2021-10-11 15:02:01+00:00,"Physician Associates in Paediatrics event: Bringing together people interested in Physician Associates – whether you now work as a PA or are keen to explore the profession, you work with PAs or are an employer seeing to recruit them. https://t.co/fg7tOJXrUn https://t.co/OhroTMXzIk","{'neg': 0.0, 'neu': 0.877, 'pos': 0.123, 'compound': 0.6369}",0.6369
1447548048415014913,2021-10-11 13:02:03+00:00,"🆕 episode of our paediatric #sepsis podcast–ep10: 2020 Sepsis Guidelines for children and young people. Prof @pus27 joins Dr @ejlim8 to discuss the first ever Sepsis Guidelines for children &amp; young people: https://t.co/bOv2twRZhn
@JonnyGucks https://t.co/foGQgkstWx","{'neg': 0.0, 'neu': 1.0, 'pos': 0.0, 'compound': 0.0}",0.0
1447533166814707713,2021-10-11 12:02:55+00:00,@MedsForChildren have been busy creating and building a new look website. Relaunch is now only one week away! Keep an eye on the website on Monday 18 October: https://t.co/mvkFeolZav https://t.co/O9N82aSAgr,"{'neg': 0.0, 'neu': 0.918, 'pos': 0.082, 'compound': 0.3595}",0.3595
1447527451027034117,2021-10-11 11:40:12+00:00,"A rise in chest infections in children is predicted for this winter. With @barnardos we’ve developed resources to help parents spot signs and symptoms that need medical help:

https://t.co/w2wyek4CNp 

#HWFund","{'neg': 0.0, 'neu': 0.833, 'pos': 0.167, 'compound': 0.6597}",0.6597
1447523053177556993,2021-10-11 11:22:44+00:00,"The climate crisis is the single biggest health threat facing humanity. The health community is calling on governments at @COP26  to take action.

RCPCH has signed the #HealthClimate prescription letter. 

Members can✍️here: https://t.co/RTXGsf3QFO","{'neg': 0.195, 'neu': 0.805, 'pos': 0.0, 'compound': -0.8176}",-0.8176
1447484580043313153,2021-10-11 08:49:51+00:00,"The cut to Universal Credit will push 200,000 children into poverty and will increase the number of children who will be disadvantaged in terms of physical and mental health.

#KeepTheLifeline https://t.co/68RB1vLAkU","{'neg': 0.206, 'neu': 0.636, 'pos': 0.158, 'compound': -0.4404}",-0.4404
1447472298823495680,2021-10-11 08:01:03+00:00,"We know that trainees sometimes struggle to embed Health Promotion and Illness Prevention into their portfolio, so we have put together some examples to help out. 

You can find out more here: https://t.co/lSQlXfh15t https://t.co/tRt44My6mO","{'neg': 0.129, 'neu': 0.801, 'pos': 0.07, 'compound': -0.3182}",-0.3182
1447230864870543360,2021-10-10 16:01:41+00:00,"Behaviours &amp; the emotions that surround them can mean many different things &amp; people respond to them in different ways. #DisabilityMatters offers insight into the possible meanings &amp; gives advice on how to respond positively, constructively &amp; effectively.
https://t.co/bQTZqDl8z6 https://t.co/rKPFIg46fo","{'neg': 0.0, 'neu': 0.858, 'pos': 0.142, 'compound': 0.743}",0.743
1447215651299332097,2021-10-10 15:01:13+00:00,RCPCH-BPSU recorded webinar: Type 2 Diabetes in Children and Young People. Prof Julian Hamilton-Shield &amp; Prof Tim Barrett present practical information and guidance for managing type 2 diabetes in children. https://t.co/lvsyMFNuNe https://t.co/XE7vwmLyID,"{'neg': 0.0, 'neu': 1.0, 'pos': 0.0, 'compound': 0.0}",0.0
1447185464457367561,2021-10-10 13:01:16+00:00,Child Protection: Recognition &amp; Response training helps discern the indicators in possible child abuse and neglect cases. It investigates the hidden signs which aren’t immediately obvious and provides a structured approach to managing this sensitive topic: https://t.co/JvCo3L3mjF https://t.co/DMqDhjL4qD,"{'neg': 0.164, 'neu': 0.776, 'pos': 0.059, 'compound': -0.6808}",-0.6808
1447170339092500482,2021-10-10 12:01:10+00:00,🆕 online course: Statement &amp; Report Writing Scotland. To equip Scottish paediatricians involved in child protection cases with the skills to produce accurate reports that ensure the best possible outcomes for the child. Find out more: https://t.co/wPzOevv1ku https://t.co/LbzKhGmpKz,"{'neg': 0.0, 'neu': 0.837, 'pos': 0.163, 'compound': 0.7783}",0.7783
1446868515034644490,2021-10-09 16:01:50+00:00,Our Spotting the Sick Child programme has over 5 hours of new footage of real patients. The online tool enables you to test your skills and knowledge of serious illness in children. Find out more: https://t.co/4XV9a666FH https://t.co/EGztvNSrsT,"{'neg': 0.181, 'neu': 0.819, 'pos': 0.0, 'compound': -0.743}",-0.743
1446853294618517509,2021-10-09 15:01:21+00:00,"RCPCH recorded webinar: Childhood Obesity–Medical Management. Our experts present practical and current guidance on how to identify obesity in the clinic and offers an approach to broaching the subject with children, young people and their families https://t.co/SgSv2LNSkV https://t.co/R0KOXfGdp8","{'neg': 0.0, 'neu': 1.0, 'pos': 0.0, 'compound': 0.0}",0.0
1446823072057724937,2021-10-09 13:01:15+00:00,ETAT+ eLearning is a well-established multi-professional course specifically designed for health professionals looking after children in low resource settings. It supports emergency care in the first 24 hrs of patient arrival at hospital. Find out more: https://t.co/eyBhivWidJ https://t.co/TUP4XXwj5D,"{'neg': 0.108, 'neu': 0.76, 'pos': 0.131, 'compound': 0.25}",0.25
1446808036501250056,2021-10-09 12:01:30+00:00,🆕 online course: Expert witness in child protection: Equipping you with the skills to produce constructive independent reports and to effectively testify in court to ensure the best possible outcomes as an expert witness. Find out more: https://t.co/vraLJFRphT https://t.co/24caQkdvku,"{'neg': 0.0, 'neu': 0.783, 'pos': 0.217, 'compound': 0.8658}",0.8658
1446506544313552898,2021-10-08 16:03:29+00:00,"GPs, school nurses, community paediatricians and child health teams – this course is for you! It ensures that you have essential youth communication skills and understand young people’s rights to consent and confidentiality, and more: https://t.co/iDCIJBAR9K https://t.co/i44FdEsFtX","{'neg': 0.0, 'neu': 0.941, 'pos': 0.059, 'compound': 0.2942}",0.2942
1446493158347579440,2021-10-08 15:10:18+00:00,"Help increase awareness of the challenges that air pollution causes - ride 1 million km for our children's air. #RideForTheirLives

Join the virtual ride 👇 https://t.co/1K1CTn8OJ4","{'neg': 0.0, 'neu': 0.691, 'pos': 0.309, 'compound': 0.7579}",0.7579
1446491155286401061,2021-10-08 15:02:20+00:00,"RCPCH-BPSU Webinar: Did you miss the live webinar? Watch it on demand. Hear current evidence, guidance and information to increase awareness of lead exposure in children https://t.co/C8B2d9pTe7 https://t.co/W4SW5mBx99","{'neg': 0.102, 'neu': 0.822, 'pos': 0.076, 'compound': 0.0516}",0.0516
1446468455868272665,2021-10-08 13:32:08+00:00,"The @RCPCHPresident Camilla Kingdon writes her latest message to members:

https://t.co/rhpshg99bs https://t.co/Ut3lgh7yPM","{'neg': 0.0, 'neu': 1.0, 'pos': 0.0, 'compound': 0.0}",0.0
1446460941495848962,2021-10-08 13:02:17+00:00,📖 Publication: ‘Clinical Cases for MRCPCH Foundation of Practice' for the FOP exam. This book gets to the heart of what examiners are looking for in successful candidate performance. Invaluable resource for those studying or preparing to apply for FOP. https://t.co/vIi9ScXYul https://t.co/RcK50bJ1Oi,"{'neg': 0.0, 'neu': 0.913, 'pos': 0.087, 'compound': 0.5859}",0.5859
1446445881969057794,2021-10-08 12:02:26+00:00,"Physician Associates in Paediatrics event: Bringing together people interested in Physician Associates – whether you now work as a PA or are keen to explore the profession, you work with PAs or are an employer seeing to recruit them. https://t.co/fg7tOJXrUn https://t.co/TFLCRCLEoi","{'neg': 0.0, 'neu': 0.877, 'pos': 0.123, 'compound': 0.6369}",0.6369
1446414980736237570,2021-10-08 09:59:39+00:00,"In this podcast, our Chief Executive, @8jorev and @RCPCHPresident Camilla Kingdon discuss COVID-19 vaccination in children and young people, a complex issue with much public focus.

You can listen to the full podcast here: https://t.co/DrFLjodILv","{'neg': 0.0, 'neu': 1.0, 'pos': 0.0, 'compound': 0.0}",0.0
1446400214248611855,2021-10-08 09:00:58+00:00,Are you an early career researcher in paediatrics? Apply for the Simon Newell award for the chance to win a £2000 prize:  https://t.co/opMh8sR5Wb @GOSHCharity https://t.co/3EERWzler4,"{'neg': 0.0, 'neu': 0.613, 'pos': 0.387, 'compound': 0.9118}",0.9118
1446395084652568589,2021-10-08 08:40:35+00:00,Deadline to submit is just a week away!⬇️ https://t.co/MPJY4CXBuJ,"{'neg': 0.0, 'neu': 1.0, 'pos': 0.0, 'compound': 0.0}",0.0
1446144102345678850,2021-10-07 16:03:16+00:00,"Teach kids how to swallow pills. They are more likely to stick to medication regimens, have less sugar and they’re less sickly than liquid medicines https://t.co/dHocw5OxTr
@YincentTse @nicola_vasey @EjLim9 https://t.co/jaoKrai4Xh","{'neg': 0.0, 'neu': 1.0, 'pos': 0.0, 'compound': 0.0}",0.0
1446113858968453132,2021-10-07 14:03:06+00:00,"""Day after day, mothers and fathers (and grandparents, siblings and foster parents) show up by their little one’s bedside.""

Toyin Ocholi gives a shout out to parents and carers in her #RCPCHat25 blog:
 https://t.co/XIz5TyHeGR","{'neg': 0.0, 'neu': 1.0, 'pos': 0.0, 'compound': 0.0}",0.0
1446098544276934663,2021-10-07 13:02:14+00:00,"RCPCH CPD approval demonstrates that your event meets essential quality criteria, including clear aims and objectives, faculty and presenter information, defined learning content and a suitable evaluation process. Get your events accredited today: https://t.co/lRuUWrQ7op https://t.co/0tTu7Eg10V","{'neg': 0.0, 'neu': 0.849, 'pos': 0.151, 'compound': 0.6908}",0.6908
1446083421894238208,2021-10-07 12:02:09+00:00,"🆕 online course: Statement &amp; Report Writing Scotland. A focused, advocate-led course to help paediatricians develop their statement and report writing skills, focused on Scottish law. Find out more: https://t.co/wPzOevv1ku https://t.co/GcmBdVl9fU","{'neg': 0.0, 'neu': 0.767, 'pos': 0.233, 'compound': 0.7845}",0.7845
1446037811656859662,2021-10-07 09:00:55+00:00,"@dr_emmacoombe tells us about her journey in paediatrics for this month's theme - variety in paediatrics! 

Check it out here https://t.co/9fZvLZeKAX https://t.co/d5bpCwV2v1","{'neg': 0.0, 'neu': 1.0, 'pos': 0.0, 'compound': 0.0}",0.0
1445786331070615570,2021-10-06 16:21:37+00:00,"Millions of families will be impacted by the biggest overnight cut to social security since the Second World War.

Read the RCPCH full response on the cut to #UniversalCredit 
https://t.co/NCDJELJU53 https://t.co/Vu9rZGEmmD","{'neg': 0.216, 'neu': 0.72, 'pos': 0.064, 'compound': -0.6908}",-0.6908
1445781798156374016,2021-10-06 16:03:36+00:00,🆕 Safeguarding CYP programme: Looked After Children. Helping you to recognise legislation related to looked after children and be confident in your knowledge of consent. Appreciate statutory health assessments needed. https://t.co/zAfsqUrBXb https://t.co/BeG7fR4NcE,"{'neg': 0.0, 'neu': 0.682, 'pos': 0.318, 'compound': 0.8779}",0.8779
1445766440523497477,2021-10-06 15:02:35+00:00,"The impact of climate change on child health at home and abroad: Join us virtually to be informed and inspired, and to find out about the impact of climate change on global child health and the roles and responsibilities of paediatricians https://t.co/VsQFZqjTBb https://t.co/KB7bqaM9wc","{'neg': 0.0, 'neu': 0.884, 'pos': 0.116, 'compound': 0.6597}",0.6597
1445736166448271369,2021-10-06 13:02:17+00:00,"Avoid the stress of tracking your CPD with our CPD Diary! It helps ensure your activity is up to date, and can manage your CPD activity, measuring its impact across your career. Find out more: https://t.co/2rfFb2YZWJ https://t.co/xiV5LNEgSu","{'neg': 0.115, 'neu': 0.759, 'pos': 0.126, 'compound': 0.126}",0.126
1445721078630916097,2021-10-06 12:02:20+00:00,"🆕 online course: Paediatric Sepsis. 1 day course exploring how to recognise and manage life-threatening sepsis. Taking you through the practical aspects of the recognition and management of sepsis, including the use of fluids, antibiotics and inotropes. https://t.co/8jO2nR2xKz https://t.co/iFAD7geXSF","{'neg': 0.0, 'neu': 1.0, 'pos': 0.0, 'compound': 0.0}",0.0
1445708673657884675,2021-10-06 11:13:02+00:00,"The £20-a-week cut to Universal Credit comes into effect today. Modelling by @jrf_uk indicates that a further 200,000 children will be dragged across the poverty line.

Read the full response from RCPCH: https://t.co/NCDJELJU53 https://t.co/h0Lx6s2694","{'neg': 0.173, 'neu': 0.759, 'pos': 0.068, 'compound': -0.4588}",-0.4588
1445687395521761285,2021-10-06 09:48:29+00:00,"Dr Camilla Kingdon, @RCPCHPresident introduces the brand new #ChoosePaediatrics programme in her blog.

Read it here! https://t.co/Y41t2qpGSf https://t.co/Ma2kqCarcI","{'neg': 0.0, 'neu': 1.0, 'pos': 0.0, 'compound': 0.0}",0.0
1445684384053424138,2021-10-06 09:36:31+00:00,@ianlewins I'm afraid we won't be accepting papers from lobsters.,"{'neg': 0.195, 'neu': 0.805, 'pos': 0.0, 'compound': -0.2924}",-0.2924
