id,created_at,text,scores,compound
1384160393413619723,2021-04-19 15:02:08+00:00,"RCPCH Conference: We’re excited to present a wide range of topical sessions at this year's RCPCH Conference. Attend workshops exploring issues affecting paediatrics and child health, and update your knowledge on the latest advances in your specialty https://t.co/nmYVP6nGyT https://t.co/U1Fpd2X7pJ","{'neg': 0.0, 'neu': 0.939, 'pos': 0.061, 'compound': 0.34}",0.34
1384130189769076754,2021-04-19 13:02:07+00:00,The BPSU in collaboration with PHE is hosting a free 2-day symposia series exploring the impact of COVID-19 from a paediatric perspective. Find out more https://t.co/5yTJsrR5l8 https://t.co/q9tdOH40Zo,"{'neg': 0.0, 'neu': 0.879, 'pos': 0.121, 'compound': 0.5106}",0.5106
1384130047519248386,2021-04-19 13:01:33+00:00,"A journalist from BBC radio 4 wants to speak with a paediatrician, based in Birmingham, about yesterday's infant mortality report. If interested please DM me or email press.office@rcpch.ac.uk","{'neg': 0.0, 'neu': 0.821, 'pos': 0.179, 'compound': 0.6124}",0.6124
1384114959039094788,2021-04-19 12:01:36+00:00,LAST FEW PLACES! Online workshop for overseas candidates: Taking the 2021 FOP exam? This workshop is for you! Explore topics that have proven particularly challenging. You’ll find them incredibly useful and helpful. Register https://t.co/cQiwNAkIS6 https://t.co/7PBOp9vqX2,"{'neg': 0.0, 'neu': 0.786, 'pos': 0.214, 'compound': 0.8287}",0.8287
1383812912255356937,2021-04-18 16:01:22+00:00,#DisabilityMatters: Health &amp; Wellbeing sessions help you to think about the needs &amp; functioning of #disabled children &amp; young people. Pitfalls highlighted &amp; guidance provided on positive &amp; practical ways to achieve equal access &amp; best possible outcomes https://t.co/bQTZqDCJqE https://t.co/npwfyKLKrO,"{'neg': 0.0, 'neu': 0.779, 'pos': 0.221, 'compound': 0.8885}",0.8885
1383797774693519360,2021-04-18 15:01:13+00:00,Want to advertise your educational event to thousands of paediatricians and other child health professionals? RCPCH CPD approval is a recognised mark of quality. Get your course accredited today: https://t.co/lRuUWs7IfX https://t.co/SH0Zxc36Xl,"{'neg': 0.0, 'neu': 0.864, 'pos': 0.136, 'compound': 0.5267}",0.5267
1383767675151601673,2021-04-18 13:01:37+00:00,ALSG safeguarding courses. Maintain your safeguarding competencies with Child Protection: Recognition and Response (for ST1 onwards) and Child Protection in Practice (for ST4 onwards). Developed and supported in partnership with RCPCH. Find out more: https://t.co/VhH52TU0lI https://t.co/O7wWnmRwvl,"{'neg': 0.0, 'neu': 0.835, 'pos': 0.165, 'compound': 0.6705}",0.6705
1383519474075066370,2021-04-17 20:35:21+00:00,"New webinar recording: Supporting the drive to digitise healthcare, we have developed a new Growth Charts API to calculate centiles for height, weight, head circumference and BMI: https://t.co/vb0AwIMRQG https://t.co/7IVaZdsaws","{'neg': 0.0, 'neu': 0.825, 'pos': 0.175, 'compound': 0.6705}",0.6705
1383435466679017473,2021-04-17 15:01:32+00:00,Our CPD Diary is easy to use and empowers you to manage activities and measure the impact of CPD across your career. Find out more: https://t.co/2rfFb2YZWJ https://t.co/UpkV75xysI,"{'neg': 0.0, 'neu': 0.9, 'pos': 0.1, 'compound': 0.4404}",0.4404
1383405370933006340,2021-04-17 13:01:57+00:00,"MRCPCH Theory &amp; Science online lectures: 15 videos designed to help with the TAS exam that candidates found most difficult. “Extremely useful, helped me to understand what the examiners are looking for and how best to approach the questions.” https://t.co/MxAGzUud7p https://t.co/Qg3ecaSmWk","{'neg': 0.056, 'neu': 0.742, 'pos': 0.202, 'compound': 0.8058}",0.8058
1383390045449588739,2021-04-17 12:01:03+00:00,RCPCH Conference: Join us to hear @HelenBevanTweet and @goranhenriks deliver the opening keynote at our first Plenary session ‘Leadership and innovation in a time of crisis’. Book your place today https://t.co/nmYVP6nGyT https://t.co/hRcuJSvIE3,"{'neg': 0.0, 'neu': 0.858, 'pos': 0.142, 'compound': 0.5859}",0.5859
1383088443048230913,2021-04-16 16:02:36+00:00,"New webinar: Cases of type 2 diabetes are rising, but it’s still relatively rare in children. Symptoms may not always be clear to paediatricians who have not encountered diabetes before and late or misdiagnoses can cause additional problems. Find out more https://t.co/jHiIwvVwXW https://t.co/O6RDtoGJHf","{'neg': 0.137, 'neu': 0.863, 'pos': 0.0, 'compound': -0.745}",-0.745
1383073289086586885,2021-04-16 15:02:23+00:00,"St David's Day Conference: Listen again! Attendees to the conference can listen to the sessions recorded on the day. Contact the Events team for details: events@rcpch.ac.uk
@SDDC21 https://t.co/BLSzW2XLEt","{'neg': 0.0, 'neu': 1.0, 'pos': 0.0, 'compound': 0.0}",0.0
1383043051334078464,2021-04-16 13:02:13+00:00,FOP exam workshop: our popular FOP workshops are running again for the next exam. Candidates can explore the topics that are the most challenging for those overseas. Find out more: https://t.co/cQiwNA380y https://t.co/byMz5dNxIC,"{'neg': 0.0, 'neu': 0.865, 'pos': 0.135, 'compound': 0.5709}",0.5709
1383027902866919425,2021-04-16 12:02:02+00:00,RCPCH Conference: Prof @devisridhar will be sharing her thoughts in her keynote 'What precious lessons have we learnt from the pandemic that will help us tackle the challenges for child health in the future?'. Book your place today to hear her speak https://t.co/nmYVP665Hl https://t.co/AWSpYzuJ4U,"{'neg': 0.0, 'neu': 0.792, 'pos': 0.208, 'compound': 0.8591}",0.8591
1382973067593400322,2021-04-16 08:24:08+00:00,"@ed_abrahamson @FrankieBridge Hi Ed, could you DM us your contact details? We'd be very interested to hear more - thanks, Mark","{'neg': 0.0, 'neu': 0.744, 'pos': 0.256, 'compound': 0.734}",0.734
1382710858304913413,2021-04-15 15:02:12+00:00,Spotting the Sick Child website has been updated. Outstanding resource to help healthcare professionals assess acutely sick children. Check it out: https://t.co/4XV9a666FH https://t.co/3Hld3oogO5,"{'neg': 0.204, 'neu': 0.588, 'pos': 0.207, 'compound': 0.0258}",0.0258
1382680611693989889,2021-04-15 13:02:01+00:00,📖 Publication: ‘Clinical Cases for MRCPCH Foundation of Practice' for the FOP exam. This book gets to the heart of what examiners are looking for in successful candidate performance. Invaluable resource for those studying or preparing to apply for FOP. https://t.co/vIi9ScXYul https://t.co/NrFm7viL3L,"{'neg': 0.0, 'neu': 0.913, 'pos': 0.087, 'compound': 0.5859}",0.5859
1382665401557991424,2021-04-15 12:01:35+00:00,RCPCH Conference: Join us online to hear Dr @agnesbinagwaho deliver her keynote speech at the Plenary session ‘The Impact of COVID-19 globally on achieving Sustainable Development Goals’. Book your place today https://t.co/nmYVP665Hl https://t.co/EupdDCQuPb,"{'neg': 0.0, 'neu': 0.936, 'pos': 0.064, 'compound': 0.296}",0.296
1382363780408094721,2021-04-14 16:03:02+00:00,"New webinar: Behçet’s Syndrome in CYP. Understand how children are affected by Behçet’s and improve differential diagnoses and investigations. https://t.co/tZF0RqjFv8
@BehcetsUK @RheumatologyUK @BPSUtweet https://t.co/uCl2UZcfar","{'neg': 0.06, 'neu': 0.83, 'pos': 0.109, 'compound': 0.3182}",0.3182
1382348562680446977,2021-04-14 15:02:34+00:00,The BPSU in collaboration with PHE is hosting a free 2-day symposia series exploring the impact of COVID-19 from a paediatric perspective. Find out more https://t.co/5yTJss8GJI https://t.co/HmIaYMK9rA,"{'neg': 0.0, 'neu': 0.879, 'pos': 0.121, 'compound': 0.5106}",0.5106
1382338324174626817,2021-04-14 14:21:53+00:00,"Yesterday we reported an administrative issue related to paediatric training offers. 

We have worked with @NHS_HealthEdEng to investigate and the issue is now resolved. 

No candidate will be disadvantaged and no offer will be withdrawn. More information: https://t.co/LzqWE33hj2","{'neg': 0.166, 'neu': 0.794, 'pos': 0.04, 'compound': -0.6597}",-0.6597
1382318327381565440,2021-04-14 13:02:26+00:00,"New online course: offering a clear, structured approach to assessing motor development, help recognising abnormal development, guidance on reporting clinical findings, skills to recognise common disorders, and more: https://t.co/Dbxq6LbO8Q https://t.co/xEj403xekw","{'neg': 0.0, 'neu': 0.836, 'pos': 0.164, 'compound': 0.6486}",0.6486
1382303022903144454,2021-04-14 12:01:37+00:00,Hear @DrGuddiSingh share her views in her keynote–‘Climate change will worsen inequalities – what is the role of the paediatrician?' on 16 June. Book your place today https://t.co/nmYVP665Hl https://t.co/GUPIwwEXZg,"{'neg': 0.105, 'neu': 0.825, 'pos': 0.07, 'compound': -0.2732}",-0.2732
1382257574754537472,2021-04-14 09:01:01+00:00,"RCPCH Committee vacancies are open! Apply by 9:30am BST, Monday 10 May at https://t.co/1hf2ncEZJX","{'neg': 0.0, 'neu': 1.0, 'pos': 0.0, 'compound': 0.0}",0.0
1382024657327562752,2021-04-13 17:35:29+00:00,"@EMcCabe95 Hi Emma, we're looking into that right now and will have more details tomorrow ASAP. We'll post an update here and on the website - Mark","{'neg': 0.0, 'neu': 1.0, 'pos': 0.0, 'compound': 0.0}",0.0
1382001179274657796,2021-04-13 16:02:12+00:00,New online course: Mentoring skills. A one-day interactive course designed to equip you with the essentials to begin effective mentoring relationships. Also ideal as a refresher for previous attendees and mentors https://t.co/HJZ7B40cAJ https://t.co/BLkC5eYOc8,"{'neg': 0.0, 'neu': 0.817, 'pos': 0.183, 'compound': 0.7579}",0.7579
1381986055541362692,2021-04-13 15:02:06+00:00,"Pills are a better, easier and healthier way for children to take medication. Take our short eLearning session developed to help healthcare professionals and carers to teach children how to swallow pills. https://t.co/dHocw5OxTr
@YincentTse @nicola_vasey @EjLim9 https://t.co/eJjy2Ibg2L","{'neg': 0.0, 'neu': 0.797, 'pos': 0.203, 'compound': 0.8126}",0.8126
1381955928115793923,2021-04-13 13:02:23+00:00,"Taking the MRCPCH Clinical exam in June? Our online course will help you gain a better understanding of the key skills required and pitfalls to avoid. Focus on exam technique and prep for the stations, and more. Register your interest: https://t.co/fSq8fS9iIq https://t.co/mgoduFc5Yr","{'neg': 0.044, 'neu': 0.713, 'pos': 0.243, 'compound': 0.8768}",0.8768
1381940604968525828,2021-04-13 12:01:30+00:00,RCPCH Conference: Join us to hear Dr @watts_nick give a keynote at the plenary session ‘Is the pandemic a threat to or an opportunity for tackling climate change?’ Book your place today https://t.co/nmYVP665Hl https://t.co/7UpuC07di8,"{'neg': 0.091, 'neu': 0.775, 'pos': 0.134, 'compound': 0.1531}",0.1531
1381727685269987330,2021-04-12 21:55:26+00:00,🤗 https://t.co/zXRBPLXS4v,"{'neg': 0.0, 'neu': 1.0, 'pos': 0.0, 'compound': 0.0}",0.0
1381657421987340289,2021-04-12 17:16:14+00:00,@JenHope24 @LondonPaeds Congratulations Jennifer!,"{'neg': 0.0, 'neu': 0.417, 'pos': 0.583, 'compound': 0.636}",0.636
1381642733928976387,2021-04-12 16:17:52+00:00,How can paediatricians support Muslim children and young people and their families this Ramadan? - @nadiashad8   https://t.co/EjAzMdjXed,"{'neg': 0.0, 'neu': 0.847, 'pos': 0.153, 'compound': 0.4019}",0.4019
1381638823726178310,2021-04-12 16:02:19+00:00,"St David's Day Conference: If you attended the conference then you can revisit the recorded sessions by contacting the events team for details events@rcpch.ac.uk
@SDDC21 https://t.co/JqF0ewe7wl","{'neg': 0.0, 'neu': 1.0, 'pos': 0.0, 'compound': 0.0}",0.0
1381623654484693003,2021-04-12 15:02:03+00:00,New eLearning: ETAT+ is a well-established multi-professional course for health professionals looking after children in low resource settings. Learn more: https://t.co/eyBhivWidJ https://t.co/hi9Sg586c8,"{'neg': 0.095, 'neu': 0.905, 'pos': 0.0, 'compound': -0.2732}",-0.2732
1381609358820249601,2021-04-12 14:05:14+00:00,Help ensure your fellow trainee paediatricians are represented across the College's activities. We're recruiting a new Vice Chair of the Trainees’ Committee. Find out more about this role and other opportunities for trainees - https://t.co/2tyWitdkj5 https://t.co/F31tEuzaHP,"{'neg': 0.0, 'neu': 0.797, 'pos': 0.203, 'compound': 0.7845}",0.7845
1381593211693633544,2021-04-12 13:01:05+00:00,"New online course: Paediatricians have a key role in providing evidence and presenting as a professional witness in family, criminal or civil proceedings in child protection cases. This 2 day course gives you the skills required to fulfil these duties: https://t.co/eASgMzxnmP https://t.co/PvnWONDsoN","{'neg': 0.082, 'neu': 0.918, 'pos': 0.0, 'compound': -0.5267}",-0.5267
1381578211654565888,2021-04-12 12:01:28+00:00,RCPCH Conference: We’re excited to announce Sir @MichaelMarmot will be delivering a keynote speech. Join us to hear 'Building back fairer for children and young people' on 15 June. Book your place today to hear him https://t.co/nmYVP665Hl https://t.co/7ZbBL7Zujw,"{'neg': 0.0, 'neu': 0.884, 'pos': 0.116, 'compound': 0.5574}",0.5574
1381276214611095554,2021-04-11 16:01:27+00:00,"Developed by disabled young people, parent carers and experts, #DisabilityMatters has bite-sized modules matching the needs of individuals, groups &amp; sectors. It has practical advice about supporting disabled children, young people &amp; their families. https://t.co/bQTZqDl8z6 https://t.co/mRJq3KI6db","{'neg': 0.0, 'neu': 0.923, 'pos': 0.077, 'compound': 0.4404}",0.4404
1381261063451201538,2021-04-11 15:01:14+00:00,Want to advertise your educational event to thousands of paediatricians and other child health professionals? RCPCH CPD approval is a recognised mark of quality. Get your course accredited today: https://t.co/lRuUWrQ7op https://t.co/tIH13URSI4,"{'neg': 0.0, 'neu': 0.864, 'pos': 0.136, 'compound': 0.5267}",0.5267
1381230869743075329,2021-04-11 13:01:16+00:00,ALSG safeguarding courses. Maintain your safeguarding competencies with Child Protection: Recognition and Response (for ST1 onwards) and Child Protection in Practice (for ST4 onwards). Developed and supported in partnership with RCPCH. Find out more: https://t.co/VhH52TCpua https://t.co/MdcBnWzg99,"{'neg': 0.0, 'neu': 0.835, 'pos': 0.165, 'compound': 0.6705}",0.6705
1381215695908798464,2021-04-11 12:00:58+00:00,RCPCH Conference: Join us to hear @HelenBevanTweet and @goranhenriks deliver the opening keynote at our first Plenary session ‘Leadership and innovation in a time of crisis’. Book your place today https://t.co/nmYVP665Hl https://t.co/ytuRfQCEzm,"{'neg': 0.0, 'neu': 0.858, 'pos': 0.142, 'compound': 0.5859}",0.5859
1380913879102930946,2021-04-10 16:01:39+00:00,"New webinar recording: Supporting the drive to digitise healthcare, we have developed a new Growth Charts API to calculate centiles for height, weight, head circumference and BMI: https://t.co/vb0AwJ4tfg https://t.co/RMPmvzDS5x","{'neg': 0.0, 'neu': 0.825, 'pos': 0.175, 'compound': 0.6705}",0.6705
1380898747064975362,2021-04-10 15:01:31+00:00,Our CPD Diary is easy to use and empowers you to manage activities and measure the impact of CPD across your career. Find out more: https://t.co/2rfFb2Hp5b https://t.co/f6VlGoUQVc,"{'neg': 0.0, 'neu': 0.9, 'pos': 0.1, 'compound': 0.4404}",0.4404
1380868534893473795,2021-04-10 13:01:28+00:00,"MRCPCH Theory &amp; Science online lectures: 15 videos designed to help with the TAS exam that candidates found most difficult. “Extremely useful, helped me to understand what the examiners are looking for and how best to approach the questions.” https://t.co/MxAGzUcCfR https://t.co/jG7rC2tgg4","{'neg': 0.056, 'neu': 0.742, 'pos': 0.202, 'compound': 0.8058}",0.8058
1380853334752518149,2021-04-10 12:01:04+00:00,RCPCH Conference: Prof @devisridhar will be sharing her thoughts in her keynote 'What precious lessons have we learnt from the pandemic that will help us tackle the challenges for child health in the future?'. Book your place today to hear her speak https://t.co/nmYVP665Hl https://t.co/dD8QwMtvCN,"{'neg': 0.0, 'neu': 0.792, 'pos': 0.208, 'compound': 0.8591}",0.8591
1380551847442837505,2021-04-09 16:03:04+00:00,"New webinar: Cases of type 2 diabetes are rising, but it’s still relatively rare in children. Symptoms may not always be clear to paediatricians who have not encountered diabetes before and late or misdiagnoses can cause additional problems. Find out more https://t.co/jHiIwvVwXW https://t.co/URIeYzS8ve","{'neg': 0.137, 'neu': 0.863, 'pos': 0.0, 'compound': -0.745}",-0.745
1380536756232130563,2021-04-09 15:03:06+00:00,The BPSU in collaboration with PHE is hosting a free 2-day symposia series exploring the impact of COVID-19 from a paediatric perspective. Find out more https://t.co/5yTJss8GJI https://t.co/BAXthCBkdb,"{'neg': 0.0, 'neu': 0.879, 'pos': 0.121, 'compound': 0.5106}",0.5106
1380531988742950913,2021-04-09 14:44:09+00:00,Important survey for Muslim parents and carers on the current Routine Childhood Vaccination Programme 👇 https://t.co/6lJu6BDYdi,"{'neg': 0.0, 'neu': 0.886, 'pos': 0.114, 'compound': 0.2023}",0.2023
1380521406723719173,2021-04-09 14:02:06+00:00,"Trainees and consultants in our CSAC (committee) for paediatric allergy, immunology and infectious diseases have produced a guide for their educational supervisors - and hope it inspires other sub-specialties. Read more and download the guide - https://t.co/mosfAOYyX6 https://t.co/Hf0GAaJWfR","{'neg': 0.0, 'neu': 0.851, 'pos': 0.149, 'compound': 0.7003}",0.7003
1380506432227921923,2021-04-09 13:02:36+00:00,"New online course: offering a clear, structured approach to assessing motor development, help recognising abnormal development, guidance on reporting clinical findings, skills to recognise common disorders, and more: https://t.co/Dbxq6LbO8Q https://t.co/ff7XgJaQlo","{'neg': 0.0, 'neu': 0.836, 'pos': 0.164, 'compound': 0.6486}",0.6486
1380501402133364736,2021-04-09 12:42:37+00:00,"We extend our condolences to our Patron, @HRHPrincessAnne, and the rest of the @RoyalFamily.","{'neg': 0.0, 'neu': 0.884, 'pos': 0.116, 'compound': 0.1779}",0.1779
1380491123634896897,2021-04-09 12:01:46+00:00,RCPCH Conference: Join us online to hear Dr @agnesbinagwaho deliver her keynote speech at the Plenary session ‘The Impact of COVID-19 globally on achieving Sustainable Development Goals’. Book your place today https://t.co/nmYVP665Hl https://t.co/XWl37OYqpD,"{'neg': 0.0, 'neu': 0.936, 'pos': 0.064, 'compound': 0.296}",0.296
1380174180545662976,2021-04-08 15:02:21+00:00,Do you assess children for serious illness? Update your skills and test your knowledge with the updated and relaunched Spotting the Sick Child website: https://t.co/4XV9a666FH https://t.co/ZEIeSpUD5N,"{'neg': 0.241, 'neu': 0.759, 'pos': 0.0, 'compound': -0.743}",-0.743
1380143926653427716,2021-04-08 13:02:08+00:00,"Taking the MRCPCH Clinical exam in June? Our online course will help you gain a better understanding of the key skills required and pitfalls to avoid. Focus on exam technique and prep for the stations, and more. Register your interest: https://t.co/fSq8fS9iIq https://t.co/9SEPWq5y4o","{'neg': 0.044, 'neu': 0.713, 'pos': 0.243, 'compound': 0.8768}",0.8768
1380128687694172163,2021-04-08 12:01:35+00:00,RCPCH Conference: Hear @DrGuddiSingh share her views in her keynote–‘Climate change will worsen inequalities – what is the role of the paediatrician?' on 16 June. Book your place today https://t.co/nmYVP665Hl https://t.co/fboeZdTmpR,"{'neg': 0.099, 'neu': 0.836, 'pos': 0.066, 'compound': -0.2732}",-0.2732
1380086490559094786,2021-04-08 09:13:54+00:00,You can read our response to the Commission on Race and Ethnic Disparities report here: https://t.co/2Hkwuj5nip,"{'neg': 0.0, 'neu': 1.0, 'pos': 0.0, 'compound': 0.0}",0.0
1380086488365465608,2021-04-08 09:13:54+00:00,👇 https://t.co/auCZ9mkYjM,"{'neg': 0.0, 'neu': 1.0, 'pos': 0.0, 'compound': 0.0}",0.0
1379827135469260801,2021-04-07 16:03:19+00:00,"New webinar: Behçet’s Syndrome in CYP. Understand how children are affected by Behçet’s and improve differential diagnoses and investigations. https://t.co/tZF0RqjFv8
@BehcetsUK @RheumatologyUK @BPSUtweet https://t.co/MrZ3BDTT4T","{'neg': 0.06, 'neu': 0.83, 'pos': 0.109, 'compound': 0.3182}",0.3182
1379811905645199367,2021-04-07 15:02:48+00:00,"Recruiting Stepping Up Champions. How do we support senior trainees going into new consultant roles? With our Stepping Up programme, run by a network of doctors. Take the opportunity to give something back by signing up as a champion. Find out more: https://t.co/PU0nLqIxOB https://t.co/DQeq3EeSu0","{'neg': 0.0, 'neu': 0.748, 'pos': 0.252, 'compound': 0.9153}",0.9153
1379804591718608897,2021-04-07 14:33:44+00:00,We're delighted that @EvolvingPatient will be joining us as Chair of the Board of Trustees from November. https://t.co/JVhVVS6H2M https://t.co/JTVFi9HSzl,"{'neg': 0.0, 'neu': 0.787, 'pos': 0.213, 'compound': 0.5574}",0.5574
1379781610594299905,2021-04-07 13:02:25+00:00,"New online course: Paediatricians have a key role in providing evidence and presenting as a professional witness in family, criminal or civil proceedings in child protection cases. This 2 day course gives you the skills required to fulfil these duties: https://t.co/eASgMzxnmP https://t.co/hA3u7P7eBf","{'neg': 0.082, 'neu': 0.918, 'pos': 0.0, 'compound': -0.5267}",-0.5267
1379768569148346370,2021-04-07 12:10:36+00:00,We're proud to be members of the #InequalitiesInHealthAlliance. Government must act now to reduce widening health inequalities. #WorldHealthDay https://t.co/GTdM04fqIl,"{'neg': 0.0, 'neu': 0.853, 'pos': 0.147, 'compound': 0.4767}",0.4767
1379766450517389313,2021-04-07 12:02:11+00:00,RCPCH Conference: Join us to hear Dr @watts_nick give a keynote at the plenary session ‘Is the pandemic a threat to or an opportunity for tackling climate change?’ Book your place today https://t.co/nmYVP665Hl https://t.co/a6gTvdAgIP,"{'neg': 0.091, 'neu': 0.775, 'pos': 0.134, 'compound': 0.1531}",0.1531
1379464630519672833,2021-04-06 16:02:51+00:00,"Last chance to see the amazing collection of St David's Day Conference ePosters - closes tomorrow: https://t.co/GByvO6lCQZ
@SDDC21 https://t.co/FTu6G1ULQ1","{'neg': 0.0, 'neu': 0.734, 'pos': 0.266, 'compound': 0.7003}",0.7003
1379449488490831872,2021-04-06 15:02:41+00:00,"Pills are a better, easier and healthier way for children to take medication. Take our short eLearning session developed to help healthcare professionals and carers to teach children how to swallow pills. https://t.co/dHocw5OxTr
@YincentTse @nicola_vasey @EjLim9 https://t.co/iyuJpmcjrt","{'neg': 0.0, 'neu': 0.797, 'pos': 0.203, 'compound': 0.8126}",0.8126
1379419165396729859,2021-04-06 13:02:12+00:00,FOP exam workshop: our popular FOP workshops are running again for the next exam. Candidates can explore the topics that are the most challenging for those overseas. Find out more: https://t.co/cQiwNA380y https://t.co/W0hrwntRcp,"{'neg': 0.0, 'neu': 0.865, 'pos': 0.135, 'compound': 0.5709}",0.5709
1379403898876755968,2021-04-06 12:01:32+00:00,RCPCH Conference: We’re excited to announce Sir @MichaelMarmot will be delivering a keynote speech. Join us to hear 'Building back fairer for children and young people' on 15 June. Book your place today to hear him https://t.co/nmYVP665Hl https://t.co/JCV0o7D47E,"{'neg': 0.0, 'neu': 0.884, 'pos': 0.116, 'compound': 0.5574}",0.5574
1379393941150261250,2021-04-06 11:21:58+00:00,"State of Child Health 2020 highlighted big inequalities in childhood obesity rates in the most and least deprived communities.  Only a comprehensive approach to reducing rates of obesity, including the online junk food ad restrictions, will address this. https://t.co/21BgrklfYy","{'neg': 0.0, 'neu': 0.883, 'pos': 0.117, 'compound': 0.5788}",0.5788
1379393939485122565,2021-04-06 11:21:57+00:00,We've joined over 90 other organisations and experts to sign this letter to the PM. #AdEnough https://t.co/aNPDWVcQcX,"{'neg': 0.0, 'neu': 1.0, 'pos': 0.0, 'compound': 0.0}",0.0
1379349325206196225,2021-04-06 08:24:40+00:00,We have joined this call along with 12 other organisations following the recommendation of the Williams Review in 2018 https://t.co/1z9WgKtuCu https://t.co/W59kIgSqMZ,"{'neg': 0.0, 'neu': 1.0, 'pos': 0.0, 'compound': 0.0}",0.0
1379102326334615557,2021-04-05 16:03:11+00:00,"St David's Day Conference: You will still be able to see the great selection of abstracts presented as ePosters for the conference until 7 April: https://t.co/GByvO6lCQZ
@SDDC21 https://t.co/nCEfkHnJOL","{'neg': 0.0, 'neu': 0.864, 'pos': 0.136, 'compound': 0.6249}",0.6249
1379087016596475904,2021-04-05 15:02:21+00:00,New eLearning: ETAT+ is a well-established multi-professional course for health professionals looking after children in low resource settings. Learn more: https://t.co/eyBhivWidJ https://t.co/pTYJCuqObQ,"{'neg': 0.095, 'neu': 0.905, 'pos': 0.0, 'compound': -0.2732}",-0.2732
1379056713421180933,2021-04-05 13:01:56+00:00,📖 Publication: ‘Clinical Cases for MRCPCH Foundation of Practice' for the FOP exam. This book gets to the heart of what examiners are looking for in successful candidate performance. Invaluable resource for those studying or preparing to apply for FOP. https://t.co/vIi9ScXYul https://t.co/rjbBIZYjsC,"{'neg': 0.0, 'neu': 0.913, 'pos': 0.087, 'compound': 0.5859}",0.5859
1379041485585272833,2021-04-05 12:01:26+00:00,RCPCH Conference: Prof @JaideepPrabhu will be sharing some outstanding insights in his keynote ‘Lessons for Child Health: Learning from innovations and ideas outside medicine’. Book your place today to hear https://t.co/nmYVP665Hl https://t.co/yGFWHIIBjg,"{'neg': 0.0, 'neu': 0.815, 'pos': 0.185, 'compound': 0.7783}",0.7783
