id,created_at,text,scores,compound
1420757489457328130,2021-07-29 14:45:56+00:00,"Respiratory Surge in Children programme aims to provide resources for colleagues caring for children presenting with respiratory illness.
– by @PICSociety @HEE_TEL @ICS_updates and #NHSLTLC

You can find the resources here: https://t.co/qYM6dgPKjP","{'neg': 0.077, 'neu': 0.831, 'pos': 0.092, 'compound': 0.128}",0.128
1420731314102276102,2021-07-29 13:01:55+00:00,"Spotting the Sick Child is an incredibly useful online resource for professional development, and as teaching material for others https://t.co/4XV9a666FH https://t.co/e6n2DVWGAE","{'neg': 0.129, 'neu': 0.745, 'pos': 0.125, 'compound': -0.0276}",-0.0276
1420716127668342785,2021-07-29 12:01:35+00:00,NEW! FOP exam workshop: our popular FOP workshops are running again for the next exam. Candidates can explore the topics that are the most challenging for those overseas. Find out more https://t.co/cQiwNA380y https://t.co/bIWfp7w8sB,"{'neg': 0.0, 'neu': 0.861, 'pos': 0.139, 'compound': 0.6105}",0.6105
1420691713300078592,2021-07-29 10:24:34+00:00,"""It is imperative that as paediatricians, we support, participate and lead research. We owe it to our patients and families... to learn from their stories and keep searching for the answers."" 

A new blog by @DrCBattersby for #RCPCHat25

https://t.co/bo3fUYgTJ2","{'neg': 0.0, 'neu': 0.932, 'pos': 0.068, 'compound': 0.4019}",0.4019
1420670658854506496,2021-07-29 09:00:54+00:00,Are you interested in learning more about getting involved in paediatric research? With @NIHRcommunity we’re holding a day of talks and workshops for current and aspiring academic trainees – find out more https://t.co/g2FqLjj7yI https://t.co/KO5nTRo1tl,"{'neg': 0.0, 'neu': 0.92, 'pos': 0.08, 'compound': 0.4019}",0.4019
1420414688194617357,2021-07-28 16:03:46+00:00,"RCPCH Webinar: Childhood Obesity – Medical Management. Our experts present practical and current guidance on how to identify obesity in the clinic and offers an approach to broaching the subject with children, young people and their families: https://t.co/l3TvI9jpoG https://t.co/voXafuv7ZD","{'neg': 0.0, 'neu': 1.0, 'pos': 0.0, 'compound': 0.0}",0.0
1420399226996105217,2021-07-28 15:02:20+00:00,"New online course: Raising awareness of FASD. Equips paediatricians to be able to assess children in clinics and ensures that a broad formulation, rather than a single diagnosis, is considered to help a child receive the appropriate support they require: https://t.co/e89kWj3yEX https://t.co/Hx3bIaAnHO","{'neg': 0.0, 'neu': 0.873, 'pos': 0.127, 'compound': 0.6597}",0.6597
1420393341536161794,2021-07-28 14:38:56+00:00,We're delighted to have been shortlisted for an @openuk_uk award for software 🙌 https://t.co/HAECpxC5Pd,"{'neg': 0.0, 'neu': 0.618, 'pos': 0.382, 'compound': 0.7783}",0.7783
1420369023674552327,2021-07-28 13:02:19+00:00,"Do you need to teach kids how to swallow pills? This course has been designed for you. It’s easier for kids to stick to medication regimens, have less sugar and they’re less sickly than liquid medicines https://t.co/dHocw5OxTr https://t.co/gsvGfKQ48z","{'neg': 0.0, 'neu': 0.93, 'pos': 0.07, 'compound': 0.4215}",0.4215
1420353739752460288,2021-07-28 12:01:35+00:00,"NEW! Taking the MRCPCH Clinical exam in Oct/Nov? Our online course will help you gain a better understanding of the key skills required and pitfalls to avoid. Focus on exam technique and prep for the stations, and more. Register your interest: https://t.co/uAKDpSreqC https://t.co/uhZNvsHLrz","{'neg': 0.043, 'neu': 0.715, 'pos': 0.243, 'compound': 0.8848}",0.8848
1420337403714277379,2021-07-28 10:56:40+00:00,"#JobFairyFairy 🧚Work at RCPCH to help create a healthier future for children and young people – apply today!

Policy Officer (Workforce) - https://t.co/ZnqC8PiVrK

Workforce Information Project Manager - https://t.co/GFUZYuTKke https://t.co/NsT4WJzpSQ","{'neg': 0.0, 'neu': 0.825, 'pos': 0.175, 'compound': 0.6239}",0.6239
1420323391605821440,2021-07-28 10:00:59+00:00,We hear from @ShoshLayman on her project to improve wellbeing and morale. 👉 https://t.co/mDv08Ez3cZ https://t.co/Aot0NMXf70,"{'neg': 0.0, 'neu': 0.818, 'pos': 0.182, 'compound': 0.4404}",0.4404
1420052071227744259,2021-07-27 16:02:51+00:00,"RCPCH Webinar: Childhood Obesity – Surgical Management. Our experts present a framework to assess and manage the young person with obesity, including detailed review of bariatric surgery in young people, focusing on efficacy and safety: https://t.co/JRocvKxsMn https://t.co/iid2vuGbCK","{'neg': 0.0, 'neu': 0.924, 'pos': 0.076, 'compound': 0.4215}",0.4215
1420036768611684357,2021-07-27 15:02:03+00:00,New online course: Learn to develop a clinical approach to the assessment of sick patients under 18 with Anorexia Nervosa and understand the short and long-term medical complications of starvation and weight loss in children and adolescents: https://t.co/pVqR9IfzYc https://t.co/twWe7jS9kD,"{'neg': 0.135, 'neu': 0.865, 'pos': 0.0, 'compound': -0.6808}",-0.6808
1420029513367437320,2021-07-27 14:33:13+00:00,"RCPCH responds to the latest National Training Survey from @gmcuk which shows a rise in levels of burnout across the profession.

Full statement from @RCPCHPresident and @cathrynchadwic1, Vice President Training and Assessment, here - https://t.co/q3dssyVUZ4 https://t.co/AytgWukJm0","{'neg': 0.0, 'neu': 1.0, 'pos': 0.0, 'compound': 0.0}",0.0
1420006531660226562,2021-07-27 13:01:54+00:00,"Developed by disabled young people, parent carers and experts, #DisabilityMatters has bite-sized modules matching the needs of individuals, groups &amp; sectors. It has practical advice about supporting disabled children, young people &amp; their families: https://t.co/bQTZqDl8z6 https://t.co/OSUKSdYjhQ","{'neg': 0.0, 'neu': 0.923, 'pos': 0.077, 'compound': 0.4404}",0.4404
1419991316289802241,2021-07-27 12:01:26+00:00,"Child Protection Companion is your handbook on all forms of child abuse, looking across the whole range of medical and social interactions: from examination, to identification, to referral, to court. Find out more: https://t.co/qnpJw3kzyX https://t.co/rDX1FqJbon","{'neg': 0.11, 'neu': 0.89, 'pos': 0.0, 'compound': -0.6369}",-0.6369
1419966377625100295,2021-07-27 10:22:20+00:00,"RCPCH and equality, diversity and inclusion (EDI) 
https://t.co/V0e75mstwM

Here's how we are doing on one of our pledges: https://t.co/m94vX9yijC","{'neg': 0.0, 'neu': 1.0, 'pos': 0.0, 'compound': 0.0}",0.0
1419944484431929346,2021-07-27 08:55:21+00:00,"Resource for parents- advice on what to do if a child is unwell or injured during coronavirus.

@CC4CLondon have added some FAQs from parents to our advice posters 👇 https://t.co/5IcmmZmigC","{'neg': 0.091, 'neu': 0.909, 'pos': 0.0, 'compound': -0.4019}",-0.4019
1419741453102764034,2021-07-26 19:28:34+00:00,A great resource from @PEMinfographics https://t.co/D2sFb6BDDN,"{'neg': 0.0, 'neu': 0.494, 'pos': 0.506, 'compound': 0.6249}",0.6249
1419689657823023106,2021-07-26 16:02:45+00:00,"RCPCH-BPSU Webinar: Children are still being exposed to lead. It  causes neuro-toxicity even at low concentrations and there's no safe threshold of exposure. Hear current evidence, guidance and information to increase awareness of lead exposure in children https://t.co/0SjXZkntUV https://t.co/Ts01ZMwYIM","{'neg': 0.125, 'neu': 0.759, 'pos': 0.116, 'compound': 0.1531}",0.1531
1419674449863925761,2021-07-26 15:02:19+00:00,"RCPCH Conference: Attended the Conference and missed a session? No problem! You can still access recorded sessions on demand, but only for a limited time. Recordings have now moved to Vimeo, so if you'd like access please contact the conference team - conference@rcpch.ac.uk https://t.co/uL1CotMYuV","{'neg': 0.181, 'neu': 0.686, 'pos': 0.133, 'compound': 0.3044}",0.3044
1419670087691288577,2021-07-26 14:44:59+00:00,Paediatricians new to the NHS - @Paedsoftlanding have a free webinar just for you. Register now 👇 https://t.co/EQupv6B8cK,"{'neg': 0.0, 'neu': 0.809, 'pos': 0.191, 'compound': 0.5106}",0.5106
1419654432900460547,2021-07-26 13:42:47+00:00,More about this impact through RCPCH Global child health programmes: https://t.co/Tevk3GbcO6,"{'neg': 0.0, 'neu': 1.0, 'pos': 0.0, 'compound': 0.0}",0.0
1419654056222633984,2021-07-26 13:41:17+00:00,Great to hear about the benefit for health workers involved in global health. https://t.co/FUxC8F9QkS,"{'neg': 0.0, 'neu': 0.628, 'pos': 0.372, 'compound': 0.7964}",0.7964
1419644238665486344,2021-07-26 13:02:16+00:00,Updated: AHP is an e-learning programme for all healthcare professionals working with young people. It ensures that health professionals have essential youth communication skills and understand young people’s rights to consent and confidentiality. https://t.co/iDCIJBAR9K https://t.co/YcJfv3Dejg,"{'neg': 0.0, 'neu': 0.947, 'pos': 0.053, 'compound': 0.2263}",0.2263
1419628978936193024,2021-07-26 12:01:38+00:00,Perplexing Presentations/Fabricated or Induced Illness in Children Guidance: new guidance provides procedures for safeguarding children who present with PP and FII and offers practical advice for paediatricians. Download the guidance https://t.co/JtJbLTBY4R https://t.co/mJQbiOG6iD,"{'neg': 0.078, 'neu': 0.862, 'pos': 0.06, 'compound': -0.1531}",-0.1531
1419598606781267969,2021-07-26 10:00:57+00:00,.@caitlinrea5 tells us how her passion for ASD education and research led her to #ChoosePaediatrics 👉 https://t.co/mvW8vFUTFx https://t.co/z1bsAxYXPp,"{'neg': 0.0, 'neu': 0.842, 'pos': 0.158, 'compound': 0.4588}",0.4588
1419326944349458438,2021-07-25 16:01:28+00:00,"RCPCH Webinar: Did you miss the webinar? Don’t worry, you can watch the recording via the link below. Discussing the issue of dental decay, presenting key messages for delivering better oral health and raising awareness of UK professional interventions. https://t.co/jaxKcFS0Rf https://t.co/Ytqem3svXU","{'neg': 0.153, 'neu': 0.786, 'pos': 0.062, 'compound': -0.5106}",-0.5106
1419311796410888197,2021-07-25 15:01:16+00:00,"📖 Publication: ‘Clinical Cases for MRCPCH Theory and Science' for the TAS exam. 50 clinical cases with the underpinning science mapped to the syllabus, Q&amp;As on each clinical case. This is the official resource for this exam. https://t.co/hnTGLPgQHO https://t.co/g36wc61xJW","{'neg': 0.0, 'neu': 1.0, 'pos': 0.0, 'compound': 0.0}",0.0
1419281584486850564,2021-07-25 13:01:13+00:00,New module for the Safeguarding Children and Young People programme: Looked After Children. Helping you to recognise legislation related to looked after children and be confident in your knowledge of consent. Appreciate statutory health assessments needed. https://t.co/zAfsqUrBXb https://t.co/xCqXYkrEm9,"{'neg': 0.0, 'neu': 0.732, 'pos': 0.268, 'compound': 0.8779}",0.8779
1419266401618038788,2021-07-25 12:00:53+00:00,"ALSG course: To combat child abuse and protect children it's vital to develop your awareness, notice what you are focusing on and what you’re not focusing on. Learn to recognise signs and symptoms of abuse and neglect in children of all ages, and much more https://t.co/JvCo3L3mjF https://t.co/RhTgObMY8M","{'neg': 0.232, 'neu': 0.688, 'pos': 0.081, 'compound': -0.875}",-0.875
1419236131032420354,2021-07-25 10:00:36+00:00,"Serious infections in children often don't look serious initially - and they're not missed due to negligence or poor training. We need, says Tom Waterfield, to find a middle ground.

Read Tom's #RCPCHat25 blog - https://t.co/cyaokTa9oS","{'neg': 0.121, 'neu': 0.794, 'pos': 0.085, 'compound': -0.316}",-0.316
1418964565010812934,2021-07-24 16:01:30+00:00,"RCPCH-BPSU Webinar: Did you miss the live webinar? Don’t worry, you can watch the recording, or watch again, via the link. Presenting the findings of a surveillance study and a discussion on how UK children are affected by Behçet’s syndrome.
https://t.co/8adcejz5Wa https://t.co/nvqd3AgUDl","{'neg': 0.142, 'neu': 0.858, 'pos': 0.0, 'compound': -0.6249}",-0.6249
1418949443747991559,2021-07-24 15:01:24+00:00,📖 Publication: ‘Clinical Cases for MRCPCH Foundation of Practice' for the FOP exam. This book gets to the heart of what examiners are looking for in successful candidate performance. Invaluable resource for those studying or preparing to apply for FOP. https://t.co/vIi9ScXYul https://t.co/q6zhG0517y,"{'neg': 0.0, 'neu': 0.913, 'pos': 0.087, 'compound': 0.5859}",0.5859
1418919294952427521,2021-07-24 13:01:36+00:00,"New module: Children Vulnerable to Abuse and Exploitation. Explores the most pressing challenges in child protection, including ACEs, child trafficking and county lines, gang-based exploitation, missing children, forced marriage and honour-based violence. https://t.co/zAfsqUrBXb https://t.co/RsX6cvLUeq","{'neg': 0.342, 'neu': 0.623, 'pos': 0.035, 'compound': -0.9303}",-0.9303
1418904033046274059,2021-07-24 12:00:58+00:00,ALSG safeguarding courses. Maintain your safeguarding competencies with Child Protection: Recognition and Response (for ST1 onwards) and Child Protection in Practice (for ST4 onwards). Developed and supported in partnership with RCPCH. Find out more: https://t.co/VhH52TCpua https://t.co/j92JfQfvNR,"{'neg': 0.0, 'neu': 0.835, 'pos': 0.165, 'compound': 0.6705}",0.6705
1418858677394677774,2021-07-24 09:00:44+00:00,"RCPCH and equality, diversity and inclusion

You can read the full ‘One Year On: an update on our progress to open up volunteer roles at RCPCH’ report here: https://t.co/HbRSQ5q162 https://t.co/SCGCkhfKEC","{'neg': 0.0, 'neu': 0.912, 'pos': 0.088, 'compound': 0.4215}",0.4215
1418602486084952072,2021-07-23 16:02:43+00:00,"RCPCH Webinar: Supporting paediatricians and child health professionals with managing bronchiolitis and other respiratory viruses. We looked at how to manage patient flow, ‘keeping patients safe and pathways open’ and signposted to resources for parents: https://t.co/0t636yO6zs https://t.co/88xCJyYfdj","{'neg': 0.0, 'neu': 0.858, 'pos': 0.142, 'compound': 0.7003}",0.7003
1418587292885786629,2021-07-23 15:02:21+00:00,"RCPCH Conference: Don't forget! If you registered to attended the conference you can still access sessions on demand. Recordings have now moved to Vimeo, so if you'd like access please contact the conference team: conference@rcpch.ac.uk https://t.co/AWZv0JwPig","{'neg': 0.037, 'neu': 0.79, 'pos': 0.173, 'compound': 0.6728}",0.6728
1418572130233561091,2021-07-23 14:02:06+00:00,"RCPCH Committee vacancies are open!  

Apply by 9:30am BST, Monday 23 August at https://t.co/1hf2ncEZJX https://t.co/WullcWS16e","{'neg': 0.0, 'neu': 1.0, 'pos': 0.0, 'compound': 0.0}",0.0
1418562775182417929,2021-07-23 13:24:55+00:00,"The ‘One Year On: an update on our progress to open up volunteer roles at RCPCH’ report shows the impact of the work completed to date.

You can read the full report here: https://t.co/V0e75mstwM https://t.co/Hq6QXxIX15","{'neg': 0.0, 'neu': 0.924, 'pos': 0.076, 'compound': 0.4215}",0.4215
1418557053698707460,2021-07-23 13:02:11+00:00,ETAT+ is a well-established multi-professional course specifically designed for health professionals looking after children in low resource settings. It supports emergency care in the first 24 hrs of patient arrival at hospital. Find out more: https://t.co/eyBhivWidJ https://t.co/Bl7x6BNm5q,"{'neg': 0.111, 'neu': 0.755, 'pos': 0.134, 'compound': 0.25}",0.25
1418541806699126784,2021-07-23 12:01:36+00:00,"New online course: Learn to outline the principles underpinning the guidance, establish an appropriate pathway in managing cases, and avoid common pitfalls during diagnosis when complications tend to arise. Find out more https://t.co/Gtw0iB2b8O https://t.co/2fBmbE0Aib","{'neg': 0.062, 'neu': 0.937, 'pos': 0.0, 'compound': -0.296}",-0.296
1418518829324541953,2021-07-23 10:30:18+00:00,"At our virtual Admissions Ceremony today, we were delighted to welcome this year's Honorary Fellows, awarded for their major contribution to paediatrics and child health. 🎉 https://t.co/MUSuQ0OPRi https://t.co/6es28OhWOl","{'neg': 0.0, 'neu': 0.669, 'pos': 0.331, 'compound': 0.886}",0.886
1418512584391680006,2021-07-23 10:05:29+00:00,Read our Insight piece on the difference this makes - https://t.co/poYGiy1V6h,"{'neg': 0.0, 'neu': 1.0, 'pos': 0.0, 'compound': 0.0}",0.0
1418512190051655682,2021-07-23 10:03:55+00:00,"Modelling from @jrf_uk calculates if the Government cuts Universal Credit, a further 300,000 children will go in to poverty overnight. https://t.co/Ssju9P3Xjm","{'neg': 0.219, 'neu': 0.677, 'pos': 0.104, 'compound': -0.4404}",-0.4404
1418496359276089346,2021-07-23 09:01:01+00:00,We are excited to announce that we have started preparations for the RCPCH-NIHR 2021 Academic Trainees Day. Find out more https://t.co/gQ6aXJas5G @NIHRcommunity https://t.co/vFIQZ1a9aQ,"{'neg': 0.0, 'neu': 0.902, 'pos': 0.098, 'compound': 0.34}",0.34
1418494436422701056,2021-07-23 08:53:22+00:00,"RCPCH and equality, diversity and inclusion:

A year after the publication of our action plan, we report back on what we have achieved so far to increase representation in our volunteer roles.

You can read the full ‘One Year On' report here: https://t.co/tRwT9ufszz https://t.co/B2lNzIUOU0","{'neg': 0.0, 'neu': 0.942, 'pos': 0.058, 'compound': 0.3744}",0.3744
1418225109102333953,2021-07-22 15:03:10+00:00,Online course: Part 3 of the PAT series. Learn to undertake an allergy focused clinical history to interpret SPT and specific IgE results and assess how and when to undertake food challenges: https://t.co/e7BHabmwfB https://t.co/hMCJDfbl5b,"{'neg': 0.0, 'neu': 0.888, 'pos': 0.112, 'compound': 0.4404}",0.4404
1418194651476074498,2021-07-22 13:02:08+00:00,Learn the basics of how to assess children of all ages using clinical footage and evidence based material at the updated and relaunched Spotting the Sick Child website https://t.co/4XV9a666FH https://t.co/pvhpO7o2QX,"{'neg': 0.102, 'neu': 0.898, 'pos': 0.0, 'compound': -0.5106}",-0.5106
1418179664175054859,2021-07-22 12:02:35+00:00,"The Child Protection Companion is a handbook on all forms of child abuse, looking across the whole range of medical and social interactions, from examination to identification, and referral to court. Part of the RCPCH Child Protection Portal. Find out more https://t.co/lckiPq2Xkv https://t.co/v1OHeueLki","{'neg': 0.093, 'neu': 0.907, 'pos': 0.0, 'compound': -0.6369}",-0.6369
1418135173858746372,2021-07-22 09:05:47+00:00,"“So many families have made an impact on me over the years, and I wish I could go back to thank them for the role they played in shaping the kind of doctor I became.”

Camilla Kingdon @RCPCHPresident writes a blog for our 25th birthday – read it here: https://t.co/PojzQVmndc","{'neg': 0.0, 'neu': 0.847, 'pos': 0.153, 'compound': 0.765}",0.765
1417877692834361348,2021-07-21 16:02:39+00:00,"RCPCH Webinar: Childhood Obesity – Medical Management. Learn about the epidemiology and social determinants of obesity, a medical framework for the investigation of childhood obesity and review the multidisciplinary medical management of obesity: https://t.co/l3TvI9jpoG https://t.co/tuvDWw6drV","{'neg': 0.0, 'neu': 1.0, 'pos': 0.0, 'compound': 0.0}",0.0
1417862619445309443,2021-07-21 15:02:45+00:00,"Online course: It aims to equip paediatricians to be able to assess children in their clinics and ensures that a broad formulation, rather than a single diagnosis, is considered to help a child receive the appropriate support they require: https://t.co/e89kWj3yEX https://t.co/7BJm1usj9D","{'neg': 0.0, 'neu': 0.87, 'pos': 0.13, 'compound': 0.6597}",0.6597
1417832327896502272,2021-07-21 13:02:23+00:00,"Pill swallowing is an important life skill for children to learn. They’re less sickly than suspensions, have less sugar and more common in pharmacies. Take our short e-learning course. https://t.co/dHocw5OxTr https://t.co/aAyIn8hSKi","{'neg': 0.0, 'neu': 0.943, 'pos': 0.057, 'compound': 0.2023}",0.2023
1417817035883548672,2021-07-21 12:01:37+00:00,"Child Protection Portal: Standards and resources. This section includes a comprehensive list of child protection resources from including intercollegiate roles and competencies, and much more. Find out more https://t.co/lckiPq2Xkv https://t.co/jOdRWOFsc9","{'neg': 0.0, 'neu': 0.933, 'pos': 0.067, 'compound': 0.25}",0.25
1417756490996363264,2021-07-21 08:01:02+00:00,"""I know from experience that it is essential to allow parents and young people the time and space to tell their story and for me to listen actively and intently, without interrupting.""

You can read Chris's full story for #RCPCHat25 here: https://t.co/UIws8HLRGX","{'neg': 0.0, 'neu': 0.905, 'pos': 0.095, 'compound': 0.4939}",0.4939
1417515224853266432,2021-07-20 16:02:20+00:00,"RCPCH Webinar: Childhood Obesity – Surgical Management. Discuss the justification for bariatric surgery in young people, discuss the endocrine basis for bariatric surgery and discuss multidisciplinary case selection for bariatric surgery in young people: https://t.co/JRocvKxsMn https://t.co/DMzQmJivA3","{'neg': 0.0, 'neu': 1.0, 'pos': 0.0, 'compound': 0.0}",0.0
1417500081977270273,2021-07-20 15:02:10+00:00,New online course: Learn to recognise a young person with an eating disorder and understand the principles of management: https://t.co/pVqR9IfzYc https://t.co/TmZC3g1LIp,"{'neg': 0.124, 'neu': 0.876, 'pos': 0.0, 'compound': -0.4019}",-0.4019
1417491077276315654,2021-07-20 14:26:23+00:00,Proud for @RCPCHPresident to be a signatory of this open letter. A Neonatal Safety Champion will help improve outcomes for babies and families. https://t.co/mcfnCByK7E,"{'neg': 0.0, 'neu': 0.525, 'pos': 0.475, 'compound': 0.9371}",0.9371
1417485303317663750,2021-07-20 14:03:26+00:00,"Update following yesterday's announcement on COVID-19 vaccination for children and young people.

For more: https://t.co/az4oh95XcT https://t.co/gVfTb3tKjJ","{'neg': 0.0, 'neu': 1.0, 'pos': 0.0, 'compound': 0.0}",0.0
1417469824511393819,2021-07-20 13:01:56+00:00,Why do we need #DisabilityMatters? 70% of UK workers feel they need to learn about more disability for the workplace. Find out more: https://t.co/bQTZqDl8z6 https://t.co/e8GzzY2kx4,"{'neg': 0.0, 'neu': 1.0, 'pos': 0.0, 'compound': 0.0}",0.0
1417454601943592962,2021-07-20 12:01:26+00:00,Leading charities continue to report rises in calls since lockdown began as children experience abuse at home. Our Portal provides access to vital resources to ensure you have what you need should you have any safeguarding concerns https://t.co/lckiPq2Xkv https://t.co/rRBc2gMdeO,"{'neg': 0.087, 'neu': 0.704, 'pos': 0.209, 'compound': 0.5994}",0.5994
1417409912221622294,2021-07-20 09:03:51+00:00,@Oohgpwales @DrLindaDykes @WelshGovernment @RCPCHWales @RCPCHPresident Hi @Oohgpwales - The College wasn’t approached by JCVI. We played a small role in a wider research project on risk for CYP from COVID-19: https://t.co/fuadQrNEF5,"{'neg': 0.069, 'neu': 0.852, 'pos': 0.079, 'compound': 0.0772}",0.0772
1417394071534985243,2021-07-20 08:00:55+00:00,"Dal Hothi shares her story as part of #RCPCHat25 
You can read her blog here: https://t.co/2UDO4NDuCp https://t.co/z4xIyN1qiY","{'neg': 0.0, 'neu': 0.879, 'pos': 0.121, 'compound': 0.296}",0.296
1417190410573783046,2021-07-19 18:31:38+00:00,"RCPCH responds to JCVI advice regarding children and COVID-19 vaccination:
https://t.co/vKQ5XMGQrr https://t.co/wcNcyGWGqZ","{'neg': 0.0, 'neu': 1.0, 'pos': 0.0, 'compound': 0.0}",0.0
1417152835905626113,2021-07-19 16:02:20+00:00,"RCPCH-BPSU Webinar: Understand the current evidence about lead exposure to children in the UK and the impact of lead on child health, development and behaviour, and know what to do about a raised blood lead concentration result: https://t.co/0SjXZkntUV https://t.co/qyxMqqWPOu","{'neg': 0.0, 'neu': 1.0, 'pos': 0.0, 'compound': 0.0}",0.0
1417137678060068870,2021-07-19 15:02:06+00:00,"RCPCH Conference: Attended the Conference and missed a session? No problem! You can still access recordings of sessions on demand, but only for a limited time. https://t.co/tBfavf520H https://t.co/tYUdksDoyv","{'neg': 0.299, 'neu': 0.701, 'pos': 0.0, 'compound': -0.7133}",-0.7133
1417107467348099074,2021-07-19 13:02:03+00:00,"Are you a GP, school nurse, community paediatrician or child health team member? This course has been designed for you! It ensures that you have essential youth communication skills and understand young people’s rights to consent and confidentiality. https://t.co/iDCIJBAR9K https://t.co/MQ3Uz1sbOm","{'neg': 0.0, 'neu': 0.945, 'pos': 0.055, 'compound': 0.2942}",0.2942
1417092222059679744,2021-07-19 12:01:28+00:00,"Perplexing Presentations/Fabricated or Induced Illness in Children Guidance. Covering epidemiology and an outline of the current evidence base, and updated terminology and definitions for PP, FII and Medically Unexplained Symptoms (MUS), and much more: https://t.co/JtJbLTBY4R https://t.co/VmSRgNqEBK","{'neg': 0.072, 'neu': 0.928, 'pos': 0.0, 'compound': -0.4019}",-0.4019
1417042396047675392,2021-07-19 08:43:29+00:00,We can all help to stop the virus from spreading by making choices that reduce the risk of illness to ourselves and those around us. #ItsNotToMuchToMask https://t.co/R73AZt6XMV,"{'neg': 0.214, 'neu': 0.703, 'pos': 0.083, 'compound': -0.5106}",-0.5106
1416790200148185095,2021-07-18 16:01:21+00:00,Test your skills and knowledge of serious illness in children at the updated and relaunched Spotting the Sick Child website https://t.co/4XV9a666FH https://t.co/ODRis5xw9v,"{'neg': 0.278, 'neu': 0.722, 'pos': 0.0, 'compound': -0.743}",-0.743
