id,created_at,text,scores,compound
1328728225384689665,2020-11-17 15:54:30+00:00,"Many of last year’s winners also wrote blogs outlining their winning projects and touching on what winning an Excellence in Patient Care Award meant to them. 

Peruse their blogs and gain ideas for #EPCA2021: https://t.co/mxKWqZA9vW","{'neg': 0.0, 'neu': 0.537, 'pos': 0.463, 'compound': 0.9753}",0.9753
1328728223723761664,2020-11-17 15:54:29+00:00,"On RCP Player, we’ve also produced a short series of videos featuring a few #EPCA2020 winners talking about their projects, providing inspiration for #EPCA2021 as well.

Have a watch: https://t.co/NShH7Fa5xO","{'neg': 0.0, 'neu': 0.736, 'pos': 0.264, 'compound': 0.8225}",0.8225
1328728220590551040,2020-11-17 15:54:29+00:00,"At just over halfway through the entry period, it’s still possible for #RCPmembers and #FellowsRCP to submit projects or case studies to the #EPCA2021. Members and fellows can also be nominated for the ‘Contribution to the profession’ award.

Learn more: https://t.co/JXreiBHYBV https://t.co/E84NlgM4QU","{'neg': 0.0, 'neu': 0.921, 'pos': 0.079, 'compound': 0.5423}",0.5423
1328646614114766849,2020-11-17 10:30:12+00:00,"The winning #RCPTurnerWarwick lecturers for the #RCPWestMidlands region and @RCPWales will present their lectures on 20 November at 12.30pm. 

The winning trainees are… 
Register for this free event now: https://t.co/bDJq8oNwEu 
@uhbtrust https://t.co/yXXWMFfopD","{'neg': 0.0, 'neu': 0.731, 'pos': 0.269, 'compound': 0.8928}",0.8928
1328616436294705152,2020-11-17 08:30:17+00:00,"There’s still time to register for tomorrow’s Acute medicine series episode 3.  

Gain 2 CPD credits and update your clinical knowledge on neurology from the acute take. 

 #RCPmembers can watch live or on-demand for free, register now: https://t.co/AkuQIsVfS1 https://t.co/EfDGJ2f4A6","{'neg': 0.0, 'neu': 0.792, 'pos': 0.208, 'compound': 0.8481}",0.8481
1328386157995053057,2020-11-16 17:15:14+00:00,".@WeAreTotum PRO discount (previously NUS) is now available to student, foundation and trainee RCP members!

Sign up today to get 3 years for the price of 2 and start making some serious savings on leading brands. Email membershipqueries@rcplondon.ac.uk to get your discount code. https://t.co/15P86BtHdk","{'neg': 0.037, 'neu': 0.963, 'pos': 0.0, 'compound': -0.1511}",-0.1511
1327555061757718528,2020-11-14 10:12:46+00:00,"Happy Diwali to the RCP community celebrating around the world. Wishing you a safe and wonderful time. 

#Diwali  🎉","{'neg': 0.0, 'neu': 0.43, 'pos': 0.57, 'compound': 0.9423}",0.9423
1327551916780482560,2020-11-14 10:00:16+00:00,"Have you visited RCP Player recently? Our streaming service offers learning resources, speciality updates and more. 

New videos are released weekly, so make sure you check in regularly to stay up to date. 

Watch now: https://t.co/AkVGeTZbXD https://t.co/7RUf4Wlc52","{'neg': 0.0, 'neu': 0.933, 'pos': 0.067, 'compound': 0.3774}",0.3774
1327185976695861248,2020-11-13 09:46:09+00:00,We set out earlier in the pandemic how clinical academic trainees specifically should be supported to return to research: https://t.co/ZZqh207tFU,"{'neg': 0.0, 'neu': 0.892, 'pos': 0.108, 'compound': 0.3182}",0.3182
1327185974779138048,2020-11-13 09:46:08+00:00,"Clinical research is crucial in our response to #COVID19 and NHS clinicians are playing a vital role. 

We welcome the statement from @AoMRC's Academic Leads on how to mitigate the impact of the second wave on research and clinical academia.

▶️ https://t.co/2qnAG7eHzt https://t.co/HzAzmSjbJ2","{'neg': 0.0, 'neu': 0.848, 'pos': 0.152, 'compound': 0.7184}",0.7184
1326919303908700164,2020-11-12 16:06:29+00:00,"In a foreword for @The_NHSA's report on the effect of COVID-19 in the north, @CHToh1 explains how decades of failing to invest in public health &amp; health inequalities laid the bedrock for the disproportionate brunt of the pandemic experienced in the north: 
https://t.co/16Kqzy6VZW https://t.co/noPt8SYafu","{'neg': 0.073, 'neu': 0.927, 'pos': 0.0, 'compound': -0.5106}",-0.5106
1326910275526799362,2020-11-12 15:30:37+00:00,"Associate college tutors (ACTs) act as representatives for local physician trainees and their college tutor, representing the interests of junior doctors. 

Read November’s Commentary magazine to find out what two ACTs have learned from the role in Wales: https://t.co/5EyjjxjiyW https://t.co/JW7RXbkcpk","{'neg': 0.0, 'neu': 0.951, 'pos': 0.049, 'compound': 0.25}",0.25
1326882041506516992,2020-11-12 13:38:25+00:00,"The guidance has been developed with @theRCN, in collaboration with @thecsp, @rpharms and @NHSEngland Emergency Care Improvement Support Team.","{'neg': 0.098, 'neu': 0.566, 'pos': 0.336, 'compound': 0.743}",0.743
1326882038583013376,2020-11-12 13:38:24+00:00,"Read our new guidance for multidisciplinary assessment on #COVID19 wards 👇

https://t.co/3fPdAkEwsf 

The guidance helps ward based teams to conduct multidisciplinary assessments while maintaining a safe and secure environment. https://t.co/cU3hadtL9U","{'neg': 0.0, 'neu': 0.76, 'pos': 0.24, 'compound': 0.7845}",0.7845
1326812262619901952,2020-11-12 09:01:09+00:00,"It’s not too late for new consultants and senior trainees to register for tomorrow’s National new consultants conference. Gain 6 CPD credits while learning about effective training in the clinical environment, gender inequality and more.  

Register now: https://t.co/RJPSKh3ne6 https://t.co/k7PN54UVKZ","{'neg': 0.0, 'neu': 0.795, 'pos': 0.205, 'compound': 0.8402}",0.8402
1326797989050978314,2020-11-12 08:04:25+00:00,"An important letter of support from @CMO_England, @gmcuk, @AoMRC, @NHSEnglandNMD to doctors.

Along with all NHS staff - you are being astounding.

#Thankyou https://t.co/ddGPPCqNXb","{'neg': 0.0, 'neu': 0.733, 'pos': 0.267, 'compound': 0.743}",0.743
1326526277990445056,2020-11-11 14:04:44+00:00,"We’re halfway through the #EPCA2021 entry period! #RCPmembers and #FellowsRCP can submit a project abstract, before 5pm on 2 December, to be in with a chance to have your project celebrated and promoted.

Learn more about the member-exclusive awards: https://t.co/CKM04w2vPc https://t.co/85O9rqcYjR","{'neg': 0.0, 'neu': 0.742, 'pos': 0.258, 'compound': 0.8955}",0.8955
1326520118243897349,2020-11-11 13:40:16+00:00,"""As such a rich country, we should have all done more to
protect all our citizens from the shockwaves of a crisis,"" writes @CHToh1 in his forward to this important @The_NHSA report on the #healthinequalities that have been exacerbated by the #COVID19 pandemic. 👇 https://t.co/eU1DgpM8H0","{'neg': 0.0, 'neu': 0.821, 'pos': 0.179, 'compound': 0.8166}",0.8166
1326496160383643650,2020-11-11 12:05:04+00:00,"Have you seen the results of our 2019/20 consultants census?

We found consultants of black, Asian and minority ethnic origin (BAME) were twice as likely to experience discrimination as white consultants.

Read the report: https://t.co/nDBelZ9Ruv https://t.co/pMhbqgvUc1","{'neg': 0.0, 'neu': 1.0, 'pos': 0.0, 'compound': 0.0}",0.0
1326464850617364480,2020-11-11 10:00:39+00:00,"Join our panel of experts on 12 November at 12pm, as they discuss palliative care in countries across the world including India, Jamaica, the Caribbean, Lebanon and the Middle East region.  

Register now: https://t.co/NSIJhQLNOq https://t.co/N6bQE0w8Fj","{'neg': 0.0, 'neu': 0.859, 'pos': 0.141, 'compound': 0.6597}",0.6597
1326201653570244609,2020-11-10 16:34:48+00:00,Today the government has launched its consultation on totally removing unhealthy food advertising online - an important step in addressing the UK’s obesity crisis. https://t.co/iZuNCerFRV,"{'neg': 0.25, 'neu': 0.644, 'pos': 0.106, 'compound': -0.7564}",-0.7564
1326178885118078976,2020-11-10 15:04:20+00:00,"The @UK_AHA has found it's possible to buy 14 units of alcohol for just £2.68 - the price of a cup of coffee.

As part of the alliance, we're calling on ministers to intervene &amp; tackle cheap, high-strength alcohol in their review of the duty system, &amp; introduce minimum pricing.👇 https://t.co/lIQmEe2zuQ","{'neg': 0.0, 'neu': 1.0, 'pos': 0.0, 'compound': 0.0}",0.0
1326121471807287299,2020-11-10 11:16:11+00:00,"30% of our members say that non-COVID patients are coming to them with more severe illnesses than prior to the pandemic.

“They need to know the NHS is able to care for them,"" says @bodgoddard 

More on our survey published today, here: https://t.co/VIHVqO50W8","{'neg': 0.129, 'neu': 0.807, 'pos': 0.065, 'compound': -0.489}",-0.489
1326102562119049217,2020-11-10 10:01:03+00:00,"With the 2021 #RCPTurnerWarwick open for abstract submissions, we want to provide trainees with inspiration for what types of work to enter in the lecturer scheme. In our new blog, hear from four past winners and learn about their projects.

Read now: https://t.co/enylzus5WP https://t.co/b04RPz5IWb","{'neg': 0.0, 'neu': 0.84, 'pos': 0.16, 'compound': 0.7783}",0.7783
1326102493210796033,2020-11-10 10:00:46+00:00,"Tomorrow is the CT and ACT national conference day. 

There is still time to book your place if you haven’t already: https://t.co/mJONw6OO9y   

It’s virtual, free to view and you can earn 4 CPD points. https://t.co/554VXA9b5h","{'neg': 0.0, 'neu': 0.909, 'pos': 0.091, 'compound': 0.5106}",0.5106
1326072191381889027,2020-11-10 08:00:22+00:00,"We surveyed our members for the 7th time during the pandemic, and found that almost all of them (92%) are concerned about the impact of increasing #COVID19 admissions on their hospital’s ability to deliver effective care.

Find out more here 👇 

https://t.co/VIHVqO50W8","{'neg': 0.0, 'neu': 0.815, 'pos': 0.185, 'compound': 0.8225}",0.8225
1325717303066054656,2020-11-09 08:30:10+00:00,"We're excited to be welcoming our chief registrars to module 2 of the Chief Registrar Programme today!

We hope you have a great couple of days and we're looking forward to connecting with you all virtually 💻

#ChiefRegistrar","{'neg': 0.0, 'neu': 0.711, 'pos': 0.289, 'compound': 0.9117}",0.9117
1325398199658553346,2020-11-08 11:22:10+00:00,"Today we bow our heads in remembrance of all those who lost their lives in conflict. 

#LestWeForget #RememberanceSunday https://t.co/tDtWi79yJS","{'neg': 0.213, 'neu': 0.787, 'pos': 0.0, 'compound': -0.5574}",-0.5574
1325052943171801088,2020-11-07 12:30:14+00:00,"In 2013, the Future Hospital Commission recommended trusts employ a chief of medicine, to set the standard and direction of medical services. 

November’s Commentary interviews Dr Shenaz Ramtoola, who spent 5 years in the role, about her experiences: https://t.co/TDzK5m2Bhi https://t.co/lQMqXVIC3h","{'neg': 0.0, 'neu': 0.88, 'pos': 0.12, 'compound': 0.5994}",0.5994
1325015205999468545,2020-11-07 10:00:17+00:00,"Did you miss last week’s acute and general medicine conference? 

Don’t worry, you can still watch all three days on-demand and receive 15 CPD credits.  

Register now: https://t.co/DtsWGTNwYw https://t.co/s57I9Vf1p2","{'neg': 0.136, 'neu': 0.788, 'pos': 0.076, 'compound': -0.25}",-0.25
1324668052030578691,2020-11-06 11:00:49+00:00,"Our next #RCPGlobal webinar will be looking at palliative care in low and middle-income countries.  

Join our panel of experts at 12.00pm on 12 November. 

Register now: https://t.co/NjurWTE0zv https://t.co/V8vYZTvK7c","{'neg': 0.063, 'neu': 0.776, 'pos': 0.161, 'compound': 0.5106}",0.5106
1324653033012297728,2020-11-06 10:01:08+00:00,"In our new #RCPTurnerWarwick blog, hear from wining 2019 trainee lecturers Dr Louise Alexander, Dr Azara Janmohamed, Dr @KunalMhapankar and and Dr Ayodele Sasegbon as they talk about their winning projects and lectures.

Read their blog now: https://t.co/enylzus5WP https://t.co/nYQDZWrpE6","{'neg': 0.0, 'neu': 0.918, 'pos': 0.082, 'compound': 0.5267}",0.5267
1324411721818230785,2020-11-05 18:02:15+00:00,"In a week, the National new consultants conference will provide practical support for new consultants and senior trainees. Speakers will draw on their own experience, offering inspiration and advice on relevant topics. 

#RCPMembers receive a 50% discount: https://t.co/RJPSKh3ne6 https://t.co/A1ATVevufo","{'neg': 0.0, 'neu': 0.852, 'pos': 0.148, 'compound': 0.7269}",0.7269
1324399365637709824,2020-11-05 17:13:09+00:00,"We're pleased to support the 19th @SKMCH Cancer Symposium being held 6 – 8 November. 

It’s an important way of promoting the work we are doing to develop palliative care services in Pakistan. 

If you’re interested in attending, please register here: https://t.co/181kiDOhZy https://t.co/gPLgpbQv1l","{'neg': 0.081, 'neu': 0.587, 'pos': 0.332, 'compound': 0.8934}",0.8934
1324381644208431105,2020-11-05 16:02:44+00:00,"It’s not too late for #FellowsRCP to apply to join the Committee on Ethical Issues in Medicine (CEIM) as an RCP representative for a four-year term. The deadline is next Friday, 13 November. Learn more about the role and apply now: https://t.co/7F5Qxgwmt1","{'neg': 0.0, 'neu': 0.876, 'pos': 0.124, 'compound': 0.6705}",0.6705
1324379890674737154,2020-11-05 15:55:46+00:00,"You can dive deeper into our 2019 census findings by reading November's edition of Commentary magazine, which is available online now 👇

https://t.co/i1PsPQwc5q https://t.co/4p1w6hT4Qj","{'neg': 0.0, 'neu': 1.0, 'pos': 0.0, 'compound': 0.0}",0.0
1324379886220357645,2020-11-05 15:55:45+00:00,"2020 has been dominated by #COVID19 but long-term workforce issues in the NHS need addressing more than ever.

Our 2019 census with @RCPEdin and @rcpsglasgow reveals the continuing pressures on the medical workforce and the systems in which we work: https://t.co/t9iYNNNPv3 https://t.co/vnKsOJr7to","{'neg': 0.067, 'neu': 0.933, 'pos': 0.0, 'compound': -0.4497}",-0.4497
1324331903047131136,2020-11-05 12:45:05+00:00,"Our new look November edition of Commentary is out now, featuring news about our (all virtual) #RCPMed2021, the latest consultant census from our Medical Workforce Unit, and RCP members recognised in the Queen’s birthday honours. 

📖 https://t.co/8fLXqlJNq4 https://t.co/p2ns3zNcmg","{'neg': 0.0, 'neu': 0.918, 'pos': 0.082, 'compound': 0.4939}",0.4939
1324034943970955265,2020-11-04 17:05:04+00:00,"Congratulations to the service @SheffieldHosp for achieving #QPIDS accreditation!

Well done to the team for their hard work 👏👏👏

Find out more about our QPIDS accreditation programme: https://t.co/FTqPrgRjsD https://t.co/oqWA3CwiL6","{'neg': 0.042, 'neu': 0.772, 'pos': 0.187, 'compound': 0.7088}",0.7088
1324012046141345798,2020-11-04 15:34:05+00:00,".@GeriSoc has launched a UK-wide campaign, raising awareness of issues critical to protecting older people during the second wave of the #COVID19 pandemic. 

Find out how you can lend your support to this incredibly important issue here👇

#BGSFairCare https://t.co/40FHiFHDvk","{'neg': 0.054, 'neu': 0.798, 'pos': 0.148, 'compound': 0.4576}",0.4576
1324004264969199617,2020-11-04 15:03:10+00:00,"Don’t miss Friday’s #RCPTurnerWarwick lectures on renal osteodystrophy and bone fragility as well as family planning services and tuberculosis treatment programme integration, presented by trainees from #RCPYorkshire and #RCPLondonregion.  

Register now: https://t.co/MWaxTzw55v https://t.co/uI4OYLUtty","{'neg': 0.046, 'neu': 0.893, 'pos': 0.061, 'compound': 0.128}",0.128
1323915797052481537,2020-11-04 09:11:37+00:00,"""We each have a responsibility and an ability to make a difference as individuals,"" says @bodgoddard, commenting on @UKHealthClimate's survey and joint paper on food, climate change and health. #ALLCONSUMING https://t.co/GmdN8A1vzY","{'neg': 0.0, 'neu': 0.924, 'pos': 0.076, 'compound': 0.3182}",0.3182
1323915287280975873,2020-11-04 09:09:36+00:00,"""It’s clear that if we are to avoid dangerous global warming we must start to reconsider our attitudes to food,"" says @bodgoddard in today's @guardian, commenting on @UKHealthClimate's new joint paper on food, climate change &amp; health. 👇 

#ALLCONSUMING https://t.co/Li09suzGBp","{'neg': 0.119, 'neu': 0.787, 'pos': 0.094, 'compound': -0.2732}",-0.2732
1323675083966238723,2020-11-03 17:15:07+00:00,"100 organisations (and counting) have joined the newly formed Inequalities in Health Alliance! 

Are you a not-for-profit organisation that has an interest in reducing health inequality? 

Apply to be a member of the IHA: https://t.co/nmoFu84JgA

#HealthyLivesForAll https://t.co/X8LGq1akNX","{'neg': 0.0, 'neu': 0.912, 'pos': 0.088, 'compound': 0.5093}",0.5093
1323644879088558084,2020-11-03 15:15:05+00:00,"""We have a duty to tackle climate change and the good news is this will bring a huge benefit to the nation’s health.""

RCP registrar @donalnhs discusses the responsibility of the health service, the NHS Net Zero report, and what we can do to help: https://t.co/4SbLnXPPXY","{'neg': 0.0, 'neu': 0.786, 'pos': 0.214, 'compound': 0.872}",0.872
1323619429238845442,2020-11-03 13:33:58+00:00,"We need your help to understand what’s really happening in the NHS right now! 

We're asking all our members to fill out the following survey related to the #COVID19 pandemic. 

This will help us to speak on your behalf when talking to decision makers. 🙏

https://t.co/cAtM3FuoTr https://t.co/YNH79Xrx3L","{'neg': 0.0, 'neu': 0.885, 'pos': 0.115, 'compound': 0.69}",0.69
1323596163350695938,2020-11-03 12:01:31+00:00,"Student and foundation doctor #RCPmembers are invited to self-nominate for @RCP_SFDN vacancies and represent students and FDs in east of England, the midlands, the south east, Wales and Yorkshire. Applications close 16 November. Apply now: https://t.co/sToRYyRxnf","{'neg': 0.0, 'neu': 1.0, 'pos': 0.0, 'compound': 0.0}",0.0
1323565638833606656,2020-11-03 10:00:13+00:00,"The CT and ACT national conference is next week! We hope that you are as excited as we are.   

Join the new Linacre fellow @lungsatwork and her panel to learn about the impact of #COVID19 on wellbeing, IMT and shielding.   

Book now: https://t.co/mJONw6OO9y https://t.co/91FZHTdw5H","{'neg': 0.0, 'neu': 0.84, 'pos': 0.16, 'compound': 0.7777}",0.7777
1323279213701586947,2020-11-02 15:02:04+00:00,"With the 2021 #RCPTurnerWarwick recently launched, we thought this would be a good opportunity to look back at some of the previous winning projects and the trainee members who presented them.

Read our new blog: https://t.co/enylzus5WP https://t.co/lSKQFmSstD","{'neg': 0.0, 'neu': 0.751, 'pos': 0.249, 'compound': 0.8625}",0.8625
1323218609930383362,2020-11-02 11:01:15+00:00,"There’s still time to register for tomorrow’s Specialty series – respiratory webinar where you’ll update your knowledge on the future of tuberculosis treatment, non-invasive ventilation and diagnostic pathways for lung disease.  

Register now: https://t.co/DM5kKDXLPY https://t.co/rDAH31W57T","{'neg': 0.0, 'neu': 1.0, 'pos': 0.0, 'compound': 0.0}",0.0
1323191896374681600,2020-11-02 09:15:06+00:00,"Get an exclusive discount on @WeAreTotum PRO (previously NUS) as an RCP medical student, foundation doctor or Trainee member. 

Sign up to receive discounts on brands such as Co-op, Carphone warehouse, Amazon, ASOS and more.

Email membershipqueries@rcplondon.ac.uk for your code! https://t.co/qG1BeWfOHD","{'neg': 0.0, 'neu': 0.918, 'pos': 0.082, 'compound': 0.3595}",0.3595
1322825880494919685,2020-11-01 09:00:41+00:00,"Now, more than ever, it’s important that we acknowledge the hard work and dedication of our #RCPmembers and #FellowsRCP. The #EPCA2021 are open for entries until 5pm on 2 December.

Learn more and enter a project that you’d like recognised: https://t.co/CKM04w2vPc https://t.co/wfYlOqmBWx","{'neg': 0.033, 'neu': 0.867, 'pos': 0.101, 'compound': 0.4404}",0.4404
1322221637706678273,2020-10-30 16:59:38+00:00,"We have a truly inspiring story from Sudanese doctor Prof Osheik Ab’Asha Seidi to round up @ThisDoctorCan's  #BlackHistoryMonth series ⬇️

A HUGE thank you to everyone that has contributed.

You can find all the amazing stories that have been shared here: https://t.co/C06y4wmtkH https://t.co/yFQquyvE9J","{'neg': 0.0, 'neu': 0.668, 'pos': 0.332, 'compound': 0.9471}",0.9471
1322182537112965124,2020-10-30 14:24:16+00:00,"""A new light has been shone on the inequalities in our society, and lung health plays a major part in this,"" writes Adam Croom of @lunguk &amp; @asthmauk in his blog post for the launch of the Inequalities in Health Alliance. 👇

#HealthyLivesForAll

https://t.co/CXhjnQFUI5","{'neg': 0.0, 'neu': 0.953, 'pos': 0.047, 'compound': 0.25}",0.25
1322146364080488448,2020-10-30 12:00:32+00:00,"Yesterday, we welcomed a group of fantastic physicians to the RCP at our first virtual new members ceremony.

It was a great opportunity for @bodgoddard and @donalnhs to carry on an RCP tradition and connect with diplomates from around the world.

Congratulations new members! 👏 https://t.co/O61QBPpvB0","{'neg': 0.0, 'neu': 0.69, 'pos': 0.31, 'compound': 0.9523}",0.9523
1322116668064223232,2020-10-30 10:02:32+00:00,"The winning #RCPTurnerWarwick lecturer for the #RCPYorkshire region and one of the two winners from #RCPLondonRegion will present their lectures on 6 November at 12.30pm. The winning trainees are… 

Register for this free event now: https://t.co/AdGcvOtMvH https://t.co/VfHUCfJFAY","{'neg': 0.0, 'neu': 0.699, 'pos': 0.301, 'compound': 0.9297}",0.9297
1322104732564029442,2020-10-30 09:15:06+00:00,"The IHA is demanding a cross-government strategy to reduce health inequalities.

Almost two thirds of those surveyed by @YonderConsult agreed that governments across the UK should be doing more to address the issue. #HealthyLivesForAll

https://t.co/nmoFu84JgA https://t.co/QUm7LDyg16","{'neg': 0.051, 'neu': 0.892, 'pos': 0.057, 'compound': 0.0516}",0.0516
1321824107730620417,2020-10-29 14:40:00+00:00,"""The RCP is ideally placed to highlight the impact of health inequalities, and members of the patient and carer network (PCN) can provide invaluable support and insight into this work.""

Read PCN rep Hayley Hall's blog post below 👇

#HealthyLivesForAll

https://t.co/keW7kHOEIS https://t.co/OegsoJDNSf","{'neg': 0.0, 'neu': 0.828, 'pos': 0.172, 'compound': 0.7845}",0.7845
1321814735550140416,2020-10-29 14:02:45+00:00,"RCP Immediate past-president @DacreJane will speak on gender inequality at the National new consultants conference, drawing on her own experiences and offering insight into dealing with this issue.  

#RCPMembers receive a 50% discount, register now: https://t.co/RJPSKh3ne6 https://t.co/lrU6DXiQHN","{'neg': 0.0, 'neu': 1.0, 'pos': 0.0, 'compound': 0.0}",0.0
1321785433630609408,2020-10-29 12:06:19+00:00,"There are many causes of health inequalities but deprivation is a key factor. 

It's vital that the impact of policies made at the highest level of government on the poorest in society are weighed up before final decisions are made: https://t.co/nmoFu84JgA 

#HealthyLivesForAll https://t.co/wJcaguPt6X","{'neg': 0.168, 'neu': 0.776, 'pos': 0.056, 'compound': -0.7684}",-0.7684
1321753838446104577,2020-10-29 10:00:46+00:00,".@RCP_SFDN is inviting self-nominations from committed and passionate student and foundation doctor #RCPMembers to fill vacancies in East of England, the midlands, the south east, Wales and Yorkshire. Applications close 16 November. Apply now: https://t.co/sToRYyRxnf","{'neg': 0.0, 'neu': 0.804, 'pos': 0.196, 'compound': 0.7783}",0.7783
1321494920214044674,2020-10-28 16:51:55+00:00,"""Being in a minority, I have recognised the importance of having black men and women in medicine.""

Monique Bediako talks about her goal as an aspiring physician associate in her brilliant blog for @ThisDoctorCan's #BlackHistoryMonth series ⬇️ https://t.co/zkaGq0PAzm","{'neg': 0.0, 'neu': 0.844, 'pos': 0.156, 'compound': 0.743}",0.743
1321464889530077184,2020-10-28 14:52:35+00:00,"""Socio-economic factors such as under-employment or poverty play a key role in driving obesity and poor health,"" writes @ProfBatterhamMD in her blog post to mark the launch of the Inequalities in Health Alliance.

#HealthyLivesForAll

Read it in full here: https://t.co/WRQ3as17LV https://t.co/SpgCqLabqk","{'neg': 0.14, 'neu': 0.808, 'pos': 0.052, 'compound': -0.6124}",-0.6124
1321383764224737282,2020-10-28 09:30:14+00:00,"It’s the third and final day of our acute and general medicine conference.  

Don’t miss out on today’s sessions – register now! 

Delegates will also gain access to all previous sessions, on-demand for up to 30 days.  

https://t.co/5Q18JPdVs5 https://t.co/0yHRD1gfFj","{'neg': 0.039, 'neu': 0.872, 'pos': 0.089, 'compound': 0.4753}",0.4753
1321119465904377857,2020-10-27 16:00:00+00:00,"""In the post-COVID world in which health inequalities have been exacerbated, effective policies that address smoking prevalence &amp; treatment have never been more important,"" writes @LeicesterLungs in his blog post below 👇

#HealthyLivesForAll

https://t.co/rAh9MqGGI3","{'neg': 0.0, 'neu': 0.912, 'pos': 0.088, 'compound': 0.4767}",0.4767
1321096017136279552,2020-10-27 14:26:49+00:00,"#COVID19 has exposed &amp; amplified underlying inequalities in society.

With the second wave hitting those already most disadvantaged, the IHA call on the PM to develop a cross-government strategy to reduce health inequalities &amp; ensure #HealthyLivesForAll.

https://t.co/D96ggzXUx3 https://t.co/Ga0gbmP18H","{'neg': 0.105, 'neu': 0.831, 'pos': 0.064, 'compound': -0.1761}",-0.1761
1321060836593573889,2020-10-27 12:07:02+00:00,@jsbamrah @BAPIOUK @RameshMehta15 @bodgoddard @donalnhs Thanks for your offer of support - it's much appreciated. If you would like to join the IHA please email policy@rcplondon.ac.uk for more information. Thanks again.,"{'neg': 0.0, 'neu': 0.55, 'pos': 0.45, 'compound': 0.9501}",0.9501
