id,created_at,text,scores,compound
1235233660183425025,2020-03-04 16:00:28+00:00,"In our new blog, Colonel Paul Parker, our #DCOTS course director, explains why #seniortrainees and #consultants in #orthopaedic, #general and #plasticsurgery should attend the course to learn invaluable life-saving trauma skills. Read the blog here: https://t.co/boJ0613Qnt https://t.co/unQhtkM6ng","{'neg': 0.072, 'neu': 0.928, 'pos': 0.0, 'compound': -0.4215}",-0.4215
1235210944294383617,2020-03-04 14:30:12+00:00,"In the March Bulletin, Mark Taylor investigates the shortage of #doctors in the UK and the strategies needed to target the crisis. 🚨 Out now: https://t.co/z42tNj0bnK https://t.co/bzZL3YRUUf","{'neg': 0.203, 'neu': 0.797, 'pos': 0.0, 'compound': -0.7269}",-0.7269
1235150556873797633,2020-03-04 10:30:15+00:00,Are you ready for some surgical myth-busting? Our Surgical myth-busting webinar will take place tonight! Tune in to listen to our experts @ArinSaha6  @OrthopodReg #medtwitter #orthotwitter deconstruct the misconceptions about the surgical profession. https://t.co/5nm5r26dfO https://t.co/icNnmDSCrs,"{'neg': 0.0, 'neu': 0.924, 'pos': 0.076, 'compound': 0.4199}",0.4199
1234858614466195463,2020-03-03 15:10:10+00:00,"A BIG thank you to our Vitality @OfficialBigHalf team. They all successfully crossed the finish line raising just under £2k for our Surgical Research Fund. Do you fancy a challenge in support of the RCS? Visit: https://t.co/f5H3R7HmmM
#FitforSurgery #MovedByLondon https://t.co/0PVAk8s8LS","{'neg': 0.0, 'neu': 0.733, 'pos': 0.267, 'compound': 0.875}",0.875
1234841112034074625,2020-03-03 14:00:38+00:00,"Visit our Instagram to watch @scarlettmcnally’s #NCW2020 #mythbusting video in our story highlight to find out more about the miracle cure that is #exercise 🏃‍♀️⚽ https://t.co/YpiWK3WHI0

Illustration by @TerouzP https://t.co/Mg7cHvVf83","{'neg': 0.0, 'neu': 0.812, 'pos': 0.188, 'compound': 0.7553}",0.7553
1234829721113944069,2020-03-03 13:15:22+00:00,"How can exercise help you recover from #surgery? ‘People get a lot of benefit from feeling they’re contributing [to their health]... and there’s evidence it gets them out of hospital quicker,’ says @scarlettmcnally in @irishexaminer: https://t.co/ft709tvUIy","{'neg': 0.0, 'neu': 0.816, 'pos': 0.184, 'compound': 0.7351}",0.7351
1234807015265972224,2020-03-03 11:45:08+00:00,Our recent editions of the Bulletin feature great articles for #careers information and guidance. With an RCS Affiliate membership you can access advice and resources to help you stand out from the crowd. Check out our #NCW2020 recommended reading list: https://t.co/3o43Cwc0pQ https://t.co/VgiIwJUgE8,"{'neg': 0.0, 'neu': 0.819, 'pos': 0.181, 'compound': 0.8225}",0.8225
1234511520832409605,2020-03-02 16:10:57+00:00,"This #NCW2020 we have produced a range of content around #mythbusting the stereotypes surrounding a #career in surgery. Visit our Instagram each day this week and watch real surgeons highlight key stereotypes of the profession: https://t.co/CUMNrTc6NJ

Illustration by @TerouzP https://t.co/cP5VIDHSvQ","{'neg': 0.0, 'neu': 0.939, 'pos': 0.061, 'compound': 0.34}",0.34
1233874442717143041,2020-02-29 21:59:26+00:00,@grahamjsutton Suggest you contact HQIP direct. Sorry we can’t be of more help!,"{'neg': 0.083, 'neu': 0.706, 'pos': 0.211, 'compound': 0.4561}",0.4561
1233873317808963585,2020-02-29 21:54:57+00:00,Good luck James &amp; running team! 🏃‍♂️🎉 https://t.co/70i0oJqF5u,"{'neg': 0.0, 'neu': 0.492, 'pos': 0.508, 'compound': 0.7345}",0.7345
1233439255923503105,2020-02-28 17:10:09+00:00,"Our Council Member, @scarlettmcnally, says that exercise and emotional wellbeing can prepare patients for #surgery. 
https://t.co/nM8jO4QLWM","{'neg': 0.0, 'neu': 0.904, 'pos': 0.096, 'compound': 0.1531}",0.1531
1233410433723326465,2020-02-28 15:15:37+00:00,"Great meeting this morning with Chris Munsch from 
@NHS_HealthEdEng discussing #FutureOfSurgery and how to train surgeons in robotic techniques, with RCS Council member Richard Kerr @RscKerr, and RCS Robotics Leads Naeem Soomro and Simon Bach. https://t.co/I1tCrghb5x","{'neg': 0.0, 'neu': 0.895, 'pos': 0.105, 'compound': 0.6249}",0.6249
1233407291686313984,2020-02-28 15:03:08+00:00,"Mark Taylor, our Director for Northern Ireland, tells the BBC: “It is universally accepted that the waiting times in #NorthernIreland are the worst in the UK.” 
https://t.co/Sa7ybWcBfF","{'neg': 0.131, 'neu': 0.801, 'pos': 0.067, 'compound': -0.4588}",-0.4588
1233366267396001793,2020-02-28 12:20:07+00:00,More than 93% of surgeons in our survey on Northern Ireland waiting times said there were not enough beds in their trust to admit patients for #surgery. Read the key findings and download the report: https://t.co/HG4vr5wBHO https://t.co/buc8lkHRm9,"{'neg': 0.0, 'neu': 0.873, 'pos': 0.127, 'compound': 0.6249}",0.6249
1233317189639376897,2020-02-28 09:05:06+00:00,"More than 64% of surgeons had to cancel operations at the last minute, our survey on Northern Ireland waiting times found. Find out the reasons why in our report: https://t.co/5m0KQbF2fK https://t.co/Y68R6J7kax","{'neg': 0.062, 'neu': 0.938, 'pos': 0.0, 'compound': -0.25}",-0.25
1233111027904122885,2020-02-27 19:25:53+00:00,@grahamjsutton Is this what you’re after? https://t.co/O0AdyurkZH,"{'neg': 0.0, 'neu': 1.0, 'pos': 0.0, 'compound': 0.0}",0.0
1233109540570308611,2020-02-27 19:19:59+00:00,@jonnyruss @NHS_HealthEdEng @NewcastleHosps @NTeesHpoolNHSFT Well done Jonny 🎉🎉,"{'neg': 0.0, 'neu': 0.769, 'pos': 0.231, 'compound': 0.2732}",0.2732
1233078144023875585,2020-02-27 17:15:13+00:00,Our survey on Northern Ireland waiting times found that nearly 60% of surgeons had to undertake more complex #surgery on patients because of long waits. Read the key findings: https://t.co/hcVPzk1Q8B #NI https://t.co/xij4eoojLi,"{'neg': 0.0, 'neu': 1.0, 'pos': 0.0, 'compound': 0.0}",0.0
1233054205759410176,2020-02-27 15:40:06+00:00,Our Surgical-skills webinar is less than 1 week away! Tune into our webinar on Wednesday 4 March to listen to our experts @ArinSaha6 @OrthopodReg discuss  the differences between a real life surgical career and the medical shows we watch on TV: https://t.co/NUAYAtMEnT https://t.co/AFUVW1MpSC,"{'neg': 0.0, 'neu': 1.0, 'pos': 0.0, 'compound': 0.0}",0.0
1232923404300423170,2020-02-27 07:00:20+00:00,"Looking to build on your knowledge and learn new skills?  Our #DCOTS course will teach you the skills needed to manage severely injured patients with life-threatening musculoskeletal injuries, often in challenging and time-critical circumstances: https://t.co/Cx5b2rbMrc https://t.co/5hXb2gcyWz","{'neg': 0.141, 'neu': 0.819, 'pos': 0.04, 'compound': -0.6249}",-0.6249
1232727266926440449,2020-02-26 18:00:58+00:00,"There is still time to book onto our Professional Behaviours Masterclass in April. It is the first step to becoming certified with our cosmetic surgery certification scheme, aiming to make the industry safer for patients: https://t.co/gLy8lbR5Q1 https://t.co/IJLp3JFv0e","{'neg': 0.0, 'neu': 0.928, 'pos': 0.072, 'compound': 0.4215}",0.4215
1232707468108627968,2020-02-26 16:42:17+00:00,@Tristan27856485 Appreciate this is causing some concern.  Worth reading their clarification https://t.co/zD4qdccfF6,"{'neg': 0.0, 'neu': 0.685, 'pos': 0.315, 'compound': 0.5574}",0.5574
1232698126399610880,2020-02-26 16:05:10+00:00,"What issues are important to you? Our 2020 Council elections are now open, with 28 candidates standing for 9 positions. Voting will close at 5pm on Friday 3 April. This is your chance to decide who represents you, have your say today: https://t.co/UQBvlVrOyT https://t.co/dpcVCrtfIu","{'neg': 0.0, 'neu': 0.913, 'pos': 0.087, 'compound': 0.4215}",0.4215
1232635239152988166,2020-02-26 11:55:16+00:00,"Mr Mark Taylor, @RCSnews director for Northern Ireland, &amp; colleagues, met @healthdpt minister Robin Swann &amp; his team, to discuss how to reduce waiting times for patients in NI. Our survey of the impact of lengthening waiting times for surgery on patients informed the discussion. https://t.co/oviDxBMjYY","{'neg': 0.0, 'neu': 1.0, 'pos': 0.0, 'compound': 0.0}",0.0
1232606376695943168,2020-02-26 10:00:35+00:00,RCS members - get involved with our Specialty Updates by submitting your own research https://t.co/hTbp2rQl9S This month's Colorectal Surgery Update features the work of @VidehaSharma and colleagues #colorectalsurgery #colorectalresearch https://t.co/QAwAH9ISV5,"{'neg': 0.0, 'neu': 1.0, 'pos': 0.0, 'compound': 0.0}",0.0
1232304675162132482,2020-02-25 14:01:44+00:00,"We're holding a workshop for foundation and core trainees in Warrington on 23 April. Review your portfolio with experienced consultants and learn more about managing your career to avoid burnout. To find out more and book, visit https://t.co/8AWyKEdqjG https://t.co/ERkhnJ0xi8","{'neg': 0.056, 'neu': 0.944, 'pos': 0.0, 'compound': -0.296}",-0.296
1232278821094797312,2020-02-25 12:19:00+00:00,"We - and other leading health organisations - have written to the PM, to ask him to accept the recommendations of the ‘Health Equity in England: the Marmot review 10 years on’. The report says life expectancy has stalled for the first time in 120 years. https://t.co/gnuzYtceoA","{'neg': 0.038, 'neu': 0.907, 'pos': 0.055, 'compound': 0.2023}",0.2023
1232259023916937222,2020-02-25 11:00:20+00:00,"#ICYMI: A blog from our President, Prof Derek Alderson, on what needs to be done to safeguard patient safety in the independent sector.  #PatersonInquiry. 
https://t.co/R6rrkNuZDr","{'neg': 0.0, 'neu': 0.803, 'pos': 0.197, 'compound': 0.6597}",0.6597
1230916537784995841,2020-02-21 18:05:46+00:00,"Surgeons will need to play a key role in genomics: acquiring &amp; handling tissue samples and being the first to discuss genetic analysis with a patient.
Get ahead of the curve with this two day course ‘Genomics for surgeons’, 23-24 April  @unisouthampton https://t.co/bUkzP5V77P","{'neg': 0.0, 'neu': 0.943, 'pos': 0.057, 'compound': 0.34}",0.34
1230805498838110208,2020-02-21 10:44:32+00:00,"Our Council Member, @rsckerr, tells the @DailyMailUK that we urgently need a national strategy and quality training to integrate robots into surgical teams. #versius #futureofsurgery 

https://t.co/xHEWu9qdP6","{'neg': 0.0, 'neu': 1.0, 'pos': 0.0, 'compound': 0.0}",0.0
1230469797055516672,2020-02-20 12:30:35+00:00,"Together with @BAAPSMedia and @BAPRASvoice we're seeking plastic surgeons with experience of running their own cosmetic surgery practice, to help write and edit content for our Professional Behaviours Masterclass. To find out more, please email: certify@rcseng.ac.uk https://t.co/qgkQRxc2le","{'neg': 0.0, 'neu': 0.869, 'pos': 0.131, 'compound': 0.6478}",0.6478
1230160219872931842,2020-02-19 16:00:26+00:00,"We welcome plans for a new #PatientSafety database. As outlined in our recommendations to the #PatersonInquiry, we need a single repository of information about consultants’ practice across the #NHS and private sector | https://t.co/79s69J6bN0","{'neg': 0.0, 'neu': 0.909, 'pos': 0.091, 'compound': 0.4588}",0.4588
1230146020933324801,2020-02-19 15:04:01+00:00,"Following the #PatersonInquiry report, we need a ‘single repository’ of data to bring together information on surgeon’s work across all sectors, write RCS President Prof. Derek Alderson in @bmj_latest | https://t.co/7XDxE1ZmET","{'neg': 0.0, 'neu': 1.0, 'pos': 0.0, 'compound': 0.0}",0.0
1229790927985741824,2020-02-18 15:33:00+00:00,"@CELovegrove @hayleymagill @RCSEd @RCSI_Irl @rcpsglasgow @ASiTofficial Furthermore, we have frozen membership fees for 4 years in a row and are working with ASiT and BOTA, who both sit on our council, to understand and try to address this issues where we can.","{'neg': 0.0, 'neu': 1.0, 'pos': 0.0, 'compound': 0.0}",0.0
1229780419752681475,2020-02-18 14:51:14+00:00,@CELovegrove @hayleymagill @RCSEd @RCSI_Irl @rcpsglasgow @ASiTofficial We totally understand the difficulties faced by people early in their surgical career. That's why we have reduced the price of some of our courses within the last year and offered bursaries and membership discounts. We are continually reviewing our offers to make them accessible.,"{'neg': 0.047, 'neu': 0.953, 'pos': 0.0, 'compound': -0.3535}",-0.3535
1229441228019830784,2020-02-17 16:23:25+00:00,"We are inviting applications for an RCS Surgical Specialty Lead in Neurosurgery, generously supported by @The_SBNS. Applications close 11 March. Find out more: https://t.co/JYGHLqzEQ1 https://t.co/lc9o9iJCQ5","{'neg': 0.0, 'neu': 0.748, 'pos': 0.252, 'compound': 0.7506}",0.7506
1228620058106236929,2020-02-15 10:00:23+00:00,"Our Professional Behaviours Masterclass is the first step to becoming certified with our #CosmeticSurgery certification scheme, aiming to make the industry safer for patients. Book onto our April masterclass now: https://t.co/uuP8lGTsCZ https://t.co/IOliI683cy","{'neg': 0.0, 'neu': 0.917, 'pos': 0.083, 'compound': 0.4215}",0.4215
1228292830235447296,2020-02-14 12:20:05+00:00,"From everyone at the RCS, we wish you all great cardiovascular health this #ValentinesDay2020 ❤️ https://t.co/l6bTQDl9yo","{'neg': 0.0, 'neu': 0.673, 'pos': 0.327, 'compound': 0.7783}",0.7783
1228242585820573698,2020-02-14 09:00:26+00:00,"On the fence about choosing a surgical career? Maybe the myths surrounding it have kept you at bay? If so, we are here to challenge them all with our surgical myth-busting webinar! Questions will be answered by our expert panellists. Book your place now https://t.co/sXPhydv49A https://t.co/nU32GZH4jb","{'neg': 0.0, 'neu': 0.958, 'pos': 0.042, 'compound': 0.2387}",0.2387
1227997423554977792,2020-02-13 16:46:15+00:00,"Meet the next President of the RCS, Prof. @mortensen_neil.
‘After seven years on the Council of the RCS, it is a huge honour to have been elected as President.’ Read his full statement: https://t.co/AEOD8V7LTZ https://t.co/qW0DDOWsDm","{'neg': 0.0, 'neu': 0.842, 'pos': 0.158, 'compound': 0.7184}",0.7184
1227936688959295488,2020-02-13 12:44:55+00:00,"Our response to the #NHS England quarterly figures [Oct to Dec 2019] on cancelled surgeries. “A cocktail of pressures is hitting our hospitals. We need swift action and investment in nurses and beds.” 
https://t.co/KgJKb5DUjE","{'neg': 0.116, 'neu': 0.836, 'pos': 0.049, 'compound': -0.3612}",-0.3612
1227924182132051969,2020-02-13 11:55:13+00:00,"In the latest issue of the Bulletin, Daniels et al ask whether it’s possible for core surgical trainees working in plastic surgery to meet the training standards set by the Joint Committee on Surgical Training. Access the article here: https://t.co/LOOQBHzaWF https://t.co/y9UFor6IOH","{'neg': 0.0, 'neu': 1.0, 'pos': 0.0, 'compound': 0.0}",0.0
1227920988823793664,2020-02-13 11:42:32+00:00,"We’re delighted to announce that @mortensen_neil has been elected our next President, taking up post in July 2020. A colorectal surgeon from Oxford, he takes up the reins as we launch a new 5-year plan and move into our new London HQ. #reshuffle https://t.co/j4KX1zl9LH","{'neg': 0.0, 'neu': 0.926, 'pos': 0.074, 'compound': 0.5106}",0.5106
1226876136996646913,2020-02-10 14:30:39+00:00,"‘The role of the surgeon is not limited to the operating theatre; surgeons have a responsibility to engage with patients on a holistic level,’ assert Swain et al in this month's Bulletin. Read it here: https://t.co/wXp3Guk9sv https://t.co/xMhT6Z8nW2","{'neg': 0.0, 'neu': 0.89, 'pos': 0.11, 'compound': 0.4707}",0.4707
1226827253234966528,2020-02-10 11:16:25+00:00,Need #MondayMotivation? Vascular surgeon and RCS fellow Neil Hopper recently returned to work after both his legs were amputated 👏. Here’s how his experience as a patient has changed his perspective as a surgeon: https://t.co/GYAZMXS1mO,"{'neg': 0.0, 'neu': 1.0, 'pos': 0.0, 'compound': 0.0}",0.0
1225722331026333696,2020-02-07 10:05:51+00:00,"Paul Spraggs, one of our Council Members, talks to @HuffPostUKLife about rhinitis and its effect on the quality of our lives. 
https://t.co/wLrpJwwszD","{'neg': 0.0, 'neu': 1.0, 'pos': 0.0, 'compound': 0.0}",0.0
1225496726036938752,2020-02-06 19:09:22+00:00,"Richard Kerr, @rcsnews Commission on Future of Surgery Chair, makes the case for robotics, 3D printing, AR, VR and genomic medicine at AI and Robotics conference in London. But reminds audience of the value of empathy and the human touch. https://t.co/yd5M2ceTyI","{'neg': 0.0, 'neu': 0.928, 'pos': 0.072, 'compound': 0.4767}",0.4767
1225489330937958402,2020-02-06 18:39:59+00:00,Great to meet so many women and men at tonight's @UKWENTs @ENT_UK RADA workshop on communication and confidence. We are always pleased to support #WomeninSurgery events @WomenSurgeonsUK  #WithYouThroughout https://t.co/TcI1gcXqAK,"{'neg': 0.0, 'neu': 0.658, 'pos': 0.342, 'compound': 0.9186}",0.9186
1225441670201856000,2020-02-06 15:30:36+00:00,We have launched our Instagram channel! Head over to the app right now and give us a follow for regular updates and a behind-the-scene look at what we do 🙌 https://t.co/jPZmll1OSi,"{'neg': 0.0, 'neu': 0.938, 'pos': 0.062, 'compound': 0.2003}",0.2003
1225426595080495104,2020-02-06 14:30:42+00:00,"Do stereotypical impressions of surgeons still exist? Do consultant surgeons recognise the role of #emotions in teaching? In the February issue of the Bulletin, we examine the impact of emotions on medical students. Access the article here: https://t.co/HMNGB9QvVV https://t.co/vkUP0j32tD","{'neg': 0.0, 'neu': 0.944, 'pos': 0.056, 'compound': 0.3094}",0.3094
1225377187886436352,2020-02-06 11:14:22+00:00,"It’s #TimeToTalk about burnouts in surgery. For surgeons, a lot of the #stress begins to build up as medical students. In the February edition of the Bulletin, we look at ways to combat this: https://t.co/NRaisakEJC https://t.co/0J7knJ3bPP","{'neg': 0.066, 'neu': 0.934, 'pos': 0.0, 'compound': -0.34}",-0.34
1225002396234997760,2020-02-05 10:25:05+00:00,"This February, the Bulletin is available in a digital format. In our latest issue, we ask whether interventions at work can help mitigate burnout and a surgeon examines practical anatomy teachings across UK medical schools. Read this, and more, here: https://t.co/UL1EK36PHX https://t.co/PoarGMdIHH","{'neg': 0.0, 'neu': 0.935, 'pos': 0.065, 'compound': 0.4019}",0.4019
1224977070381576192,2020-02-05 08:44:27+00:00,On ⁦@BBCr4today⁩ our President points out there is a Bill going through Parliament - the Health Service Safety Investigation Bill - that should be extended to include the private sector. #PatersonInquiry #patientsafety https://t.co/21ndqrWopL,"{'neg': 0.0, 'neu': 0.912, 'pos': 0.088, 'compound': 0.4215}",0.4215
1224731326282190848,2020-02-04 16:27:57+00:00,"We welcome the #PatersonInquiry recommendations today which are designed to improve safety. “The test will be whether the government and regulators act on these recommendations.” 
https://t.co/66i18085Oz","{'neg': 0.0, 'neu': 0.726, 'pos': 0.274, 'compound': 0.8271}",0.8271
1224673949956694017,2020-02-04 12:39:57+00:00,There are still spaces for the Women in ENT UK 'Hold Your Space' workshop on Thursday evening.  Open to all specialties @WomenSurgeonsUK @UKWENTs @ENT_UK https://t.co/1Rq1w5B4Fs,"{'neg': 0.0, 'neu': 1.0, 'pos': 0.0, 'compound': 0.0}",0.0
1224636242001829899,2020-02-04 10:10:07+00:00,"Ahead of the publication of #PatersonInquiry, Derek Alderson, our President, says “we must do everything possible to ensure that a rogue individual cannot do so much harm to so many, ever again.”
https://t.co/vYzxfCqadF","{'neg': 0.104, 'neu': 0.825, 'pos': 0.071, 'compound': -0.2911}",-0.2911
1223269729139404801,2020-01-31 15:40:05+00:00,Prof Michael Escudier from @FDS_RCS speaks to @cypnow and says that the Early Years Foundation proposal will make an important contribution to tackling child tooth decay.  https://t.co/oGV5s9YsSo,"{'neg': 0.092, 'neu': 0.847, 'pos': 0.061, 'compound': -0.2263}",-0.2263
1223256001035624448,2020-01-31 14:45:32+00:00,"Just as antibiotics were the miracle of the 20th century, exercise can be the miracle cure of the 21st, argues RCS council member @scarlettmcnally in a blog for @bmj_latest | https://t.co/ofwE0KSVIW","{'neg': 0.072, 'neu': 0.718, 'pos': 0.21, 'compound': 0.7184}",0.7184
1223221900605829121,2020-01-31 12:30:02+00:00,Great to have held yet another heat for our #RCSSkillsComp last night in Oxford! Thanks to Devan and Billy for organising it and congratulations to Rikhil and Oliver who will compete in the final. Consultants can get involved with judging the final: https://t.co/s5YQyRDBOF https://t.co/yQXkXkgGIt,"{'neg': 0.0, 'neu': 0.786, 'pos': 0.214, 'compound': 0.9041}",0.9041
1222927589276209155,2020-01-30 17:00:32+00:00,"One week to go until our new webinar 'Demystifying the NHS pension scheme' on Thursday 6 February, 6pm. Tune in to hear @ChasedeVereMed  sharing their knowledge on pensions and financial planning for surgeons. Free for members, book now: https://t.co/8KfjPYezuS https://t.co/2t5rJDmggQ","{'neg': 0.0, 'neu': 0.858, 'pos': 0.142, 'compound': 0.7269}",0.7269
1222830967636799488,2020-01-30 10:36:36+00:00,A royal college that can do it all! Our latest digital exhibition on our makeovers over the years is available here: https://t.co/zKWVemvFA3 #DollyPartonChallenge https://t.co/GmnkvGaN2y,"{'neg': 0.0, 'neu': 1.0, 'pos': 0.0, 'compound': 0.0}",0.0
1222491696937738240,2020-01-29 12:08:28+00:00,"Our #RCSSkillsComp 2020 final is coming up! We need you to help judge the top CT2 from across the UK. If you are a General, T&amp;O or Plastics consultant and can help on Saturday 14 March in London, get in touch: https://t.co/s5YQyRDBOF https://t.co/WRtxVTsqDC","{'neg': 0.0, 'neu': 0.839, 'pos': 0.161, 'compound': 0.7574}",0.7574
1222487784587431937,2020-01-29 11:52:55+00:00,"SAS and LE doctors are an integral part of our medical workforce. The worrying instances of bullying and exclusion highlighted in the survey go against the core values of the #NHS, says Dr Vinita Shekar, Chair of the RCS SAS Forum. Read our full statement: https://t.co/qF1ARC91Ub https://t.co/q5Ye1VpXXw","{'neg': 0.157, 'neu': 0.793, 'pos': 0.05, 'compound': -0.7003}",-0.7003
1222107012860915713,2020-01-28 10:39:52+00:00,The @BBCNews reports that prostate cancer is now the most commonly diagnosed cancer in England because more men are getting tested. Read the @NPCA_uk report 2019 on the care &amp; outcomes of men diagnosed with or treated for prostate cancer here: https://t.co/QdSxkm2XIi,"{'neg': 0.243, 'neu': 0.699, 'pos': 0.059, 'compound': -0.9001}",-0.9001
1221821162830925824,2020-01-27 15:44:00+00:00,"‘We need ministers to agree a robust five-year plan to bring down waiting times, with at least 3,000 more beds,’ RCS President Prof. Derek Alderson told @DailyMirror: https://t.co/7UGM59D7ST","{'neg': 0.0, 'neu': 0.836, 'pos': 0.164, 'compound': 0.5994}",0.5994
1220745738625392640,2020-01-24 16:30:39+00:00,@manukwij Training the trainers course helps you become the best clinical trainer you can be!,"{'neg': 0.0, 'neu': 0.647, 'pos': 0.353, 'compound': 0.7959}",0.7959
1220678937891803136,2020-01-24 12:05:12+00:00,"The beautiful Hortus Malabaricus, the oldest printed book on the flora of southern #India, contains descriptions and illustrations of 742 plants and their medicinal properties. Discover the origins of the book in our #LibraryBlog: https://t.co/GoYbaszB27 https://t.co/d7FL0Ugpxh","{'neg': 0.0, 'neu': 0.9, 'pos': 0.1, 'compound': 0.5994}",0.5994
1220388257869062146,2020-01-23 16:50:09+00:00,"On a recent trip to #Egypt, two neurosurgery specialists joined us on a visit to @AinShamsUn hospital, one of the oldest medical schools in Cairo. Here is their story on ties between the UK and Egyptian surgical community: https://t.co/yi6QCI3jE8 https://t.co/5XwAYcdZsX","{'neg': 0.0, 'neu': 1.0, 'pos': 0.0, 'compound': 0.0}",0.0
1220378186355265536,2020-01-23 16:10:07+00:00,Analysis of November waiting times shows a further decline in performance in Wales. RCS Director in Wales Richard Johnson urges the Welsh Health Boards not to let up in their focus on reducing the backlog of patients: https://t.co/wCCI78oz2Y https://t.co/tKtwET0aGU,"{'neg': 0.0, 'neu': 1.0, 'pos': 0.0, 'compound': 0.0}",0.0
1220367712641277953,2020-01-23 15:28:30+00:00,"The last piece of concrete is poured into our London home, marking a major historical landmark for the RCS and the future of surgery! @WatesGroup https://t.co/yTFtrmul7H","{'neg': 0.0, 'neu': 0.938, 'pos': 0.062, 'compound': 0.1511}",0.1511
1220366173080039425,2020-01-23 15:22:23+00:00,"Our President Prof Alderson marks our Topping Out ceremony at the top of our redeveloped building. Our new home will support the profession of the future, both at home and globally. ‘We are at the nerve centre of global surgery’ he says. #advancingsurgicalcare https://t.co/CYGo8iMUZ1","{'neg': 0.0, 'neu': 0.903, 'pos': 0.097, 'compound': 0.5423}",0.5423
1220364451624443904,2020-01-23 15:15:33+00:00,Sir James Wates @WatesGroup introduces our Topping Out ceremony to mark the highest point of the now completed structure of our London home. Fun facts: many social enterprises have supported the project and the cement from the old building has all been reused in the new! https://t.co/xtcrV13HTI,"{'neg': 0.0, 'neu': 0.884, 'pos': 0.116, 'compound': 0.7088}",0.7088
1220325659337199616,2020-01-23 12:41:24+00:00,@rchrdsn_ it was great to have you on the course!,"{'neg': 0.0, 'neu': 0.672, 'pos': 0.328, 'compound': 0.6588}",0.6588
1220017122128080899,2020-01-22 16:15:23+00:00,"We are inviting applications for an RCS Surgical Specialty Lead in Hand Surgery, generously supported by @BSSHand. Find out more: https://t.co/ZpIVhhSUfm https://t.co/VvtmDUgHKf","{'neg': 0.0, 'neu': 0.629, 'pos': 0.371, 'compound': 0.8625}",0.8625
