id,created_at,text,scores,compound
1394238823752736776,2021-05-17 10:30:13+00:00,"What can healthcare professionals do to mitigate the barriers to good health outcomes created by socio-economic inequality? In the fourth podcast of our series with @MelaninMedics, @NeenaModi1 and  @ayomide_ayorind discuss. Listen now https://t.co/zx8R0ZeueG https://t.co/Kz9sLJxaJB","{'neg': 0.0, 'neu': 0.867, 'pos': 0.133, 'compound': 0.5994}",0.5994
1393868908923346952,2021-05-16 10:00:19+00:00,"Did you know? UK trainees are able to save up to £512 on their membership fees in the first four years post-MRCS, just by taking their MRCS Part B with us! Learn more about the benefits of our First 4 membership package:  https://t.co/V7LHmGPfKS https://t.co/KfxBEAhrRB","{'neg': 0.0, 'neu': 0.863, 'pos': 0.137, 'compound': 0.7473}",0.7473
1393232508695756804,2021-05-14 15:51:29+00:00,"@monicabell Hi Monica, please email careers@rcseng.ac.uk and one of our team will be happy to advise you and provide some further resources regarding careers in surgery.","{'neg': 0.0, 'neu': 0.8, 'pos': 0.2, 'compound': 0.7184}",0.7184
1393193597479030789,2021-05-14 13:16:52+00:00,"Our response to yesterday's waiting time statistics has been reported by a number of media publications, including in @guardiannews. 

https://t.co/FySG0qbOs7","{'neg': 0.0, 'neu': 0.933, 'pos': 0.067, 'compound': 0.0772}",0.0772
1393129090425761794,2021-05-14 09:00:32+00:00,"Do you want to learn more about the new SAS grade? Tune in to our #RCSWebinar on Wednesday 19 May at 6pm where our panel @TMitchellFRCS, Ananda Nanu, Vinita Shekar will be discussing a range of topics including the diversity report and the SAS action plan. https://t.co/2j3ZG73lAv https://t.co/HebDqM8w3P","{'neg': 0.0, 'neu': 0.973, 'pos': 0.027, 'compound': 0.0772}",0.0772
1392834541291716609,2021-05-13 13:30:06+00:00,We're unable to accommodate all of the beautiful furniture from the Barry Reading Room in our new home of surgery. But it won't go to waste! Find out how you can bid on your own piece of College history at our first-ever fundraising auction on 29 June: https://t.co/I1hgYPWzGB https://t.co/pN7HITJU9A,"{'neg': 0.0, 'neu': 0.891, 'pos': 0.109, 'compound': 0.6946}",0.6946
1392799107413168129,2021-05-13 11:09:18+00:00,"Our statement on the waiting time statistics published  today.
@TMitchellFRCS said:
""As we’ve seen the NHS do over the last year, we will pull together to serve patients. But we won’t be able to deal with the backlog overnight [without] more investment.""

https://t.co/PQdx4BOjBP","{'neg': 0.0, 'neu': 1.0, 'pos': 0.0, 'compound': 0.0}",0.0
1392781715672862721,2021-05-13 10:00:12+00:00,Eid Mubarak to our Muslim colleagues and friends. Today marks the end of the month long dawn-to-sunset fasting of Ramadan. Wishing you all a blessed and joyous #EidAlFitr. https://t.co/QaeKjBUsED,"{'neg': 0.0, 'neu': 0.649, 'pos': 0.351, 'compound': 0.9186}",0.9186
1392751556848766976,2021-05-13 08:00:21+00:00,"The cost of clinical negligence claims from incidents in 2019/20 is expected to cost the NHS £8.3bn

@NHSGIRFT
 &amp; 
@NHSResolution
 have worked together on best practice guidance to improve patient safety and help curb the costs 
Want to know more? https://t.co/8qs8IPc2Gf","{'neg': 0.0, 'neu': 0.721, 'pos': 0.279, 'compound': 0.9169}",0.9169
1392494942606569473,2021-05-12 15:00:40+00:00,"We are delighted to be working alongside our nursing colleagues to offer the Advanced Trauma Nursing Course (ATNC), following the patient journey from preparing for their arrival, through the resuscitation phase care. Find out more: https://t.co/VtznozPiFb #InternationalNursesDay https://t.co/TRblfhpvtS","{'neg': 0.062, 'neu': 0.751, 'pos': 0.188, 'compound': 0.6908}",0.6908
1392479943003676676,2021-05-12 14:01:04+00:00,"Are you interested in understanding more about how RCS England is supporting SAS Surgeons? On Wednesday 19 May we will be joined by @TMitchellFRCS, Ananda Nanu, Vinita Shekar to discuss the new SAS grade, the diversity report and the SAS action plan. https://t.co/i7pzjUseLO https://t.co/iQikwGV8CG","{'neg': 0.0, 'neu': 0.882, 'pos': 0.118, 'compound': 0.6808}",0.6808
1392449762000089092,2021-05-12 12:01:08+00:00,"We will be discussing how to attend to your mental health needs during challenging times at our webinar tonight. You still have time to register and join us https://t.co/VhqMfXoUBm
Because the best surgical brains protect their own minds #RCSWebinar #MentalHealthAwarenessWeek https://t.co/YuogpAgek1","{'neg': 0.0, 'neu': 0.777, 'pos': 0.223, 'compound': 0.8625}",0.8625
1392405454563778567,2021-05-12 09:05:04+00:00,"What next after we published the findings of our independent diversity review? In the latest issue of the Bulletin, Baroness Helena Kennedy QC and RCS England President @mortensen_neil discuss the College's next steps: https://t.co/jxMUw4PKjZ https://t.co/k1f8bP7VsW","{'neg': 0.0, 'neu': 1.0, 'pos': 0.0, 'compound': 0.0}",0.0
1392389154256965635,2021-05-12 08:00:18+00:00,"Happy #InternationalNursesDay to all of our wonderful colleagues. Thank you for all that you do within the #SurgicalCareTeam and for the care you provide to patients across the #NHS, particularly in these challenging times. https://t.co/qnRgpagdYX","{'neg': 0.0, 'neu': 0.667, 'pos': 0.333, 'compound': 0.9321}",0.9321
1392147783130435587,2021-05-11 16:01:11+00:00,"Tomorrow our Northern Ireland Board meet Health Minister @RobinSwannMoH. Together with the minister and senior team (@healthdpt), surgeons will discuss the devastating waiting lists that will take 10 years to address and the need for investment @markataylor16","{'neg': 0.107, 'neu': 0.893, 'pos': 0.0, 'compound': -0.6486}",-0.6486
1392106309521137668,2021-05-11 13:16:22+00:00,Apologies if you're experiencing server errors or delays when attempting to access your MFDS results. Please wait for an hour and try again while we resolve the issue. Thank you.,"{'neg': 0.067, 'neu': 0.726, 'pos': 0.207, 'compound': 0.6124}",0.6124
1392087171398578176,2021-05-11 12:00:20+00:00,"@scarlettmcnally and @ASiTofficial VP @kingmartin will discuss the challenges facing surgeons, and how they can best be supported at our webinar tomorrow at 6pm https://t.co/QEi7NOQEIC. 

Because the best surgical brains protect their own minds.
 #mentalhealthawarenessweek https://t.co/Lm1tSJ5Hjm","{'neg': 0.0, 'neu': 0.68, 'pos': 0.32, 'compound': 0.9274}",0.9274
1392058168058941440,2021-05-11 10:05:05+00:00,How has #COVID19 affected waiting times for surgery for hip fractures in the elderly? Malik-Tabassum et al investigate in the May issue of the Annals. Read for free: https://t.co/D5GqNoMpic https://t.co/8g6vzy6i7G,"{'neg': 0.049, 'neu': 0.851, 'pos': 0.1, 'compound': 0.4019}",0.4019
1392026789845864449,2021-05-11 08:00:23+00:00,Are you looking for a new challenge? We are looking for a new clinical lead and working group members to help us develop courses that deliver the practical skills and knowledge needed to look after surgical patients. Applications close on 20 May: https://t.co/s6tAuUgXwa https://t.co/sZq5JQ9wwL,"{'neg': 0.0, 'neu': 0.909, 'pos': 0.091, 'compound': 0.4588}",0.4588
1391709759242448897,2021-05-10 11:00:37+00:00,"You rated our Library services as one of the top benefits in our membership survey, but said you wanted improved access. We’ve now developed two new online search tools to help you search and retrieve current and historical content and resources: https://t.co/XLSZjwtnfW https://t.co/lNy7gxHvWD","{'neg': 0.0, 'neu': 0.782, 'pos': 0.218, 'compound': 0.872}",0.872
1391664424092643329,2021-05-10 08:00:29+00:00,"You can have an impact on our future learning agenda. The Expert Advisory Network is a space for professionals from any discipline who are interested in technology, research, innovation or education to come together. Join  us: https://t.co/4HkRNYbwLV 

With thanks to @BBraunUK https://t.co/EpqIJI6S29","{'neg': 0.0, 'neu': 0.781, 'pos': 0.219, 'compound': 0.8555}",0.8555
1390994823495233542,2021-05-08 11:39:44+00:00,"From robotics and sustainability to inclusivity and today's #NoTrainingTodayNoSurgeonsTomorrow session, there has been a range of thought-provoking talks this week at #ASGBI2021. Congratulations to @asgbi on an excellent congress. 👏","{'neg': 0.0, 'neu': 0.774, 'pos': 0.226, 'compound': 0.8225}",0.8225
1390987245000306689,2021-05-08 11:09:37+00:00,One piece of advice from Professor Averil Mansfield? Enjoy every minute of the amazing career you're in and retain your outside interests as much as you can. Enjoying her wisdom during this final session of #ASGBI2021! https://t.co/btyvuix2DO,"{'neg': 0.0, 'neu': 0.665, 'pos': 0.335, 'compound': 0.9441}",0.9441
1390986096624943107,2021-05-08 11:05:03+00:00,"In May’s issue of the Bulletin, we interview RCS England President @mortensen_neil and Baroness Helena Kennedy QC to discuss the findings of the recent independent diversity review. Read the full issue: https://t.co/sextAsaoYC https://t.co/xF1PWDCTd8","{'neg': 0.0, 'neu': 1.0, 'pos': 0.0, 'compound': 0.0}",0.0
1390964828995571712,2021-05-08 09:40:32+00:00,Great to debunk myths and hear some practical aspects of flexible training from @Beccajfish. Surgeons need support regardless of circumstance and gender. #ASGBI2021 https://t.co/01ZztnvGR4,"{'neg': 0.0, 'neu': 0.707, 'pos': 0.293, 'compound': 0.8271}",0.8271
1390957346692677635,2021-05-08 09:10:48+00:00,"Jon Lund from @JCST_Surgery reminds us that training should be ‘any time, any place, any case’ in this morning’s fascinating Focus on Training session at #ASGBI2021.  #NoTrainingTodayNoSurgeonsTomorrow","{'neg': 0.0, 'neu': 0.881, 'pos': 0.119, 'compound': 0.5423}",0.5423
1390703918968082437,2021-05-07 16:23:46+00:00,"Did you know 1 in 5 appendix removed are normal? Thanks to @JFAbercrombie for his wonderful talk on the role of the appendix and how we can reduce negative appendicectomy rates. QI, imaging and auditing results could make all the difference #ASGBI2021 https://t.co/ksCWzqAXaG","{'neg': 0.077, 'neu': 0.787, 'pos': 0.137, 'compound': 0.4404}",0.4404
1390701008595132417,2021-05-07 16:12:13+00:00,Fantastic to hear the patient perspective on breaking down stigmas associated with various medical conditions and how we can recognise and embrace differences. An important part of this inclusivity session from Mesha Moinirad at #ASGBI2021.,"{'neg': 0.0, 'neu': 0.806, 'pos': 0.194, 'compound': 0.7717}",0.7717
1390692787805466630,2021-05-07 15:39:33+00:00,"Should surgeons give lifestyle advice? Our council and @WomenSurgeonsUK member @scarlettmcnally says yes! We should use our position of trust to encourage exercise, which reduces the risk of diseases like bowel cancer and depression and helps with perioperative care #ASGBI2021 https://t.co/IS2YLWzbFW","{'neg': 0.17, 'neu': 0.533, 'pos': 0.298, 'compound': 0.7712}",0.7712
1390689009396027392,2021-05-07 15:24:32+00:00,"'Who is responsible for reduction in the NHS? Would you try reusable vs. disposable instruments?' A wonderful talk by @CleoKenington
at #ASGBI2021. We are committed to making surgery more sustainable: https://t.co/fMl4UK8O8p https://t.co/VDsq3CTq01","{'neg': 0.0, 'neu': 0.768, 'pos': 0.232, 'compound': 0.8156}",0.8156
1390683207801126919,2021-05-07 15:01:29+00:00,"@MaryMeekings Head of BMA CSER and wellbeing @BMAwellbeing, will be speaking about the support available to help you to attend your mental health needs at our webinar on 12 May. Register today: https://t.co/V1kdkGnsPV
Because the best surgical brains protect their own minds. https://t.co/ZWUFv57swW","{'neg': 0.0, 'neu': 0.762, 'pos': 0.238, 'compound': 0.9042}",0.9042
1390675958533967873,2021-05-07 14:32:40+00:00,"'The more inclusive a profession is, the more diverse and better talent it attracts.' Brilliant to hear from our newly elected Council member @NuhaZsurgeon at #ASGBI2021. We are committed to putting diversity at the heart of our strategy. https://t.co/FpIsxDkZbG https://t.co/pWD5MlxzUF","{'neg': 0.0, 'neu': 0.747, 'pos': 0.253, 'compound': 0.8971}",0.8971
1390666992429027328,2021-05-07 13:57:02+00:00,"A system-wide approach to increasing #resilience: Allow people to have a voice and influence in their work life, encouraging teamwork and providing opportunities to connect, and tackling the fundamental problems of workload in medicine, says @sifrazer at #ASGBI2021","{'neg': 0.063, 'neu': 0.751, 'pos': 0.185, 'compound': 0.6369}",0.6369
1390659829581111298,2021-05-07 13:28:35+00:00,"'If you're actively thinking ahead you can actively prevent an error from happening,' interesting insights from @BrennanSurgeon on situational awareness vs. error management. #ASGBI2021","{'neg': 0.17, 'neu': 0.566, 'pos': 0.264, 'compound': 0.25}",0.25
1390656154930454530,2021-05-07 13:13:59+00:00,Kicking off this afternoon's #ASGBI2021 session on human factors and all things resilience with RCS England Council member @BrennanSurgeon. https://t.co/QKQPT4n7K6,"{'neg': 0.0, 'neu': 1.0, 'pos': 0.0, 'compound': 0.0}",0.0
1390653923191574530,2021-05-07 13:05:07+00:00,Is it safe yet? Kinghorn et al explore patient attitudes about returning to hospital for orthopaedic care. Read the full article in May’s Annals here: https://t.co/AHxWjaGdL2 https://t.co/DUk7vgUs2M,"{'neg': 0.0, 'neu': 0.804, 'pos': 0.196, 'compound': 0.7269}",0.7269
1390577273368195077,2021-05-07 08:00:32+00:00,"We're delighted to have filled our spaces for @LondonMarathon. Good luck to our runners! If you would like to run for us we have places available for various distances, starting with #ASICSLDN10K this July. Sign up to fundraise for surgical research: https://t.co/E39ipZFl9S https://t.co/2LQLE7W29u","{'neg': 0.0, 'neu': 0.765, 'pos': 0.235, 'compound': 0.8999}",0.8999
1390322987438690313,2021-05-06 15:10:05+00:00,We're looking forward to joining @asgbi's Robotics in general surgery session! If you're interested in using technology and innovation to further the future of surgical education join our Expert Advisory Network. Find out more: https://t.co/EykoykLQ8t  #ASGBI2021 https://t.co/S6olmTCn0e,"{'neg': 0.0, 'neu': 0.814, 'pos': 0.186, 'compound': 0.7777}",0.7777
1390309169086046211,2021-05-06 14:15:11+00:00,What a fascinating hernia symposium at #ASGBI2021! Interested in learning more? The PGCert hernia module covers surgical approaches to a variety of common abdominal hernias. Take it as standalone eLearning or as part of the PGCert in Surgery programme. https://t.co/4e0f45rlyi https://t.co/RNnndTv7Gb,"{'neg': 0.0, 'neu': 0.851, 'pos': 0.149, 'compound': 0.7574}",0.7574
1390259618438389760,2021-05-06 10:58:17+00:00,"@SoleimanHossam Thank you Hossam. We hope to be back in our international centres soon, too 🌎","{'neg': 0.0, 'neu': 0.707, 'pos': 0.293, 'compound': 0.6597}",0.6597
1390245013112643584,2021-05-06 10:00:15+00:00,Registered nurses can now enroll on the Advanced Trauma Nursing Course (ATNC) with us. This heralds a new era in multi-professional learning alongside the ATLS here in the UK. Find out more: https://t.co/hOkemt0wqA https://t.co/vUIhJctIPM,"{'neg': 0.078, 'neu': 0.866, 'pos': 0.056, 'compound': -0.2023}",-0.2023
1390231121590431745,2021-05-06 09:05:03+00:00,"In May’s issue of the Annals, authors discuss simulation training in breast surgery, patient attitudes towards elective procedures during #COVID19 and the impact of lockdown on hip fractures in older patients. Read the full issue here: https://t.co/dgW4A0J6tK https://t.co/LG3PzNQjTe","{'neg': 0.0, 'neu': 1.0, 'pos': 0.0, 'compound': 0.0}",0.0
1390214897519190017,2021-05-06 08:00:35+00:00,Want to work with us? Why not join our faculty! Your expertise could help others develop in their careers and gives you the opportunity to gain valuable leadership and training experience. Find out more: https://t.co/4KtHCKblw8 https://t.co/T2Ltj8pvVS,"{'neg': 0.042, 'neu': 0.66, 'pos': 0.299, 'compound': 0.8935}",0.8935
1389965358958776320,2021-05-05 15:29:00+00:00,Fantastic range of speakers talking about COVID-19: Research and Lessons Learnt @asgbi  #ASGBI2021,"{'neg': 0.0, 'neu': 0.769, 'pos': 0.231, 'compound': 0.5574}",0.5574
1389943114127839233,2021-05-05 14:00:36+00:00,"Join us on 12 May to hear about how to prevent and manage mental health problems. @mihaelabucur10, Consultant Psychiatrist and Associate Registrar for Wellbeing and Retention for @rcpsych will be speaking on workforce wellbeing at our webinar. Book  here: https://t.co/lhtKAUypZZ https://t.co/viG1oIsRAs","{'neg': 0.061, 'neu': 0.864, 'pos': 0.075, 'compound': -0.1027}",-0.1027
1389902821558992896,2021-05-05 11:20:30+00:00,"@SoleimanHossam Hello Hossam, due to COVID-19 restrictions we are not running any MRCS Part B internationally at the moment.","{'neg': 0.0, 'neu': 1.0, 'pos': 0.0, 'compound': 0.0}",0.0
1389875031786803202,2021-05-05 09:30:04+00:00,Our unique First 4 membership package responds to your concerns about the financial burdens of training. Save up to £512 on your first four years of membership when you take your MRCS Part B with us! Learn more: https://t.co/Epw0VI2LRr https://t.co/AwEnWBnhiY,"{'neg': 0.06, 'neu': 0.857, 'pos': 0.083, 'compound': 0.2481}",0.2481
1389583570176446476,2021-05-04 14:11:55+00:00,81% of trainees have reported issues with mental health in @ASiTofficial's survey. If you are experiencing problems and would like confidential support from a trained counsellor please call our helpline on 02078696221 or find resources online: https://t.co/6mjwpBHhR3 #ASGBI2021 https://t.co/7CFIPlHPOF,"{'neg': 0.061, 'neu': 0.769, 'pos': 0.17, 'compound': 0.5859}",0.5859
1389580837050540038,2021-05-04 14:01:03+00:00,Our Chief Executive @AReed57 talked to @UK_ABHI  about the College’s role in improving surgical care at home and abroad. https://t.co/TekLlHX0AU,"{'neg': 0.0, 'neu': 0.75, 'pos': 0.25, 'compound': 0.7184}",0.7184
1389579839447961602,2021-05-04 13:57:05+00:00,"It is important for trainees to be aware of their options. Only a quarter of trainees surveyed by 
@ASiTofficial knew about the options to take an Out Of Programme Pause or take part in Less Than Full-Time training, these options could help improve your wellbeing #traineesmatter https://t.co/Nhw9IZqbkF","{'neg': 0.0, 'neu': 0.853, 'pos': 0.147, 'compound': 0.7506}",0.7506
1389575558472814597,2021-05-04 13:40:04+00:00,Come join our Surgical Trial Initiative! Our Surgical Trial Centres benefit from close working relationships with surgical specialty associations and patient groups. Find out more and apply by 26 May: https://t.co/X5zgqr4dRM https://t.co/C6YlVyLYLU,"{'neg': 0.0, 'neu': 0.845, 'pos': 0.155, 'compound': 0.6696}",0.6696
1389572393295917056,2021-05-04 13:27:30+00:00,"Fascinating to hear Professor @des_winter speak on the past, present and future of surgery. Particularly the challenge to elitism in our profession. It is fantastic to see the shift in the balance and a more diverse group of surgeons rising up! #ASGBI2021  https://t.co/HN6z62pRXN https://t.co/LKWnQmQvvl","{'neg': 0.0, 'neu': 0.817, 'pos': 0.183, 'compound': 0.8389}",0.8389
1389521682063314944,2021-05-04 10:05:59+00:00,We are pleased to be supporting #ASGBI2021. We're looking forward to meeting delegates and attending the fantastic sessions over the next five days. If you are attending the @asgbi conference don't forget to visit our virtual stand and say hello: https://t.co/XPgRTNyzwO https://t.co/ZU6QWjwUV5,"{'neg': 0.0, 'neu': 0.774, 'pos': 0.226, 'compound': 0.8769}",0.8769
1389503336399970306,2021-05-04 08:53:05+00:00,@DanyalKhalid22 Thanks Danyal! Looking forward to next week.,"{'neg': 0.0, 'neu': 0.687, 'pos': 0.313, 'compound': 0.4926}",0.4926
1389157907086909440,2021-05-03 10:00:29+00:00,"Discover our new library search tools, created to help you retrieve content. Our Surgical Library contains modern, clinical resources and if you’re looking for older books, journals and archives, you can find them within our Heritage Collections:  https://t.co/6xvm6HOWYa https://t.co/viSUB5wH6n","{'neg': 0.0, 'neu': 0.887, 'pos': 0.113, 'compound': 0.5719}",0.5719
1389127696555388934,2021-05-03 08:00:26+00:00,"Do you know how the McCloud judgment will impact on your NHS pension? Are you clear what actions you need to take, and by when? Tune in to our webinar on 4 May for a special briefing by @ChasedeVereMed. Book now: https://t.co/GmpMoJ2aYN https://t.co/UVs5HpzfAU","{'neg': 0.0, 'neu': 0.873, 'pos': 0.127, 'compound': 0.6868}",0.6868
1388418003713282051,2021-05-01 09:00:22+00:00,"To mark #MentalHealthAwarenessWeek later this month, we are hosting a webinar on wellbeing on 12 May. Join us to hear about the support available as surgeons face challenges ahead. Book here: https://t.co/qWmzvVQZxc https://t.co/MiWaAytLDz","{'neg': 0.0, 'neu': 0.824, 'pos': 0.176, 'compound': 0.6369}",0.6369
1388160090000211971,2021-04-30 15:55:30+00:00,"We are deeply saddened by the situation unfolding in India. If you can, please donate to @BAPIOUK's COVID fund to help provide more support &amp; resources for those on the ground. Our thoughts are with our members, colleagues, friends and family in India. https://t.co/JSz7PDg2lZ https://t.co/VdQVO0othp","{'neg': 0.067, 'neu': 0.73, 'pos': 0.202, 'compound': 0.7506}",0.7506
1388131877089914882,2021-04-30 14:03:24+00:00,@ped_sidsel @DrAllyCat @MelaninMedics Thanks for letting us know Sidsel. It has been amended on our website: https://t.co/jkdOC5Tmw7,"{'neg': 0.0, 'neu': 0.847, 'pos': 0.153, 'compound': 0.4404}",0.4404
1388093323085336576,2021-04-30 11:30:12+00:00,"We are looking for a clinical lead, working group members, and advisors to help us redevelop content and resources for our popular courses, including the hugely successful CCrISP programme.  Find more out about the roles and how to apply here: https://t.co/EVunJl2n2t https://t.co/tS0V3qwjIc","{'neg': 0.0, 'neu': 0.798, 'pos': 0.202, 'compound': 0.8622}",0.8622
1388076926695317510,2021-04-30 10:25:03+00:00,"How do gender diverse people experience our health system? In the new episode of our podcast made in collaboration with @MelaninMedics, @DrAllyCat advocates for a curriculum that covers #LGBTQ+ healthcare. Listen now: https://t.co/1M3HyRo6qn https://t.co/tzgcH4TTvm","{'neg': 0.0, 'neu': 1.0, 'pos': 0.0, 'compound': 0.0}",0.0
1387771181185519622,2021-04-29 14:10:07+00:00,"Managing disruptive behaviours involves difficult conversations with testing individuals. In our new Good Practice Guide, we offer various models for intervention. Discover now: https://t.co/CSnnjpeHsK https://t.co/1xMEFOTBTI","{'neg': 0.162, 'neu': 0.741, 'pos': 0.098, 'compound': -0.2263}",-0.2263
1387735881470066688,2021-04-29 11:49:51+00:00,@ExeterMed @Viktorija__K @UniofExeterNews @UniExeCornwall Congratulations @Viktorija__K!,"{'neg': 0.0, 'neu': 0.544, 'pos': 0.456, 'compound': 0.636}",0.636
1387472806015868939,2021-04-28 18:24:29+00:00,"LIVE: We can extend the lifespan of reusables through repairing them! For example, 1 reusable scissor can be reused 40 times and repaired 9 times offsite✂️","{'neg': 0.0, 'neu': 0.92, 'pos': 0.08, 'compound': 0.2481}",0.2481
1387471035579224073,2021-04-28 18:17:27+00:00,LIVE: Did you know that 101 pieces of single-use plastic are used in a single adenotonsillectomy? @chantelle_rizan ♻️🌎,"{'neg': 0.0, 'neu': 1.0, 'pos': 0.0, 'compound': 0.0}",0.0
1387469420562419717,2021-04-28 18:11:02+00:00,LIVE: have you tuned into our disposable vs. reusable webinar? Our sustainability in surgery group are speaking now about the changes that we need to make in order to look after our planet. https://t.co/hfRVzMibDd,"{'neg': 0.0, 'neu': 1.0, 'pos': 0.0, 'compound': 0.0}",0.0
1387406475014852611,2021-04-28 14:00:55+00:00,"Join us and run for research! Starting with #ASICSLDN10K this July, every step you take and penny you raise helps us advance patient care and surgical research: https://t.co/xUJQf0iQOW https://t.co/cARPB1oz7D","{'neg': 0.0, 'neu': 0.758, 'pos': 0.242, 'compound': 0.807}",0.807
1387365998748123136,2021-04-28 11:20:04+00:00,Calling all surgeons! Last chance to register for our #RCSWebinar on sustainability in surgery and the disposable vs. reusable materials debate. If you are interested in finding new and sustainable ways to improve your surgical skills tune in at 7pm. https://t.co/yObBE5YF3Q https://t.co/yQfICJNB48,"{'neg': 0.0, 'neu': 0.832, 'pos': 0.168, 'compound': 0.784}",0.784
1387039956489576454,2021-04-27 13:44:30+00:00,"Have you completed this year's national training survey? We encourage as many trainees and trainers as possible to take part. The survey closes on Tuesday 18 May, have your voice heard! https://t.co/Ax8lEWfQYU","{'neg': 0.0, 'neu': 0.896, 'pos': 0.104, 'compound': 0.5562}",0.5562
1386998728041639938,2021-04-27 11:00:40+00:00,"We can’t wait to welcome you back to our newly refurbished library! Even if you can’t join us in person you can access everything you need from our Surgical Library and Heritage Collections online. Anytime, anywhere: https://t.co/ppAMRPgHrF https://t.co/h8fkoVZIyW","{'neg': 0.0, 'neu': 0.868, 'pos': 0.132, 'compound': 0.6696}",0.6696
1386611017375944707,2021-04-26 09:20:03+00:00,Our commitment to supporting surgery includes developing educators. Training the Trainers and Excellence in Surgical Supervision enhance your skills in these roles so you can help trainees progress their careers. Find out more: https://t.co/TTujFJ7Zo5 https://t.co/YVppJecjCG,"{'neg': 0.0, 'neu': 0.661, 'pos': 0.339, 'compound': 0.9367}",0.9367
1385604322117947394,2021-04-23 14:39:48+00:00,"@SpeareRuth @rcgp @RCPLondon @FPH @RCollEM @Medact Hi Ruth. We’ve already taken action on our portfolio and plan to adopt an ethical investment policy soon. This policy, along with our new strategy, will enable us to be at the forefront of positive environmental change within the UK health and care system.","{'neg': 0.0, 'neu': 0.796, 'pos': 0.204, 'compound': 0.8957}",0.8957
