id,created_at,text,scores,compound
1305520442514472961,2020-09-14 14:55:03+00:00,"Champions of #diversity are among experts on the panel of our review. They are: Lord Ribeiro, Prof Averil Mansfield, @samanthatross, @GeorgetteOni, @Tlmcampbell1, @ShafiAhmed5, @_JoshBurke_, @DrFBE, @WestM61, @VictoriaPegna &amp; Kathryn Harley. Find out more: https://t.co/qSv9vvluo2 https://t.co/l2w8ghNAmD","{'neg': 0.0, 'neu': 0.909, 'pos': 0.091, 'compound': 0.5267}",0.5267
1304782010091700226,2020-09-12 14:00:47+00:00,"Do you want to be the first to find out about the future of robotics and surgery? Join @mortensen_neil, Richard Kerr, @Bach_Surgeon and @naeemsoomro for our webinar on Wednesday 16 September as they introduce our new exciting initiative. Book now: https://t.co/RRfVxP85VM https://t.co/NF8MhYH65L","{'neg': 0.0, 'neu': 0.853, 'pos': 0.147, 'compound': 0.6908}",0.6908
1304759252402212864,2020-09-12 12:30:21+00:00,"In our new Trainees’ Bulletin, @IanFarr56366377 and @SarahDuff3 delve into the differences in research requirements for CCT across each specialty. Is there a reason behind the inconsistencies? Find out here: https://t.co/hmkKJbfgPp #WithYouThroughout https://t.co/reXDyhinsK","{'neg': 0.0, 'neu': 1.0, 'pos': 0.0, 'compound': 0.0}",0.0
1304736622978760704,2020-09-12 11:00:26+00:00,Regional Representatives for the RCS will be participating in a month-long series of virtual webinars &amp; workshops this November. Themes include #sustainability #wellbeing &amp; the future of surgical training. Find out more &amp; sign up for the sessions here: https://t.co/hU0C6kA2Vz https://t.co/7jlmlw8AnS,"{'neg': 0.0, 'neu': 1.0, 'pos': 0.0, 'compound': 0.0}",0.0
1304401200750702595,2020-09-11 12:47:35+00:00,@mrsjuliaspencer Congratulations Julia 🎉,"{'neg': 0.0, 'neu': 0.339, 'pos': 0.661, 'compound': 0.5994}",0.5994
1304379182907109377,2020-09-11 11:20:06+00:00,Our September Bulletin sees changes to the Editorial Board as we welcome @JMG_urology as our Editor-in-Chief and @keogh_ken as our Editor. You can read Ken’s poignant take on #wellbeing and #burnout in surgery here: https://t.co/FNABso19A2 https://t.co/5WzgEH1FS8,"{'neg': 0.0, 'neu': 0.921, 'pos': 0.079, 'compound': 0.4588}",0.4588
1304340177410838528,2020-09-11 08:45:06+00:00,"In his first Bulletin piece as President, @mortensen_neil examines living in a virtual world and reiterates his powerful declaration to the College. Read the full article here: https://t.co/Z1AsdLZRFG https://t.co/vw4z9aLmPq","{'neg': 0.0, 'neu': 0.906, 'pos': 0.094, 'compound': 0.4215}",0.4215
1304087346921508864,2020-09-10 16:00:26+00:00,"Next Wednesday’s free #RCSwebinar will introduce our new RCS robotics group and the RADAR initiative. Join us at 6pm to discuss at how robotics and digital surgery will influence surgical practice and training in years to come.
Register here: https://t.co/kVazbFRNTO https://t.co/et3di57qEF","{'neg': 0.0, 'neu': 0.876, 'pos': 0.124, 'compound': 0.6705}",0.6705
1304062099371548673,2020-09-10 14:20:07+00:00,"Comment from @mortensen_neil  on today's hospital waiting figures. ""Flu, together with continuing local Covid outbreaks, must not bring surgery to a standstill again, or thousands more will suffer.”

https://t.co/zWcbehkOji","{'neg': 0.0, 'neu': 1.0, 'pos': 0.0, 'compound': 0.0}",0.0
1304058331422699520,2020-09-10 14:05:09+00:00,"Inside this month’s Bulletin, you can find resources available to support surgeons’ wellbeing in the workplace. Share the advice with someone who might need it this #SuicidePreventionDay: https://t.co/UyQLige5UD https://t.co/Pl8Hah8riJ","{'neg': 0.0, 'neu': 0.846, 'pos': 0.154, 'compound': 0.5994}",0.5994
1304056426877407233,2020-09-10 13:57:35+00:00,read @RCSnews comment in @bbchealth  on the worst waiting times on record. https://t.co/lWFJRCTpTi,"{'neg': 0.255, 'neu': 0.745, 'pos': 0.0, 'compound': -0.6249}",-0.6249
1304053919681843205,2020-09-10 13:47:37+00:00,"Commenting on the worst waiting times on record, Prof Mortensen said: ""We urgently need to build up our hospital reserves if we are to see this winter through."" Get the full story here https://t.co/tgZeu5odII.","{'neg': 0.111, 'neu': 0.889, 'pos': 0.0, 'compound': -0.6249}",-0.6249
1304007947555688448,2020-09-10 10:44:56+00:00,"Today is #SuicidePreventionDay. Please take a moment to check in on your mental health. And if you or someone you know needs to talk, please call our 24/7 confidential support helpline. #KindnessMatters ❤️: https://t.co/k9ATDIG8gf https://t.co/RTRDGOe7Ei","{'neg': 0.0, 'neu': 0.809, 'pos': 0.191, 'compound': 0.743}",0.743
1303984071547195394,2020-09-10 09:10:04+00:00,‘The future of research is collaborative and the ongoing successes of pan-surgical networks will continue to prove this.’ Read the article by @kennethmclean92 and @Tom_Drake1 @NRC_Collaborate in the new Trainees’ Bulletin here: https://t.co/TgYX88NMLd #WithYouThroughout https://t.co/xLpN273SQL,"{'neg': 0.0, 'neu': 0.904, 'pos': 0.096, 'compound': 0.5574}",0.5574
1303927220667404289,2020-09-10 05:24:09+00:00,"Thank you Zarina! For anyone who missed last nights webinar on #sustainability and the surgical supply chain, it will be online later today ✅ https://t.co/uCpp4x9wrI","{'neg': 0.082, 'neu': 0.815, 'pos': 0.103, 'compound': 0.1511}",0.1511
1303752731170156546,2020-09-09 17:50:48+00:00,‘There are opportunities for change in the supply chain... it’s a work in progress. More of us need to start thinking about this issue and asking the right questions’ - Professor Mahmood Bhutta,"{'neg': 0.0, 'neu': 0.843, 'pos': 0.157, 'compound': 0.6597}",0.6597
1303748868283281414,2020-09-09 17:35:27+00:00,"Professor Mahmood Bhutta is now talking about the surgical supply chain, including the poor conditions and pay for those working in factories and the worrying health effects of the substances and tools they use on a daily basis.","{'neg': 0.169, 'neu': 0.831, 'pos': 0.0, 'compound': -0.7096}",-0.7096
1303746696854286336,2020-09-09 17:26:49+00:00,‘We can all play a role in improving #sustainability in surgery through multiple small acts’ @chantelle_rizan,"{'neg': 0.0, 'neu': 0.714, 'pos': 0.286, 'compound': 0.6369}",0.6369
1303745255154438144,2020-09-09 17:21:05+00:00,‘The majority of the time reusable items have a lower carbon footprint - we should aim to use these where appropriate’ @chantelle_rizan ♻️,"{'neg': 0.099, 'neu': 0.901, 'pos': 0.0, 'compound': -0.296}",-0.296
1303742915164934144,2020-09-09 17:11:48+00:00,‘Operating theatres are one of the most resource intensive areas of hospitals...’ @chantelle_rizan is currently highlighting the environmental impact of surgery and surgical services #Sustainability,"{'neg': 0.0, 'neu': 1.0, 'pos': 0.0, 'compound': 0.0}",0.0
1303741534869893121,2020-09-09 17:06:18+00:00,And we are LIVE with @mortensen_neil @svig2 @VictoriaPegna @PRCSEd @chantelle_rizan &amp; Professor Bhutta discussing #sustainability in surgery ♻️,"{'neg': 0.0, 'neu': 1.0, 'pos': 0.0, 'compound': 0.0}",0.0
1303649716748595200,2020-09-09 11:01:27+00:00,"Calling all surgeons! Last chance to register for our #RCSWebinar ‘The importance of sustainability in the surgical profession’ with @RCSEd tonight. If you are interested in finding new and sustainable ways to improve your surgical skills, tune in at 6pm: https://t.co/VANGqGgZt4 https://t.co/TC4a4gKGsh","{'neg': 0.0, 'neu': 0.785, 'pos': 0.215, 'compound': 0.8553}",0.8553
1303614137759682560,2020-09-09 08:40:05+00:00,Can social media contribute to surgical training? @juliomayol thinks so. Find out how the digital age is influencing trainees' mind maps and developing surgeons' capabilities in our Trainees’ Bulletin: https://t.co/NlyR2JFy9O #WithYouThroughout https://t.co/ZqWD2as4IU,"{'neg': 0.0, 'neu': 1.0, 'pos': 0.0, 'compound': 0.0}",0.0
1303334808337121281,2020-09-08 14:10:07+00:00,"In the new Trainees’ Bulletin, we offer three perspectives with a common aim: how to reshape the design of breast training to support best surgical practice. Join the discussion with G Weston-Petrides, BG Baker and @DominicMSummers: https://t.co/8gtSz6tCQf #WithYouThroughout https://t.co/o5PLcu55aR","{'neg': 0.0, 'neu': 0.789, 'pos': 0.211, 'compound': 0.8442}",0.8442
1303319700751908865,2020-09-08 13:10:05+00:00,The presidents of the four surgical Royal Colleges have welcomed the agreement to offer surgeons in training teaching and learning opportunities in the private sector. Read our full statement: https://t.co/p008hIsZAw https://t.co/ILtImObiKG,"{'neg': 0.0, 'neu': 0.773, 'pos': 0.227, 'compound': 0.802}",0.802
1303294156857581568,2020-09-08 11:28:35+00:00,"📢 Only one day left to fill in our Faculty of Dental Surgery's survey on the resumption of dental services in England! 

⏰ Make sure to share your experiences before 23:55 BST Wed 9 Sep to inform our meetings with NHS and gov.

📝 Take the survey now at: https://t.co/dqffjr6JJ5 https://t.co/ZuGu1xuuit","{'neg': 0.0, 'neu': 0.904, 'pos': 0.096, 'compound': 0.5848}",0.5848
1302941446710980609,2020-09-07 12:07:03+00:00,"We must prioritise the establishment of COVID-light facilities to make sure that a potential #secondwave of COVID-19 does not disrupt planned surgery again in the winter, says RCS England President @mortensen_neil in @guardian: https://t.co/B2gMYLRNHr","{'neg': 0.0, 'neu': 0.933, 'pos': 0.067, 'compound': 0.3182}",0.3182
1302937021460213761,2020-09-07 11:49:27+00:00,"@ShanYasinMian Hello, we're so sorry we haven't responded during this busy time. We are doing our best to deal with high volumes of exam queries. Please check your Twitter inbox for an update.","{'neg': 0.046, 'neu': 0.784, 'pos': 0.17, 'compound': 0.6964}",0.6964
1302894566232780805,2020-09-07 09:00:45+00:00,"Do you want to learn about the latest sustainability advancements in the field of surgery? Tune in to our new #RCSWebinar on Wednesday 9 September at 6pm as our expert panel discuss the global efforts to enact policy to create real change in this area.

https://t.co/NmZASEluOh https://t.co/0StoqbYy36","{'neg': 0.0, 'neu': 0.928, 'pos': 0.072, 'compound': 0.34}",0.34
1302231291295928321,2020-09-05 13:05:08+00:00,How can we move beyond platitudes to deliver meaningful change on race inequality in healthcare? Abdul Badran et al examine in the feature article for our new Trainees’ Bulletin. Join as a member today to get the next issue in the post: https://t.co/Fn2uNiUkI6 #WithYouThroughout https://t.co/YmuvmLTS5k,"{'neg': 0.0, 'neu': 0.903, 'pos': 0.097, 'compound': 0.5423}",0.5423
1301838706182172672,2020-09-04 11:05:09+00:00,Not being selected via the national selection is undoubtedly disappointing. But Sophie Rintoul-Hoad @urologytrainee is certain that you can bounce back stronger. Find out how in her article for the Trainees' Bulletin: https://t.co/3KumO6pWQA  #WithYouThroughout https://t.co/c5HbduPj6d,"{'neg': 0.052, 'neu': 0.797, 'pos': 0.151, 'compound': 0.6059}",0.6059
1301514216814280711,2020-09-03 13:35:44+00:00,We are honoured to have been invited by NHS #Wales to teach our Definitive Surgical Trauma Skills (DSTS) course at their new major trauma centre in Cardiff. Find out more about this #SurgicalEducation course: https://t.co/MUpd2QpsfF https://t.co/5jRsM6ya6F,"{'neg': 0.134, 'neu': 0.789, 'pos': 0.077, 'compound': -0.34}",-0.34
1301459980676214784,2020-09-03 10:00:14+00:00,"Are you interested in finding new and sustainable ways to improve your surgical skills? Join us on Wednesday 9 September for our latest #RCSWebinar in collaboration with @RCSEd to explore sustainability further and ask your questions to our expert panel. 

https://t.co/somkgaBdRY https://t.co/BGEU6p9g0g","{'neg': 0.0, 'neu': 0.83, 'pos': 0.17, 'compound': 0.7783}",0.7783
1301458638255595522,2020-09-03 09:54:53+00:00,"@harmankhatkar1 Hello Harman, sorry we haven't responded during this busy time. Please check your Twitter inbox for an update.","{'neg': 0.063, 'neu': 0.825, 'pos': 0.112, 'compound': 0.25}",0.25
1301233596569661440,2020-09-02 19:00:39+00:00,"Calling all surgeons! Following on from tonight’s sustainability webinar, please complete the @SusHealthcare &amp; help us to understand the sustainability behaviours, attitudes &amp; practice of surgeons. Have your voice heard now! @RCSEd @asit
https://t.co/tTtlvn8GLM https://t.co/Ce5NW7X2dT","{'neg': 0.0, 'neu': 0.855, 'pos': 0.145, 'compound': 0.6792}",0.6792
1301192395992727554,2020-09-02 16:16:56+00:00,"Our Faculty of Dental Surgery want to hear your views on the resumption of dental services in England, but you only have one week until the survey closes! Let the FDS know your experiences of delivering dental and oral care since 8 June at: https://t.co/nsrxkAExnC https://t.co/FuoBkJjOVj","{'neg': 0.0, 'neu': 0.882, 'pos': 0.118, 'compound': 0.6948}",0.6948
1301178501773623296,2020-09-02 15:21:44+00:00,The @London_Surgery symposium brings together experts on surgical innovation and advances in general surgery to discuss surgical education and quality assurance.  This year's event will be taking place online on 22 September #LSS2020. Register for free: https://t.co/AgSnneU8IQ https://t.co/kjDRwASQhC,"{'neg': 0.0, 'neu': 0.808, 'pos': 0.192, 'compound': 0.8074}",0.8074
1301112827097346048,2020-09-02 11:00:46+00:00,"Last chance to register for our #RCSWebinar ‘Navigating an academic career pathway’ tonight at 6pm! Join our panel Rachel Hargest, Dileep Lobo and @NatalieBlencowe to hear first hand experiences of the various academic pathways into surgery.

https://t.co/4nH8kwCcpL https://t.co/YwrqbSzLnv","{'neg': 0.0, 'neu': 0.82, 'pos': 0.18, 'compound': 0.7712}",0.7712
1301102585378738178,2020-09-02 10:20:04+00:00,What impact has #COVID19 had on senior trainees close to obtaining their CCT? Rumina Begum and @bota_uk President Tricia Campbell discuss changes to ARCPs and #FRCS exam dates in the new issue of the Trainees’ Bulletin: https://t.co/jskFWWC1Oy #WithYouThroughout https://t.co/4B0ANUwy2G,"{'neg': 0.0, 'neu': 1.0, 'pos': 0.0, 'compound': 0.0}",0.0
1301073878886813697,2020-09-02 08:26:00+00:00,"@waelkouider1 Hello, we're sorry we have not responded during this busy time. Please check your inbox on Twitter for an update.","{'neg': 0.058, 'neu': 0.841, 'pos': 0.102, 'compound': 0.25}",0.25
1301072178914439170,2020-09-02 08:19:14+00:00,"Richard Johnson, our Director in Wales, spoke to @WalesOnline this week: ""We would like the Welsh Government to do some demand and capacity planning.  We need a long-term plan of how we are going to reduce these elective surgeries. ""

https://t.co/efYyy9JgkC","{'neg': 0.037, 'neu': 0.902, 'pos': 0.061, 'compound': 0.25}",0.25
1300811926180593665,2020-09-01 15:05:05+00:00,"Despite all the uncertainty created by COVID-19, one thing is for sure: #NoTrainingTodayNoSurgeonsTomorrow. Read Surgical Director @Schoolofsurg Jon Lund’s article in the new issue of the Trainees’ Bulletin and join the debate using #WithYouThroughout: https://t.co/UBksjJiDYl https://t.co/uuMPEmBjq6","{'neg': 0.0, 'neu': 0.789, 'pos': 0.211, 'compound': 0.7605}",0.7605
1300715026517549056,2020-09-01 08:40:03+00:00,"The second edition of the Trainees’ Bulletin is out today! In his column, editor and @ASiTofficial president @_JoshBurke_ highlights the impact of #COVID19 on training and reflects on pre-pandemic training issues. Read it now: https://t.co/Fige94SCfl #WithYouThroughout https://t.co/DAkujtRD1e","{'neg': 0.0, 'neu': 1.0, 'pos': 0.0, 'compound': 0.0}",0.0
1299612357019275264,2020-08-29 07:38:26+00:00,"Listen to our President @mortensen_neil on https://t.co/6fMF5eWEvs this morning 07.55am discuss the importance of getting orthopaedic, ENT and other vital surgery back online. @BritOrthopaedic @ENT_UK","{'neg': 0.0, 'neu': 0.83, 'pos': 0.17, 'compound': 0.5719}",0.5719
1299404719157383169,2020-08-28 17:53:21+00:00,"‘Somehow we will do it’. This sentiment is echoed by our President @mortensen_neil in the upcoming September issue of our Trainees’ Bulletin, launching next week #CareersInSurgery https://t.co/EN1ao6KLK3","{'neg': 0.0, 'neu': 1.0, 'pos': 0.0, 'compound': 0.0}",0.0
1299401297557413891,2020-08-28 17:39:45+00:00,Don’t forget to share your experiences to help the Centre for Sustainable Healthcare understand the barriers that prevent sustainable surgical practice #Sustainability #Surgery ♻️ https://t.co/ZFsS0vIPTC,"{'neg': 0.066, 'neu': 0.727, 'pos': 0.208, 'compound': 0.4767}",0.4767
1299296816777908225,2020-08-28 10:44:35+00:00,"@CloughMed Hello Reece, we're sorry we have not responded yet. Please check your Twitter inbox for an update.","{'neg': 0.169, 'neu': 0.831, 'pos': 0.0, 'compound': -0.3098}",-0.3098
1299295957956341761,2020-08-28 10:41:10+00:00,"@Zainabbzr Hello Zainab, we're sorry we have not responded yet. Please check your Twitter inbox for an update.","{'neg': 0.169, 'neu': 0.831, 'pos': 0.0, 'compound': -0.3098}",-0.3098
1299292223121563653,2020-08-28 10:26:20+00:00,"Mark Taylor, our Director in Northern Ireland, spoke to @BBCTalkback  yesterday about the NI waiting figures: ""Surgeons are also advocates for their patients."" [Listen from 51:24 – 1:00:09]

https://t.co/wlH8QClAhk","{'neg': 0.0, 'neu': 1.0, 'pos': 0.0, 'compound': 0.0}",0.0
1299284101258772481,2020-08-28 09:54:03+00:00,Surgeons report that productivity in the #NHS is half of what it was before. Our President Prof @mortensen_neil told @Telegraph that the lack of routine testing was impeding ‘efforts to create Covid-free zones’. Read the front page news: https://t.co/oys0Pvwwgo,"{'neg': 0.056, 'neu': 0.894, 'pos': 0.051, 'compound': -0.0516}",-0.0516
1298989923060523008,2020-08-27 14:25:06+00:00,"Our special edition of the Bulletin written by trainees, for trainees is back! Ahead of our issue launch on 1 September, here’s a preview of our cover illustrated by the fantastic @TerouzP. Can you guess what it is? https://t.co/AMfJ48qtYZ","{'neg': 0.0, 'neu': 0.842, 'pos': 0.158, 'compound': 0.7644}",0.7644
1298956289528258560,2020-08-27 12:11:27+00:00,"@SurgicalTutor @DrFBE Hey, FYI the two sessions we announced yesterday will be in the evening but others will take place at different times of the day! We’ll be letting our reps know the details once they’re confirmed here: https://t.co/ykKsPDIPOy https://t.co/CVJn59TqU0","{'neg': 0.0, 'neu': 0.95, 'pos': 0.05, 'compound': 0.2636}",0.2636
1298930368536555520,2020-08-27 10:28:27+00:00,"Mr Mark Taylor,  our Director in Northern Ireland, responds to today's waiting times figures for NI: 

""We must prioritise setting up Covid-light sites so that surgery can continue through any further spike in infections.""
https://t.co/9yN1J7SQJr","{'neg': 0.0, 'neu': 1.0, 'pos': 0.0, 'compound': 0.0}",0.0
1298926274660970496,2020-08-27 10:12:11+00:00,"@June_Phillips1 Hi June, it certainly is. What a difference!","{'neg': 0.0, 'neu': 0.722, 'pos': 0.278, 'compound': 0.4003}",0.4003
1298923291126763520,2020-08-27 10:00:20+00:00,"Calling all medical students and trainees! Want to learn more about navigating an academic career pathway? Tune in to our new #RCSWebinar on 2 September with Rachel Hargest, Dileep Lobo and @NatalieBlencowe where they will be answering your questions.

https://t.co/k43fN07qTJ https://t.co/HtC5uAMELr","{'neg': 0.0, 'neu': 0.961, 'pos': 0.039, 'compound': 0.1511}",0.1511
1298917864339050496,2020-08-27 09:38:46+00:00,"@ahelsalmawy Hello Dr Elsalmawy, thanks for getting in touch. We have sent you a direct message on Twitter.","{'neg': 0.0, 'neu': 0.847, 'pos': 0.153, 'compound': 0.4404}",0.4404
1298712436879417349,2020-08-26 20:02:28+00:00,We are counting down the days until we can put John Hunter back into the heart of RCS England 💙 https://t.co/YKnyYhlERD,"{'neg': 0.0, 'neu': 1.0, 'pos': 0.0, 'compound': 0.0}",0.0
1298662952749469696,2020-08-26 16:45:50+00:00,Our flagship HQ is really starting to take shape! Our President Prof @mortensen_neil and Chief Executive @AReed57 have been on site for a visit today. The new staircase and Lumley Library are looking great 🚧 😍 https://t.co/b2H2BKBThp,"{'neg': 0.0, 'neu': 0.847, 'pos': 0.153, 'compound': 0.6996}",0.6996
1298546992025677825,2020-08-26 09:05:03+00:00,"How ready is the #NHS for a #secondwave? Our President Prof @mortensen_neil stressed the importance of COVID-light sites in last night’s @C4Dispatches, with @xandvt. Catch up on All 4: https://t.co/qFoiRSRNJC https://t.co/cEatBFCKsD","{'neg': 0.07, 'neu': 0.785, 'pos': 0.145, 'compound': 0.3818}",0.3818
1298353199942860800,2020-08-25 20:14:59+00:00,Our President Prof @mortensen_neil talked to @xandvt about the likelihood of a #secondwave in @C4Dispatches. Watch now! https://t.co/Q3GZBFEgv4,"{'neg': 0.0, 'neu': 1.0, 'pos': 0.0, 'compound': 0.0}",0.0
1298275311877001218,2020-08-25 15:05:29+00:00,Here’s a #sneakpeek of BTS in tonight’s @C4Dispatches documentary: how to avoid a second wave. @xandvt interviewed our President Prof @mortensen_neil to get his expert take on the situation. ⌚ 9pm: https://t.co/tuzWCbTWrv #secondwave https://t.co/6tdYSpHaKN,"{'neg': 0.068, 'neu': 0.932, 'pos': 0.0, 'compound': -0.296}",-0.296
1298263927843745798,2020-08-25 14:20:15+00:00,Are you preparing for your #MRCS exams? Get interactive with your revision with 3D anatomy learning tools such as Aclands Atlas of Human Anatomy and Visible Body. Free for our members: https://t.co/6UK68xnc5H https://t.co/NaWNOKwTfx,"{'neg': 0.0, 'neu': 0.907, 'pos': 0.093, 'compound': 0.5106}",0.5106
1298247589142437888,2020-08-25 13:15:20+00:00,"#AI is set to transform the #FutureofSurgery. But the human relationship between a surgeon and a patient remains ‘absolutely fundamental’, says Richard Kerr, chair of the RCS Commission on the Future of Surgery in @Telegraph: https://t.co/OFjnUVh3za","{'neg': 0.0, 'neu': 1.0, 'pos': 0.0, 'compound': 0.0}",0.0
1298218579209400320,2020-08-25 11:20:03+00:00,Do you know someone who deserves a national honour? Nominate a colleague so they can receive recognition for their contribution to surgery. Find out more: https://t.co/NwwB77pxCW https://t.co/jSQIVEitNv,"{'neg': 0.0, 'neu': 0.866, 'pos': 0.134, 'compound': 0.5719}",0.5719
1298208513454415872,2020-08-25 10:40:03+00:00,Book your #MRCS exams with us and you could save up to £512 on your first four years of membership. Bookings open now for the MRCS Part A in January: https://t.co/MpIQgOeGlK https://t.co/gwGOLXlBB9,"{'neg': 0.0, 'neu': 0.904, 'pos': 0.096, 'compound': 0.4939}",0.4939
1298206547659632640,2020-08-25 10:32:15+00:00,"@traumakhan @RCSEd Hi Mansoor, there is guidance from the @AoMRC on returning to work after absence, which is also applicable in this case: https://t.co/xlOZYMX9Q9","{'neg': 0.0, 'neu': 1.0, 'pos': 0.0, 'compound': 0.0}",0.0
1298191822947262465,2020-08-25 09:33:44+00:00,"@nhshero2 Hi, if you're struggling at work we suggest you call our confidential support helpline. If you have any other queries please send us a direct message on Twitter.","{'neg': 0.085, 'neu': 0.762, 'pos': 0.152, 'compound': 0.296}",0.296
1297888963366199296,2020-08-24 13:30:17+00:00,"It’s ok not to be ok. If you would like to speak to someone about the challenges you are facing at work or in your personal life, our expanded confidential support and advice service helpline is here to help 24 hours a day, 7 days a week: https://t.co/k9ATDIG8gf https://t.co/aTjpxNmQYE","{'neg': 0.0, 'neu': 0.746, 'pos': 0.254, 'compound': 0.891}",0.891
1297885140929204227,2020-08-24 13:15:05+00:00,"Chart from @NuffieldTrust shows patients waiting more than 18 weeks for planned treatment, by region:  https://t.co/zuqR6VVv2m","{'neg': 0.0, 'neu': 1.0, 'pos': 0.0, 'compound': 0.0}",0.0
1297867657820147712,2020-08-24 12:05:37+00:00,"@anonymousdr1992 Hi, due to current restrictions, we only require candidates to scan a copy of their documents and email that to us. You will find more information on the exam booking page.","{'neg': 0.0, 'neu': 1.0, 'pos': 0.0, 'compound': 0.0}",0.0
1296810688799813632,2020-08-21 14:05:36+00:00,How did a group of surgical consultants support the ICU during the peak of #COVID19? @SueClark16 and her co-authors argue that ‘there is clearly a role for surgeons in the ICU’ in our latest blog: https://t.co/csW8AdNys3 https://t.co/K1XwqloL0J,"{'neg': 0.06, 'neu': 0.804, 'pos': 0.136, 'compound': 0.4588}",0.4588
1296772720957566978,2020-08-21 11:34:44+00:00,"For our next podcast 🎧 series, we want to hear from you about what to cover on coping with adverse events and unexpected patient deaths. What strategies would you find useful? 🗣️","{'neg': 0.072, 'neu': 0.807, 'pos': 0.121, 'compound': 0.1779}",0.1779
1296743978503733248,2020-08-21 09:40:31+00:00,"Professor of Vascular Surgery, Frank Smith, talks about his plans to help improve training pathways and the overall training experience in this week’s #MeetRCSCouncil 🦅 You can watch the full video on our Instagram https://t.co/20tmNEqR6x https://t.co/D5bjfnj9X7","{'neg': 0.0, 'neu': 0.855, 'pos': 0.145, 'compound': 0.6808}",0.6808
1296456983755853826,2020-08-20 14:40:06+00:00,"We are looking for two Vascular Surgical Specialty Leads. Generously supported by @VSGBI and @CircFoundation, the two posts will develop effective clinical networks to deliver multi-centre studies. Read the full job description: https://t.co/aSXtLhS4uG https://t.co/2nlsGNW6hw","{'neg': 0.0, 'neu': 0.791, 'pos': 0.209, 'compound': 0.802}",0.802
1296389026509979650,2020-08-20 10:10:04+00:00,"Although #COVID19 brought @doctor_haneen’s surgical training to a halt, she is grateful for the experience. In our latest blog, she describes the ‘importance of learning skills outside of our specialty’: https://t.co/0rmVGHrLFY https://t.co/ehSwlJrW6f","{'neg': 0.0, 'neu': 0.909, 'pos': 0.091, 'compound': 0.4588}",0.4588
